id,name,title,score,subreddit,url,num_comments,selftext,author,num_crossposts,over_18,permalink,pinned,subreddit_type,link_flair_text,author_flair_text,total_awards_received,upvote_ratio,time_created,comment
g6lru7,t3_g6lru7,"For Indian Diaspora, Panic and Anger Over Trump’s Immigration Plans",77,india,https://www.nytimes.com/2020/04/22/world/asia/india-immigration-trump-coronavirus.html,42,,Jayyy100,0,False,/r/india/comments/g6lru7/for_indian_diaspora_panic_and_anger_over_trumps/,False,public,Policy/Economy,,0,0.89,2020-04-23 18:00:43,"  I wonder if there are any ""We support NRC CAA""  ""protestors"" among these. They must be happy, no?

They love Modi, and Trump is sending them back to India.

AHAHAHAHAHAHAHA. Most of these were present at Howdy Modi event. As ""Sabh Changa C"" in India, what is the problem, they can go and settle back Sorry I can't help but laugh at this one Why panic and anger? It should be their wet dream come to life, to be with the politicians and ideologies which most remotely funded and applauded. This is why right wing governments are not your friend. A conservative doesn't see whether you are Muslim,or Hindu or sikh..all he sees is your brown skin Hehehhehe

Ahahhahahh
Ahahah
Hahahhahahahhahahahhhahhaha

Lag laye laude >	Most of the 800,000 immigrants currently waiting for a green card are Indian citizens. Because of quotas that limit the number of workers from each country, Indians can expect to wait up to 50 years for a green card since their representation among immigrants is so high in the U"
g6lmo6,t3_g6lmo6,Government sets up 723 COVID-19 hospitals across country,3,india,http://newsonair.com/Main-News-Details.aspx?id=386423,1,,bookshearer,0,False,/r/india/comments/g6lmo6/government_sets_up_723_covid19_hospitals_across/,False,public,Coronavirus,,0,0.64,2020-04-23 17:50:06,"  Finally, some healthcare will come up."
g6l71c,t3_g6l71c,Lay off action,7,india,https://www.reddit.com/r/india/comments/g6l71c/lay_off_action/,37,"Hello people,
Our CEO called for a meeting and announced that they will have to let go off people and for the rest of them there will be 50% pay cut. Just a minute after the call, people who are laid off were removed from GitHub, AWS, Slack accounts and so forth. 

What is the next step that I can take here? 
What are my options? 
Any help/suggestions would mean a lot. 

TIA.

Edit: Looking for suggestions to handle this scenario with the current company (legal or any other step) and not more on looking for other jobs (yes I'd do that)",Jacklisa12,0,False,/r/india/comments/g6l71c/lay_off_action/,False,public,AskIndia,,0,0.7,2020-04-23 17:15:36,"  Can you share the name of the company? Best you can do is check the employment contract to see the clause about severance. But most small companies in India do not have such clauses. Downvote me to hell but what do you want exactly from the company? I think they have done the correct thing by informing the situation to their employees instead of going some other route and doing some political crap.

You cannot expect the owners and shareholders to sell themselves to keep paying employees they cannot afford.

Start looking at your options. I am not a lawyer but there should be legal options available to you. If more than one person is laid off than even better cos you can fight it together. Hopefully government also brings in some relief for people getting let go in sometime. For now i would say consult a few lawyers and discuss all your options and then wait and watch what happens and be ready to pounce when the time is right. Did they mention who would be laid off? Did they mention "
g6ljfk,t3_g6ljfk,Two lenses,2295,india,https://i.redd.it/xwabo3m67ku41.jpg,49,,sudden_dust,1,False,/r/india/comments/g6ljfk/two_lenses/,False,public,Politics,:snoo_shrug:,0,0.92,2020-04-23 17:43:09,"  They don't have to find hatred, they give birth to it. The Indian mainstream media has proven to be the biggest hate for profit racket. Because we hate each other. They just make money out of it. There is 0 news in what we see. Our media has 0 brains. I don't even see the news nowadays. Im not saying that they belong to a party or what not. But the news programs are so shit. They're not worth being thought of forget being on tv actually. [Source ](https://mobile.twitter.com/caricatured/status/1253250764870430725) It's all about TRP we are the fools who consume such content Mostly civilized, sensible and sane discussions till now. Thank you. 🙏🏽 Nowadays media focus on negativity more True even in this situation where whole world in close to death news channels are spreading hatred on the name of caste and religion [removed] Miss those times when we just had Doordarshan news as only popular news channel in 1990s and they presented news as facts and not verdicts. Can't be more apt ! Div"
g6lix4,t3_g6lix4,India gifts 23 tonnes of essential medicines to Nepal,83,india,https://www.thehindu.com/news/national/coronavirus-india-gifts-23-tonnes-of-essential-medicines-to-nepal/article31406850.ece,2,,bookshearer,0,False,/r/india/comments/g6lix4/india_gifts_23_tonnes_of_essential_medicines_to/,False,public,Coronavirus,,0,0.92,2020-04-23 17:42:10,  Hopefully it's just surplus that we won't need in the future. But conveniently forgets to fucking feed it's poor. Yay!
g6lej8,t3_g6lej8,"Indian Initiative to Fight COVID-19, Enhancing Natural Defense",0,india,http://pib.nic.in/newsite/PrintRelease.aspx?relid=202503,0,,bookshearer,0,False,/r/india/comments/g6lej8/indian_initiative_to_fight_covid19_enhancing/,False,public,Coronavirus,,0,0.33,2020-04-23 17:32:44, 
g6leed,t3_g6leed,Covid-19 relief: How India doesn’t count the poor as workers,15,india,https://www.newslaundry.com/2020/04/23/covid-19-relief-how-india-doesnt-count-the-poor-as-workers,1,,Dumma1729,0,False,/r/india/comments/g6leed/covid19_relief_how_india_doesnt_count_the_poor_as/,False,public,Policy/Economy,,0,0.8,2020-04-23 17:32:27,  Workers ? India doesn't count poor as people
g6lc5b,t3_g6lc5b,BBC Culture: The floral fabric that was banned,7,india,http://www.bbc.com/culture/story/20200420-the-cutesy-fabric-that-was-banned,0,,kanchudeep,0,False,/r/india/comments/g6lc5b/bbc_culture_the_floral_fabric_that_was_banned/,False,public,Non-Political,,0,0.82,2020-04-23 17:27:29, 
g6l93l,t3_g6l93l,India freezes salary rises for more than 11 million to combat coronavirus,12,india,https://in.reuters.com/article/health-coronavirus-india-wages/india-freezes-salary-rises-for-more-than-11-million-to-combat-coronavirus-idINKCN22512W?feedType=RSS&feedName=topNews,0,,bookshearer,0,False,/r/india/comments/g6l93l/india_freezes_salary_rises_for_more_than_11/,False,public,Coronavirus,,0,0.88,2020-04-23 17:20:30, 
g6l7hl,t3_g6l7hl,"As India’s Poor Demand Relief, Why Are Middle Classes Silent?",91,india,https://www.newsclick.in/India-Poor-Demand-Relief-Middle-Classes-Silent,25,,Dumma1729,0,False,/r/india/comments/g6l7hl/as_indias_poor_demand_relief_why_are_middle/,False,public,Coronavirus,,0,0.88,2020-04-23 17:16:33,"  Because as the great George Carlin once said - ""The upper class keeps all of the money, pays none of the taxes. The middle class pays all of the taxes, does all of the work. The poor are there just to scare the shit out of the middle class."" Middle class is used to getting fucked by government lol. Middle class is also suffering badly. No surity of jobs, salary cut, no relief from school fees, taxes. Everything is middle class responsibility? The middle class pays the most taxes, gets the least back, gets shafted by everyone and then gets guilt tripped as well. Because it's the fucking government's responsibility. Middle class is most fuckable whore from the lot ... come fuck n go ...😎 Cause half the people in middle class are saving money in this situation with no pressure from the family to go out in the weekends, spending money on shopping,eating out/ordering, movies, vacation,etc (assuming my definition of middle class being people who have taxable white collar income below 1 cr "
g6l6yh,t3_g6l6yh,Raksha Mantri Shri Rajnath Singh inaugurates DRDO developed Mobile Laboratory to test COVID19 samples,16,india,http://pib.nic.in/newsite/PrintRelease.aspx?relid=202504,0,,bookshearer,0,False,/r/india/comments/g6l6yh/raksha_mantri_shri_rajnath_singh_inaugurates_drdo/,False,public,Coronavirus,,0,0.79,2020-04-23 17:15:23, 
g6l6c1,t3_g6l6c1,Coronavirus: What India achieved in last 30 days of lockdown,6,india,https://www.indiatoday.in/india/story/coronavirus-what-india-achieved-in-last-30-days-of-lockdown-1670203-2020-04-23?utm_source=feedly,3,,bookshearer,0,False,/r/india/comments/g6l6c1/coronavirus_what_india_achieved_in_last_30_days/,False,public,Coronavirus,,0,0.87,2020-04-23 17:13:57,"  India is doing quite well. In past 30 days:

India has seen steady rise in infection across the country. During lock down.

Wasted away millions of Ruppes to cover up.

Incorrectly blame on minorties  instead of developing viable action plan.

Made false promises.

Mishandled any and all process which carelessly infected more citizens.

And actively  avoid taking any responsibility.

I am more scared of quarantine than the virus its self. Time will tell"
g6l17t,t3_g6l17t,"Running out of money, Actor Prakash Raj pledges to take loan to help people amid lockdown",350,india,https://newsd.in/running-out-of-money-actor-prakash-raj-pledges-to-take-loan-to-help-people-amid-lockdown/,30,,ThinkingIndian,1,False,/r/india/comments/g6l17t/running_out_of_money_actor_prakash_raj_pledges_to/,False,public,Coronavirus,,0,0.92,2020-04-23 17:02:47,"  A good actor and an even better human being. Chellam.. I love you da chellam Reading the headline, it seems he is running out of money. 🤔 I really don't understand why Bengaluru didn't vote for a good guy like him"
g6l0zm,t3_g6l0zm,"CAA: Protestors Forced Into Hiding, As UP Police Puts Bounty On Their Heads",210,india,https://www.huffingtonpost.in/entry/caa-varanasi-up-bjp_in_5e3cbb9ac5b6b70886fd0a2f,13,,StorySpiral,0,False,/r/india/comments/g6l0zm/caa_protestors_forced_into_hiding_as_up_police/,False,public,CAA-NRC-NPR,,0,0.88,2020-04-23 17:02:13,"  Protest used to be a, fundamental right till 2014 I put ₹2 bounty on Ajay Bisht This is from FEB 7th."
g6l0ts,t3_g6l0ts,"BJP spreading ‘communal prejudice and hatred’ even during COVID-19 pandemic, says Sonia Gandhi",56,india,https://www.thehindu.com/news/national/bjp-spreading-communal-prejudice-and-hatred-even-during-covid-19-pandemic-says-sonia-gandhi/article31412358.ece,2,,bookshearer,0,False,/r/india/comments/g6l0ts/bjp_spreading_communal_prejudice_and_hatred_even/,False,public,Politics,,0,0.74,2020-04-23 17:01:57, 
g6l0fn,t3_g6l0fn,BJP condemns attack on journalist Arnab Goswami,81,india,https://www.thehindu.com/news/national/bjp-condemns-attack-on-journalist-arnab-goswami/article31412897.ece,18,,bookshearer,0,False,/r/india/comments/g6l0fn/bjp_condemns_attack_on_journalist_arnab_goswami/,False,public,Politics,,0,0.81,2020-04-23 17:01:09,"  Only worry about journalists that serve their interest. Not saying anyone should be attacked, but it's maddening how on one hand journalists who speak against them can face legal actions but journalists who support fake news serving their interests get a pity party. Gauri Lankesh is still waiting on that condemnation. Hate it that this guys face is everywhere today. Agar Kisi ke kutte ko laat padegi to usko gussa to aayega hi. Appreciate that the party is condemning the attack on it's spokesperson Man I've seen journalist being attacked by BJP members and politicians, where's the condemnation there? BJP will definitely condemn first whenever it's about Goswami. It is time for the rest of the media to stop calling these anchors, 'journalists'. And they condemned it even before the story was out. Arrest and Target journalists who are critical and protect assholes like him. Chutiya hai yeh important nahi hai, humara ladka hai yeh important hai. inga adicha anga valikathaan seiyum jounra"
g6kztw,t3_g6kztw,Learning about Indian Taxation system and laws for both Personal and Business,0,india,https://www.reddit.com/r/india/comments/g6kztw/learning_about_indian_taxation_system_and_laws/,3,"I am talking about both personal and business (GST) taxes.

I can use sites like cleartax to look up specific terms but there so many that are not so well know. For example, Section 80C, 80D etc, input tax, set-off etc. How to save tax using Health Insurance etc.

How does GST work? How to register? How to pay taxes? Things to watch out for. Tips etc.

Is there a book or video series or any other resource to learn about Indian taxation system?",vedacam,0,False,/r/india/comments/g6kztw/learning_about_indian_taxation_system_and_laws/,False,public,AskIndia,,0,0.38,2020-04-23 16:59:46,"  I can be of help. What exactly is your end goal here? Are you starting a business or are you seeking advice to manage your personal finance? I'm in a similar situation with exactly the same question. Been designing stuff since 2015, recently started a plc."
g6kzdp,t3_g6kzdp,India’s private COVID-19 tests cost highest in South Asia; free in Bangladesh,14,india,https://caravanmagazine.in/health/india-private-covid-19-tests-cost-highest-in-south-asia-free-in-bangladesh,5,,Dumma1729,0,False,/r/india/comments/g6kzdp/indias_private_covid19_tests_cost_highest_in/,False,public,Coronavirus,,0,0.75,2020-04-23 16:58:41,  It also free in government hospitals where most of the tests are happening right now
g6ku1z,t3_g6ku1z,President approves ordinance making violence against doctors punishable offence,20,india,https://www.livemint.com/news/india/president-approves-ordinance-making-violence-against-doctors-punishable-offence-11587616074735.html,1,,shadilal_gharjode,0,False,/r/india/comments/g6ku1z/president_approves_ordinance_making_violence/,False,public,Non-Political,,0,0.96,2020-04-23 16:46:59,"  -	Acts of violence shall be punished with imprisonment of 3 months to 5 years and a fine of ₹50,000 to ₹2,00,000
-	In case of grievous injury, imprisonment term can be for up to 7 years, with a fine of ₹1,00,000 to ₹5,00,000"
g6kol7,t3_g6kol7,Earth Day 2020: How a group of citizens revived a British era lake in Salem,22,india,https://www.youtube.com/watch?v=ha10ruXo2BU,1,,eternaltyro,0,False,/r/india/comments/g6kol7/earth_day_2020_how_a_group_of_citizens_revived_a/,False,public,Non-Political,,0,1.0,2020-04-23 16:34:27,"  Just amazing!

>Salem Citizens Forum have revived two big lakes (58 acres and 40 acres), one ten kilometer stream, designed two temple tanks. All this completed in 1.5 crores!

So much for the 100s of crores the Government claims to spend on lake revival and still cannot do a good job."
g6ketl,t3_g6ketl,Ajit Pawar Urges Railway Ministry to Run Special Trains For Migrants in Maharashtra After Lockdown,50,india,https://www.india.com/news/india/ajit-pawar-urges-railway-ministry-to-run-special-trains-for-migrants-in-maharashtra-after-lockdown-4008857/,9,,Ib90,0,False,/r/india/comments/g6ketl/ajit_pawar_urges_railway_ministry_to_run_special/,False,public,Coronavirus,,0,0.93,2020-04-23 16:10:40,"  Its a curious thought from Dy.CM

You need migrants after lockdown. 

You want things returning to normal. If good chunk of people leave ,, there wont be going back to normal. 

So take care of every one who is needy."
g6kc95,t3_g6kc95,"COVID-19 worry in Delhi: 3.2 lakh living in ‘red’ zone, but only 5,600 tested",67,india,https://www.newindianexpress.com/cities/delhi/2020/apr/23/covid-19-worry-in-delhi-32-lakh-living-in-red-zone-but-only-5600-tested-2134119.html,1,,IAmMohit,0,False,/r/india/comments/g6kc95/covid19_worry_in_delhi_32_lakh_living_in_red_zone/,False,public,Coronavirus,Bigotry begets Bigotry,0,0.96,2020-04-23 16:04:04,"  Almost a dozen companies were given license/permission to manufacture the kits locally. Plus ICMR in early March said, ""we have unlimited supply of reagents"".

Are there any verifiable reports or data available as to what happened to all those indigenous manufacturers?"
g6kbym,t3_g6kbym,"Coronavirus Lockdown News: Amid Lockdown, 54 Migrants In Rajasthan Paint School As Thanks For Food",29,india,https://www.ndtv.com/india-news/coronavirus-lockdown-news-amid-lockdown-54-migrants-in-rajasthan-paint-school-as-thanks-for-food-2216867,0,,Tungstonanode,1,False,/r/india/comments/g6kbym/coronavirus_lockdown_news_amid_lockdown_54/,False,public,Coronavirus,,0,0.95,2020-04-23 16:03:21, 
g6k5op,t3_g6k5op,"Kubbra Sait laughs off attack on Arnab Goswami, wonders if he’s ‘a journalist or Roadies host’",197,india,https://www.freepressjournal.in/entertainment/bollywood/kubbra-sait-laughs-off-attack-on-arnab-goswami-wonders-if-hes-a-journalist-or-roadies-host?utm_campaign=fullarticle&utm_medium=referral&utm_source=inshorts,15,,sudden_dust,0,False,/r/india/comments/g6k5op/kubbra_sait_laughs_off_attack_on_arnab_goswami/,False,public,Politics,:snoo_shrug:,0,0.79,2020-04-23 15:47:33,"  Tweet from a non-celeb --> Whole fucking article. Roadie hai MC, BC, #&&!&,**!*!*# 

/s Wait ""free press journal"" has this kinds of articles

Naam se to hi fi lagta hai Why is this even news? Why reaction tweets. Hats off to Kubbra Sait more people need to call him out on this drama Not cool Kubbra.

Arnab maybe an asshole, but violence is not the way. Will pay top rupee to watch Doorknob on Roadies though."
g6k3e5,t3_g6k3e5,Hard for Elected Govt to Have 'Political Will' to Meet with Challenges of Reservation: SC,10,india,https://www.news18.com/news/india/hard-for-elected-govt-to-have-political-will-to-meet-with-challenges-of-reservation-sc-2589383.html,1,,Themistokles_7,0,False,/r/india/comments/g6k3e5/hard_for_elected_govt_to_have_political_will_to/,False,public,Politics,,0,0.82,2020-04-23 15:41:41,"  Shocker, a judiciary filled with upper caste men at the highest levels has snide remarks about having 'will to reform' reservations. The same group of judges who bend over for the government now talks about having 'will'

This is what one of the justices said when talking about STs (from the article)

>The formal education, by and large, failed to reach them, and they remained a disadvantaged class, as such required a helping hand to uplift them and to make them contribute to the national development and not to remain part of the primitive culture,"" it said.

Yes coming from those who are part of the advanced culture of Brahmins and upper castes who still practice a variant untouchability despite soap being a thing for 3-4000 years."
g6jzx1,t3_g6jzx1,Which is the best credit card provider?,3,india,https://www.reddit.com/r/india/comments/g6jzx1/which_is_the_best_credit_card_provider/,12,"Which banks have the best credit facility and eligibility criterias? I am a 21 year old salaried employee living in my parent's rented house.

I've had 0 credit cards or loans yet and looking to build my credit score.",thepixlguy,0,False,/r/india/comments/g6jzx1/which_is_the_best_credit_card_provider/,False,public,Non-Political,,0,0.64,2020-04-23 15:33:04,"  It depends on where you spend your money. If your spends are mostly online, then go for SBI simply click,  Axis Flipkart card or ICICI AMAZON Pay card. SBI Simply click : For Amazon vouchers and a lot of points from amazon.

ICICI Coral : good for movie tickets.

HDFC Regalia :  lounge access, vistara membership and 5-10% cashback nearly everywhere, and [more info here](https://www.hdfcbank.com/personal/pay/cards/credit-cards/regalia)

I personally use HDFC Regalia. The Amazon-ICICI card is a good one but I'm not sure if they are issuing them during this lockdown. The best credit card in india as per me is diners black. 

Biggest plus 

1. 10x(33% cashback) rewards on Amazon & Flipkart 

2. 10x(33% cashback) rewards on flight bookings 


Both of these combined , you can get upto Rs 15000 cashback every month

Plus they have diners 10x partners on which you get an extra cashback of upto Rs 10000. This list gets updated every few months. Notable names in the last 6 months include Ola &"
g6jv69,t3_g6jv69,"BJP spreading virus of communal hatred, prejudice during pandemic, says Sonia Gandhi",165,india,https://www.indiatoday.in/india/story/bjp-spreading-virus-of-communal-hatred-prejudice-during-pandemic-says-sonia-gandhi-1670079-2020-04-23,20,,Ib90,0,False,/r/india/comments/g6jv69/bjp_spreading_virus_of_communal_hatred_prejudice/,False,public,Politics,,0,0.82,2020-04-23 15:20:48,  Water is wet During pandemic? Absolutely true This bitch doesn't deserve to speak after what she did to Andhra Pradesh. Still alive?
g6juwk,t3_g6juwk,Covid-19: Mumbai man arrested for refusing to accept groceries from Muslim delivery agent,68,india,https://scroll.in/latest/960007/covid-19-mumbai-man-arrested-for-refusing-to-accept-groceries-from-muslim-delivery-agent?fbclid=IwAR2bFK3OmY1DKnPeI1uhH7WA2wROFm0x2icgRUTkrO_lwLJDhfKMmOrByiY,0,,sleepygamer92,0,False,/r/india/comments/g6juwk/covid19_mumbai_man_arrested_for_refusing_to/,False,public,Coronavirus,SAB CHANGA SI BHOSADWALO,0,0.83,2020-04-23 15:20:13, 
g6jlhj,t3_g6jlhj,"Finance Ministry freezes increment on DA, DR for central govt employees, pensioners",15,india,https://www.thehindu.com/news/national/finance-ministry-freezes-increment-on-da-dr-for-central-govt-employees-pensioners/article31413397.ece,0,,Desmund977,0,False,/r/india/comments/g6jlhj/finance_ministry_freezes_increment_on_da_dr_for/,False,public,Policy/Economy,,0,0.88,2020-04-23 14:56:15, 
g6jlun,t3_g6jlun,"Sir, Press freedom is in DANGER!",105,india,https://i.redd.it/4ry4l5ycdju41.jpg,4,,Neglectedsince1994,0,False,/r/india/comments/g6jlun/sir_press_freedom_is_in_danger/,False,public,Politics,The Imitation Game! :snoo_surprised:,0,0.86,2020-04-23 14:57:08,"  As long as we’re better than Pakistan, Sab changa si. Did Gau Swamy become victim of ""morning walks"" attack as a mistaken identity.  Source: [Satish Acharya](https://twitter.com/satishacharya/status/1253230028633985031)"
g6jfii,t3_g6jfii,How will small businesses handle further extension of lockdowns?,31,india,https://www.reddit.com/r/india/comments/g6jfii/how_will_small_businesses_handle_further/,5,"I asked the same in the live thread before being downvoted. For many in this sub owning a business is the deciding factor to a genuine question or a spoiled brat's complaints. but please hear me out on this.

What will the future hold for people in the lower-income middle-class bracket? Many small business owners are weekly earners (if that's a thing), they have bills, rents and EMI's to pay. Many have workers depending on them. 

If the lockdown is extended further, as many suggest, what will the future hold for these guys? They might have already exhausted their savings. 

I think we might see an increase in the rate of EMI defaulters, an increase in poverty and a cascading effect on all major economic sectors.",blind_organic_matter,0,False,/r/india/comments/g6jfii/how_will_small_businesses_handle_further/,False,public,Policy/Economy,,0,0.88,2020-04-23 14:41:11,"  The biggest problem are the Emi's though the relief has been given, INTEREST is still being charged. It is true that NPA's will increase and you may look at higher numbers of foreclosures and bankruptcies in the coming days. Not only small businesses, all businesses are affected by coronavirus. And new cheap loans are being planned in massive level.

Many as mentioned, will declare bankruptcy.

Unemployment will increase. 

Many people will be affected.

Stay safe and avoid credit. Many will close down.  Govt has mandated that factory owners to be responsible if any worker contracts corona virus! Who in their right mind will open factories now?

Many are seriously re-thinking continuation under these conditions( at least for some time).  Actively being discussed in their groups.  They will take a call after May 3. A neighbor uncle works for a CA in a financial firm in a company of some 50 people. His boss told him on Wednesday to fire 30 guys within the next 7 days and to shift all o"
g6jggc,t3_g6jggc,How does herd immunity work?,3,india,https://www.reddit.com/r/india/comments/g6jggc/how_does_herd_immunity_work/,4,"Does herd immunity mean that if half the population gets infected, the other half automatically becomes immune?
I am confused.",indiandude007,0,False,/r/india/comments/g6jggc/how_does_herd_immunity_work/,False,public,AskIndia,,0,0.67,2020-04-23 14:43:41,"  Trying my best bit to make sense of what I read some time back. 

Before you start with herd immunity you need to understand two things. Herd Threshold and R.zero factor.

Proportion of immune individuals in a sample set of population above which the disease cannot spread. This is defined as ""Herd Threshold"". Herd Threshold is dependent on the size of the population. Greater the population sample greater the number. 

""R.zero"" typical number of infections passed on by an infectious person. A measure of person to person transmission within herd/community.

When a person or a group of persons are part of an immune herd then the probability of spread depends on the Herd Threshold and the R.zero factor. Chances of an infection spread decrease within a community with larger density of immune people. This can protect those without immunity. People who are affected with the infection will be acting as barriers to spreaders. They may carry but won't spread.  In disease elimination this can b"
