id,parent_id,link_id,body,author,author_flair_text,author_fullname,permalink,created_utc,score,total_awards_received
fcqaaw9,t1_fcqa4de,t3_eidi5v,Yaar schrondinger solve karwa do na yaar,Timur_tomb_opener,,t2_4xi7bttt,/r/india/comments/eidi5v/random_daily_discussion_thread_january_01_2020_at/fcqaaw9/,1577882042,1,0
fcqad68,t1_fcpsyes,t3_ei69l1,Needs more saffron,Theyforgetmenots,,t2_urzoe8b,/r/india/comments/ei69l1/finally_superpower_2020_happy_new_year_everyone/fcqad68/,1577882080,1,0
fcqad80,t1_fcqa88w,t3_eidi5v,Ab 100 ka hogaya hain,Timur_tomb_opener,,t2_4xi7bttt,/r/india/comments/eidi5v/random_daily_discussion_thread_january_01_2020_at/fcqad80/,1577882081,1,0
fcqaehu,t1_fcqa88w,t3_eidi5v,"Shit mai konsa exam likh aaya fir jee mains ki jagah

 ༼⁰o⁰；༽",buntys-ancestor,there is no god,t2_4oo913yp,/r/india/comments/eidi5v/random_daily_discussion_thread_january_01_2020_at/fcqaehu/,1577882103,1,0
fcqaem1,t1_fcpathv,t3_eid66v,Idk what he does everyone has started working from home now.,Emwat1024,,t2_6qfi8,/r/india/comments/eid66v/hello_there_from_bangalore/fcqaem1/,1577882105,1,0
fcqaflu,t3_ei4vq6,t3_ei4vq6,"Excellent work man, being a software developer myself I am glad to see the dexterity with which you worked. If there is any help you need on the backend side, please reach out. I will be glad to work on this project",mhz_zhm,,t2_166yok6j,/r/india/comments/ei4vq6/twitterurbannazicom_report_you_have_been_waiting/fcqaflu/,1577882122,1,0
fcqafut,t3_eihfv4,t3_eihfv4,Gomutra rain,nickleloveday,,t2_58t4z8br,/r/india/comments/eihfv4/just_stepped_out_of_my_house_and_saw_this/fcqafut/,1577882126,1,0
fcqag43,t1_fcq81s1,t3_eif2ev,They stage riots to get in power and to make  the majority believe that they are under apparent threat from minorities,Spideyocd,India,t2_3kan7z92,/r/india/comments/eif2ev/old_report_from_november_2007_action_replay_a/fcqag43/,1577882131,1,0
fcqagfk,t1_fcq9s00,t3_eidi5v,bye,baburao87,,t2_5alimi4y,/r/india/comments/eidi5v/random_daily_discussion_thread_january_01_2020_at/fcqagfk/,1577882136,1,0
fcqagt0,t1_fcq9x9s,t3_eidi5v,But I'm maths teacher,easysleazzy,zeal is ze best,t2_4llbcvk1,/r/india/comments/eidi5v/random_daily_discussion_thread_january_01_2020_at/fcqagt0/,1577882143,1,0
fcqah27,t1_fcq9viv,t3_eidi5v,लिख के दे।,baburao87,,t2_5alimi4y,/r/india/comments/eidi5v/random_daily_discussion_thread_january_01_2020_at/fcqah27/,1577882147,1,0
fcqajnz,t1_fcq9x9s,t3_eidi5v,mujhe israel ke gal gadot chahiye,baburao87,,t2_5alimi4y,/r/india/comments/eidi5v/random_daily_discussion_thread_january_01_2020_at/fcqajnz/,1577882193,1,0
fcqajw1,t1_fcqad80,t3_eidi5v,Ab do exams hote Hain na? Ab Kya process hota h qualification ka? Average?,easysleazzy,zeal is ze best,t2_4llbcvk1,/r/india/comments/eidi5v/random_daily_discussion_thread_january_01_2020_at/fcqajw1/,1577882198,1,0
fcqakxy,t1_fcqaehu,t3_eidi5v,Top 10 anime twists,easysleazzy,zeal is ze best,t2_4llbcvk1,/r/india/comments/eidi5v/random_daily_discussion_thread_january_01_2020_at/fcqakxy/,1577882216,1,0
fcqal7q,t1_fcqah27,t3_eidi5v,काम धंधा ढूंढ लो इतनी बेरोजगारी इंसान को मार सकती है।,buntys-ancestor,there is no god,t2_4oo913yp,/r/india/comments/eidi5v/random_daily_discussion_thread_january_01_2020_at/fcqal7q/,1577882221,1,0
fcqalpf,t1_fcqajnz,t3_eidi5v,Mai uski abba thodi na hun,Leburnum,,t2_553bgnmr,/r/india/comments/eidi5v/random_daily_discussion_thread_january_01_2020_at/fcqalpf/,1577882229,1,0
fcqamd9,t1_fcqajw1,t3_eidi5v,Best of 2,Timur_tomb_opener,,t2_4xi7bttt,/r/india/comments/eidi5v/random_daily_discussion_thread_january_01_2020_at/fcqamd9/,1577882240,1,0
fcqaomc,t3_eihf5q,t3_eihf5q,We are building statues of cow mata and BJP leaders and by 2050 we will also have statues of Nathuram Godse.,Pulkistan,,t2_jjgec0t,/r/india/comments/eihf5q/by_2050_mumbai_and_chennai_will_be_under_water/fcqaomc/,1577882273,1,0
fcqapwt,t1_fcqalpf,t3_eidi5v,toh netanyahu tera abba hai jo tujhe jo chahiye de dega?,baburao87,,t2_5alimi4y,/r/india/comments/eidi5v/random_daily_discussion_thread_january_01_2020_at/fcqapwt/,1577882290,1,0
fcqaqam,t1_fcq10mo,t3_eidi5v,but hua kya?,GumnaamFlautist,🎶♋💦🎺,t2_582ef1p0,/r/india/comments/eidi5v/random_daily_discussion_thread_january_01_2020_at/fcqaqam/,1577882295,1,0
fcqar53,t1_fcpwuj3,t3_eid66v,I heard they are building the tallest sky scrapper at Marathahalli. Burj Marathahalli. !,nitie_dude,,t2_hv3yj2a,/r/india/comments/eid66v/hello_there_from_bangalore/fcqar53/,1577882307,1,0
fcqart9,t1_fcq9s00,t3_eidi5v,Kyun jaa rahe?,easysleazzy,zeal is ze best,t2_4llbcvk1,/r/india/comments/eidi5v/random_daily_discussion_thread_january_01_2020_at/fcqart9/,1577882316,1,0
fcqasg6,t1_fcqaehu,t3_eidi5v,Savita entrance exam,Leburnum,,t2_553bgnmr,/r/india/comments/eidi5v/random_daily_discussion_thread_january_01_2020_at/fcqasg6/,1577882325,1,0
fcqasop,t1_fcqal7q,t3_eidi5v,बेरोज़गारी से मरना इतना आसान होता तो बेरोज़गारी देखने को ही नहीं मिलती,baburao87,,t2_5alimi4y,/r/india/comments/eidi5v/random_daily_discussion_thread_january_01_2020_at/fcqasop/,1577882329,1,0
fcqastm,t3_eigzia,t3_eigzia,"It's not that the everyday urban common man doesn't know about the Kashmir issue and all the alleged atrocities committed by the Indian Army but it's the Indian media narrative, since a long time, justifying each and every atrocity is what keeps our countrymen from thinking of it as anything else other than the armed forces keeping an insurgency at check. 

There's a reason why the RW ecosystem and now Modi himself calls every educated and sane critical thinking citizen of this country an anti national/ urban naxal and the likes. They know that if the young population of this country actually starts listening and understanding any of the contentious issues this country faces there will be localized uprising in every state and the govt in power can not let that happen. Instead, delegitimizing the messenger is a better way to blunt the message itself. Kashmir is an issue which is not going to be solved in a long long time no matter which side of the political spectrum you stand on. Abrogation of 370 is not going to do much to keep the local population down which is already broken. There are a million articles online by reputed journalists stating how the Kashmiri population has sever mental issues because of the continued state of oppression and general feeling of repression. The ones who left the state thrived and are the voices speaking out but the local population is more or less beaten into depression. Which is what the state hoped for when they employed the multitudes of operations you have stated. 

Every country has their skeletons and we are no different. Kashmir is a corpse which refuses to turn into a skeleton. The body stinks and the world turns a blind eye. Take what you may out of it.",notanothervoice,,t2_5056b1vm,/r/india/comments/eigzia/do_we_owe_an_apology_to_kashmir/fcqastm/,1577882331,1,0
fcqatxq,t3_eihfv4,t3_eihfv4,This is possible because India is a superpower,I-dont-freaking-know,,t2_4dqwkj5b,/r/india/comments/eihfv4/just_stepped_out_of_my_house_and_saw_this/fcqatxq/,1577882348,1,0
fcqauj7,t1_fcq9tns,t3_eidi5v,"*You're tearing this family apart, Lisa!*",catwhamen,there's a storm coming Mr. Wayne,t2_58aq1244,/r/india/comments/eidi5v/random_daily_discussion_thread_january_01_2020_at/fcqauj7/,1577882356,1,0
fcqavi4,t1_fcq7mk1,t3_eidi5v,oranges &gt; apples?,GumnaamFlautist,🎶♋💦🎺,t2_582ef1p0,/r/india/comments/eidi5v/random_daily_discussion_thread_january_01_2020_at/fcqavi4/,1577882370,1,0
fcqaw6u,t1_fcq9p3n,t3_eidi5v,Rehne do. Kahi bhi nai le jaate ho. *Hmph*.,catwhamen,there's a storm coming Mr. Wayne,t2_58aq1244,/r/india/comments/eidi5v/random_daily_discussion_thread_january_01_2020_at/fcqaw6u/,1577882380,1,0
fcqawde,t1_fcqapwt,t3_eidi5v,Tees maar khan hu mai,Leburnum,,t2_553bgnmr,/r/india/comments/eidi5v/random_daily_discussion_thread_january_01_2020_at/fcqawde/,1577882383,1,0
fcqaytz,t1_fcqasg6,t3_eidi5v,*Ye kaafi difficult exam hai. Kaafi Kam log de paate hain*,easysleazzy,zeal is ze best,t2_4llbcvk1,/r/india/comments/eidi5v/random_daily_discussion_thread_january_01_2020_at/fcqaytz/,1577882420,1,0
fcqayuu,t1_fcqal7q,t3_eidi5v,Yaar likh ke de dona yaar,Timur_tomb_opener,,t2_4xi7bttt,/r/india/comments/eidi5v/random_daily_discussion_thread_january_01_2020_at/fcqayuu/,1577882420,1,0
fcqazr4,t3_eid66v,t3_eid66v,This is us with 5 trillion economy,akza07,,t2_wmwtxv9,/r/india/comments/eid66v/hello_there_from_bangalore/fcqazr4/,1577882434,1,0
fcqb0fx,t1_fcqawde,t3_eidi5v,और मै चाचा चौधरी,baburao87,,t2_5alimi4y,/r/india/comments/eidi5v/random_daily_discussion_thread_january_01_2020_at/fcqb0fx/,1577882444,1,0
fcqb14m,t1_fcqaytz,t3_eidi5v,Bohut hard work chahiye. ( ͡° ͜ʖ ͡°),Leburnum,,t2_553bgnmr,/r/india/comments/eidi5v/random_daily_discussion_thread_january_01_2020_at/fcqb14m/,1577882455,1,0
fcqb5tb,t3_eidi5v,t3_eidi5v,u/haggu_baby_bot nahi dikh raha. Seems like he's having a blast,easysleazzy,zeal is ze best,t2_4llbcvk1,/r/india/comments/eidi5v/random_daily_discussion_thread_january_01_2020_at/fcqb5tb/,1577882531,1,0
fcqb649,t3_eif5xl,t3_eif5xl,Gau rakshak kahan hai ?,I-dont-freaking-know,,t2_4dqwkj5b,/r/india/comments/eif5xl/hello_from_goa_was_surprised_to_see_so_much/fcqb649/,1577882536,1,0
fcqb6m8,t1_fcqamd9,t3_eidi5v,ab asli sapios kahenge humare zamane mei jee kuch aur hi hota tha. which is slightly true i guess. iirc 2016 was extremely tough.,baburao87,,t2_5alimi4y,/r/india/comments/eidi5v/random_daily_discussion_thread_january_01_2020_at/fcqb6m8/,1577882544,1,0
fcqb7mh,t1_fcpaxzk,t3_eid66v,"Ahmedabad was the most disappointing city ive been to. I was expecting something like Banglore or Gurugram. 
Honestly, well done to Modi for making a sub-standard city seem like first world to indian voters. Its a lie but he did a godd job spreading it.",HazKaz,,t2_36bra,/r/india/comments/eid66v/hello_there_from_bangalore/fcqb7mh/,1577882561,1,0
fcqb7pk,t1_fcqasg6,t3_eidi5v,Two circles of radius 15 cm are touching each other...,Timur_tomb_opener,,t2_4xi7bttt,/r/india/comments/eidi5v/random_daily_discussion_thread_january_01_2020_at/fcqb7pk/,1577882562,1,0
fcqb85d,t1_fcq7qx2,t3_eifhqy,What do you wanna know brother?,ab4328,,t2_xly81qd,/r/india/comments/eifhqy/started_the_new_year_like_a_normie_mains_on_7th/fcqb85d/,1577882569,1,0
fcqb9cw,t1_fcqayuu,t3_eidi5v,"**Kart678 वापिस आएगा।**

लो अब इसकी पर्ची बना कर चुपके से गांड में डाल लो।",buntys-ancestor,there is no god,t2_4oo913yp,/r/india/comments/eidi5v/random_daily_discussion_thread_january_01_2020_at/fcqb9cw/,1577882589,1,0
fcqba91,t3_eihw05,t3_eihw05,"Asha Tai’s late daughter!

Pl mark it as  VERY OLD.",Indianopolice,,t2_ie9wf,/r/india/comments/eihw05/towards_balkanization_by_varsha_bhosle/fcqba91/,1577882604,1,0
fcqbafm,t1_fcqb7pk,t3_eidi5v,Bas pagle abhi preparation nhi h meri,Leburnum,,t2_553bgnmr,/r/india/comments/eidi5v/random_daily_discussion_thread_january_01_2020_at/fcqbafm/,1577882607,1,0
fcqbafo,t1_fcq2hjt,t3_eif5xl,Each comment here deserves gold.,TheMushiMan,,t2_twe5i,/r/india/comments/eif5xl/hello_from_goa_was_surprised_to_see_so_much/fcqbafo/,1577882607,1,0
fcqbara,t1_fcqb5tb,t3_eidi5v,"&gt; he's having a blast

Good one.",buntys-ancestor,there is no god,t2_4oo913yp,/r/india/comments/eidi5v/random_daily_discussion_thread_january_01_2020_at/fcqbara/,1577882613,1,0
fcqbc0v,t1_fcqba91,t3_eihw05,...not the same person,tarara_tarara,,t2_zk6cc,/r/india/comments/eihw05/towards_balkanization_by_varsha_bhosle/fcqbc0v/,1577882633,1,0
fcqbdih,t1_fcqb6m8,t3_eidi5v,Yep...2016&lt;2018&lt;2015&lt;2014&lt;2013&lt;2017,Timur_tomb_opener,,t2_4xi7bttt,/r/india/comments/eidi5v/random_daily_discussion_thread_january_01_2020_at/fcqbdih/,1577882659,1,0
fcqbe7v,t1_fcqasop,t3_eidi5v,क्या बात कही है बाबू भैया,easysleazzy,zeal is ze best,t2_4llbcvk1,/r/india/comments/eidi5v/random_daily_discussion_thread_january_01_2020_at/fcqbe7v/,1577882671,1,0
fcqbfe2,t3_eigzia,t3_eigzia,"The plight of Kashmiris is irrelevant.

What matters is that WE get to keep Kashmir away from Pakistan. That's all that matters.


If you think that was weird, well, Pakistanis too think the same about Kashmir &amp; Kashmiris.",DrMrJekyll,,t2_2rshe15e,/r/india/comments/eigzia/do_we_owe_an_apology_to_kashmir/fcqbfe2/,1577882691,1,0
fcqbfrt,t1_fcju4wk,t3_ehgepd,Bihari languages are pretty close to BOA. Maithili original script is similar to the Bengali and Assamese scripts too.,tfwalpha,,t2_c9ehj,/r/india/comments/ehgepd/the_indo_aryan_languages/fcqbfrt/,1577882698,1,0
fcqbgp0,t1_fcpx36o,t3_eigllv,"Oh, well, try to get close to those friends and see if they know anyone who could help? 
I probably sound like a dumbass rn, but if you don't already, start making connections with people. Whether it's friends, or friend's friends, or acquaintances who could help you in any way. You might even get not-so-bad jobs to support yourself.",CreepyAssassinCR33P,Kerala,t2_460p7las,/r/india/comments/eigllv/ok_i_feel_like_this_would_be_the_best_sub_for/fcqbgp0/,1577882712,1,0
fcqbgv3,t1_fcqb9cw,t3_eidi5v,Yaar parchi idhar bhejo na yaar,Timur_tomb_opener,,t2_4xi7bttt,/r/india/comments/eidi5v/random_daily_discussion_thread_january_01_2020_at/fcqbgv3/,1577882715,1,0
fcqbgv7,t3_eigzia,t3_eigzia,Big time.,DudeWheresThePorn,,t2_q04swp1,/r/india/comments/eigzia/do_we_owe_an_apology_to_kashmir/fcqbgv7/,1577882715,1,0
fcqbi9m,t1_fcqbc0v,t3_eihw05,"
?",Indianopolice,,t2_ie9wf,/r/india/comments/eihw05/towards_balkanization_by_varsha_bhosle/fcqbi9m/,1577882737,1,0
fcqbj6f,t1_fcpd8to,t3_eiemdm,Most unkills and aunties in 2020 travel via the help of quantum tunneling. Gone are the days of Bajaj scooters bois.,rehnedeyaar,,t2_54pi0zpz,/r/india/comments/eiemdm/woke_up_to_a_magnificent_view_of_pune_city_behind/fcqbj6f/,1577882751,1,0
fcqbj6t,t1_fcqbgv3,t3_eidi5v,*Sends parchi by bluedart™*,buntys-ancestor,there is no god,t2_4oo913yp,/r/india/comments/eidi5v/random_daily_discussion_thread_january_01_2020_at/fcqbj6t/,1577882751,1,0
fcqbjc6,t3_eigzia,t3_eigzia,Kashmir and North-east shouldn't even be part of India.,FranknStein07,Maharashtra,t2_qiwx4,/r/india/comments/eigzia/do_we_owe_an_apology_to_kashmir/fcqbjc6/,1577882754,1,0
fcqbk4b,t1_fcqbe7v,t3_eidi5v,क्यों तू भी ठुल्ला है क्या?,baburao87,,t2_5alimi4y,/r/india/comments/eidi5v/random_daily_discussion_thread_january_01_2020_at/fcqbk4b/,1577882765,1,0
fcqbnsc,t3_eiemdm,t3_eiemdm,Guys check your bank account we all got 15 lakhs each from the Swiss banks. Started a pakoda startup here with that and now I am a Millionaire. Believe in 2020.,ascelpius,,t2_zxgge,/r/india/comments/eiemdm/woke_up_to_a_magnificent_view_of_pune_city_behind/fcqbnsc/,1577882820,1,0
fcqbojw,t3_eigzia,t3_eigzia,I will just put this here: https://www.bbc.com/news/world-asia-india-39179515,verybadbot,sandaas wahi banega!,t2_1ubk5xd1,/r/india/comments/eigzia/do_we_owe_an_apology_to_kashmir/fcqbojw/,1577882832,1,0
fcqbpa5,t1_fcqbdih,t3_eidi5v,Ye aaye aakash Chopra ke baap. XD . ye deduce karne ka Kya process that?,easysleazzy,zeal is ze best,t2_4llbcvk1,/r/india/comments/eidi5v/random_daily_discussion_thread_january_01_2020_at/fcqbpa5/,1577882843,1,0
fcqbqbn,t1_fcpu42v,t3_eid66v,"dude, you cant call them that!

it's ""cauc'asians""",dym_sh,,t2_tfbqt0j,/r/india/comments/eid66v/hello_there_from_bangalore/fcqbqbn/,1577882859,1,0
fcqbqrv,t1_fcqb14m,t3_eidi5v,Hard work and discipline,easysleazzy,zeal is ze best,t2_4llbcvk1,/r/india/comments/eidi5v/random_daily_discussion_thread_january_01_2020_at/fcqbqrv/,1577882865,1,0
fcqbs3o,t1_fcqb85d,t3_eifhqy,Which university? How did you get there? Hows it going?,alonelysaber,,t2_dzwtvex,/r/india/comments/eifhqy/started_the_new_year_like_a_normie_mains_on_7th/fcqbs3o/,1577882885,1,0
fcqbs4n,t3_eii01h,t3_eii01h,[Hum Dekhenge](https://youtu.be/yiNwtERuL3g),ShogunOfDarkness,,t2_13qwgv,/r/india/comments/eii01h/is_hum_dekhenge_a_popular_protest_song_by_poet/fcqbs4n/,1577882886,1,0
fcqbskv,t3_eii0cx,t3_eii0cx,"The maharaja adopted the poles even after the Brits opposed his decision at every step.

Kinda makes sense why the poles didn't settle in the ""Anglo sphere"" Canada, Ireland, Gibraltar, Australia, New Zealand or the other British colonies.

Hiding from the invaders, they were rescued and put on small ships that travelled from port to port—in Scotland, Ireland, Africa—but were barred from entering. Finally, they arrived in Bombay, where the British governor also refused entry (saying he did not have permission from the home office in London, and that they came from enemy territory). Enter the Jam Saheb, then an Indian representative on the imperial war cabinet in London chaired by Winston Churchill. Hearing of the children’s plight from the Polish prime minister-in-exile, he flew immediately to Bombay. He first went to the ships, saw the dreadful condition of the kids, spoke to the captains and went to meet the governor. “Our father tried to convince him, but when he failed, he was so frustrated, he went back to the ships and asked them to move to Nawanagar’s Rosi port. He took them all off and put them in tented accommodation for a few months before the Balachadi camp came up,” the siblings recall.

Another extraordinary detail recounted by the siblings is that when the viceregal office in Delhi objected to him taking in foreigners, he said they were part of his family, and even produced an adoption certificate. “Our father politically adopted them,” says Harshad Kumari, adding that he bankrolled the project from his personal funds.

https://www.outlookindia.com/magazine/story/little-warsaw-of-kathiawar/268578",dispiritedfirework,,t2_a93bed1,/r/india/comments/eii0cx/future_generations_of_poles_who_found_refuge_in/fcqbskv/,1577882893,1,0
fcqbsoy,t1_fcqb9cw,t3_eidi5v,गांड कल रात से सुजी पड़ी है।,baburao87,,t2_5alimi4y,/r/india/comments/eidi5v/random_daily_discussion_thread_january_01_2020_at/fcqbsoy/,1577882895,1,0
fcqbsys,t1_fcqbara,t3_eidi5v,You're edgy,easysleazzy,zeal is ze best,t2_4llbcvk1,/r/india/comments/eidi5v/random_daily_discussion_thread_january_01_2020_at/fcqbsys/,1577882899,1,0
fcqbtf7,t1_fcqb5tb,t3_eidi5v,Mama abb hum jese virgins ko layak nhi samjhte h.sed lyf,Leburnum,,t2_553bgnmr,/r/india/comments/eidi5v/random_daily_discussion_thread_january_01_2020_at/fcqbtf7/,1577882906,1,0
fcqbthk,t3_eih0yd,t3_eih0yd,chaar saal age ludka de date.,rehnedeyaar,,t2_54pi0zpz,/r/india/comments/eih0yd/butwhat_about_supapowa_2020/fcqbthk/,1577882907,1,0
fcqbuue,t1_fcq93s5,t3_eifhqy,hows it feel? Confident?,alonelysaber,,t2_dzwtvex,/r/india/comments/eifhqy/started_the_new_year_like_a_normie_mains_on_7th/fcqbuue/,1577882927,1,0
fcqbuva,t1_fcqbqrv,t3_eidi5v,Stamina bhi,Leburnum,,t2_553bgnmr,/r/india/comments/eidi5v/random_daily_discussion_thread_january_01_2020_at/fcqbuva/,1577882928,1,0
fcqbv37,t1_fcq8o2u,t3_eidi5v,Ye bol ke itne padhne ke baad intelligent bezaati krne me maza aata hai,buntys-ancestor,there is no god,t2_4oo913yp,/r/india/comments/eidi5v/random_daily_discussion_thread_january_01_2020_at/fcqbv37/,1577882931,1,0
fcqbvb1,t1_fcpbojy,t3_eidi5v,There’s no such thing as too much gym,brown_burrito,,t2_17zu6sle,/r/india/comments/eidi5v/random_daily_discussion_thread_january_01_2020_at/fcqbvb1/,1577882933,1,0
fcqbvcy,t1_fcq8wvf,t3_eifhqy,"With something like Cs/Ece your college wouldn’t matter as much. If you get cs even in a tier 3 college, but work on great projects, do internships, competitive programming, your job prospects will be on par with the average IIT graduate. At the end of the day, do what you love and you’ll get ahead in life irrespective of college. Build stuff, reach out to people, network, make friends.",piewala,,t2_33fqggxb,/r/india/comments/eifhqy/started_the_new_year_like_a_normie_mains_on_7th/fcqbvcy/,1577882934,1,0
fcqbvji,t1_fcqb5tb,t3_eidi5v,तू भी करले बलास्ट,baburao87,,t2_5alimi4y,/r/india/comments/eidi5v/random_daily_discussion_thread_january_01_2020_at/fcqbvji/,1577882937,1,0
fcqbvrl,t3_eihf5q,t3_eihf5q,"Yr 6000AD , humans finding tips of skyscrapers near beaches.",Z3DLooP,Traveller,t2_1pc2qmbz,/r/india/comments/eihf5q/by_2050_mumbai_and_chennai_will_be_under_water/fcqbvrl/,1577882940,1,0
fcqbwpf,t1_fcqbsys,t3_eidi5v,You're not hydrohomie,buntys-ancestor,there is no god,t2_4oo913yp,/r/india/comments/eidi5v/random_daily_discussion_thread_january_01_2020_at/fcqbwpf/,1577882954,1,0
fcqbxlo,t1_fcqbtf7,t3_eidi5v,Mama bohot bada playaa hai. Chupa ke rakhta hai apne talents so that we feel good,easysleazzy,zeal is ze best,t2_4llbcvk1,/r/india/comments/eidi5v/random_daily_discussion_thread_january_01_2020_at/fcqbxlo/,1577882967,1,0
fcqby5e,t3_eihfv4,t3_eihfv4,Pe*gau*sus,butcherofblavakien,,t2_13fvr3,/r/india/comments/eihfv4/just_stepped_out_of_my_house_and_saw_this/fcqby5e/,1577882976,1,0
fcqbyyz,t1_fcp4sk6,t3_eidi5v,Well said!,brown_burrito,,t2_17zu6sle,/r/india/comments/eidi5v/random_daily_discussion_thread_january_01_2020_at/fcqbyyz/,1577882989,1,0
fcqbyzg,t1_fcqbojw,t3_eigzia,"Yeah, I read that too, It's disturbing, Thought to share the picture in the post directly but the people might not be ready for that.",Neglectedsince1994,📢 Inquilab Zindabad! ,t2_11ya6ujn,/r/india/comments/eigzia/do_we_owe_an_apology_to_kashmir/fcqbyzg/,1577882989,1,0
fcqbz0a,t1_fcq82k6,t3_eiduhh,"meanwhile, are we gonna get an aquarium??",GolmaalCountry,,t2_4qemgpy7,/r/india/comments/eiduhh/as_govt_fails_in_sealing_mou_for_hyperloop/fcqbz0a/,1577882990,1,0
fcqbzgz,t1_fcqa9or,t3_ei69l1,"Instructions unclear, head stuck in cow :(",sAK47,,t2_fvlx4,/r/india/comments/ei69l1/finally_superpower_2020_happy_new_year_everyone/fcqbzgz/,1577882997,1,0
fcqbzpt,t1_fcqbvji,t3_eidi5v,Ab Mai phatunga,easysleazzy,zeal is ze best,t2_4llbcvk1,/r/india/comments/eidi5v/random_daily_discussion_thread_january_01_2020_at/fcqbzpt/,1577883000,1,0
fcqc05a,t3_eif5xl,t3_eif5xl,Can't wait to see the Pune map in Cyberpunk 2077 in a few months,-Salamander-Man-,,t2_4e1cy3oy,/r/india/comments/eif5xl/hello_from_goa_was_surprised_to_see_so_much/fcqc05a/,1577883006,1,0
fcqc05c,t1_fcqbpa5,t3_eidi5v,"Experience janaab, saare paper meine solve kiye thhe..I would argue that 2015 was hard as compared to 2014 because JEE council decided sabka kateinge by introducing negative marking in multiple correct optiom",Timur_tomb_opener,,t2_4xi7bttt,/r/india/comments/eidi5v/random_daily_discussion_thread_january_01_2020_at/fcqc05c/,1577883007,1,0
fcqc0hv,t1_fcqbxlo,t3_eidi5v,Mama ji se toh inspire h hunterrr movie.,Leburnum,,t2_553bgnmr,/r/india/comments/eidi5v/random_daily_discussion_thread_january_01_2020_at/fcqc0hv/,1577883012,1,0
fcqc0kb,t1_fcqbwpf,t3_eidi5v,Why u say that?,easysleazzy,zeal is ze best,t2_4llbcvk1,/r/india/comments/eidi5v/random_daily_discussion_thread_january_01_2020_at/fcqc0kb/,1577883013,1,0
fcqc1d6,t1_fcq9w5t,t3_ei18yb,"Please read my original statement carefully. I am asking where is the money going to come from or where the money is cut. What is the use of announcing it yesterday when Budget is mere 4 weeks away? Also Infra to GDP ratio **without** private expenditure is going to be doubled is the claim by Nirmala.

&gt; The government is doing what it can to stem the fall of GDP growth.

How is it going to do? With a failing economy? Just manage headlines like yesterday? Without press conferences, it would be great if the Finance Ministry can actually get down to work on the most important budget after 1991.",arinthum_ariyamalum,,t2_c4k9dfd,/r/india/comments/ei18yb/nirmala_sitharaman_unveils_102_lakh_crore/fcqc1d6/,1577883027,1,0
fcqc1k4,t1_fcqbsoy,t3_eidi5v,तो किसने कहा था गांड को इतना चूसो की सूज जाए,buntys-ancestor,there is no god,t2_4oo913yp,/r/india/comments/eidi5v/random_daily_discussion_thread_january_01_2020_at/fcqc1k4/,1577883031,1,0
fcqc3rc,t1_fcp9vhs,t3_eidi5v,Also take some ibuprofen before you conk out and don’t drink on an empty stomach.,brown_burrito,,t2_17zu6sle,/r/india/comments/eidi5v/random_daily_discussion_thread_january_01_2020_at/fcqc3rc/,1577883065,1,0
fcqc4a1,t1_fcqc1k4,t3_eidi5v,अपनी गान्ड कैसे चुसी जाती है ज़रा सिखा दो हमें भी,baburao87,,t2_5alimi4y,/r/india/comments/eidi5v/random_daily_discussion_thread_january_01_2020_at/fcqc4a1/,1577883072,1,0
fcqc4jh,t1_fcqc0kb,t3_eidi5v,cAuSe Im EdGy,buntys-ancestor,there is no god,t2_4oo913yp,/r/india/comments/eidi5v/random_daily_discussion_thread_january_01_2020_at/fcqc4jh/,1577883076,1,0
fcqc4y4,t1_fcq0jgl,t3_eidjrc,Yes. Aadhaar is not mandatory for that. They need ID proof and address proof. Both can be given without Aadhaar.,arinthum_ariyamalum,,t2_c4k9dfd,/r/india/comments/eidjrc/so_whats_the_latest_update_on_aadhaar/fcqc4y4/,1577883083,1,0
fcqc5ld,t1_fcqbj6t,t3_eidi5v,"*in madhuri dixit's voice*  
Ah haa",Timur_tomb_opener,,t2_4xi7bttt,/r/india/comments/eidi5v/random_daily_discussion_thread_january_01_2020_at/fcqc5ld/,1577883094,1,0
