id,name,title,score,subreddit,url,num_comments,selftext,author,num_crossposts,over_18,permalink,pinned,subreddit_type,link_flair_text,author_flair_text,total_awards_received,upvote_ratio,time_created,comment
g5v9b9,t3_g5v9b9,Should Journalists Be Out Covering Stories During Pandemic?,5,india,https://www.reddit.com/r/india/comments/g5v9b9/should_journalists_be_out_covering_stories_during/,4,"What do you think?

2 days ago over 50 journalists in Mumbai test positive. 

What do you think is okay?  What do you think is not okay?

In my opinion, it is not that much important as the administration is releasing the information frequently regarding covid19. Moreover, excessive reporting on pandemic is creating an atmosphere of fear and uncertainty.",SmilingDeadpool,0,False,/r/india/comments/g5v9b9/should_journalists_be_out_covering_stories_during/,False,public,Coronavirus,,0,0.67,2020-04-22 10:49:17,"  We definitely need reporting from different sources so that we know whats going on, and don’t get biased information (in anyone’s favour). The only thing is that the journalists need to be briefed in how to navigate these circumstances safely, and some measures should be taken to minimise their contact with potentially affected people. 

Another thing is I suppose that other incidents have not stopped happening because of the pandemic, so journalists do also need to make sure that other important stories are not being missed because of the lockdown. Considering how flooded all news sources seem to be with coronavirus content though, this might need some work. If reporting is not done then how will anyone know what actually is going on. Government, cops and rule breaking elements will have free reign to do whatever they want. 

Journalism is a very important tool for people stuck inside their own homes to stay abreast of the actual situation outside and to keep everything in check. Sh"
g5vvhd,t3_g5vvhd,My uncle has got a fever for more than a week,48,india,https://www.reddit.com/r/india/comments/g5vvhd/my_uncle_has_got_a_fever_for_more_than_a_week/,23,"My uncle has 99 degree fever for more than a week. My aunt has quarantined him on a different floor in their house but she is terrified and that has caused her low BP. Yesterday he got his fever tested and they said it was okay as he didn't have any other symptoms. Any doctors here , why is his fever not improving and what else can we do?

Edit : My aunt just phoned and my uncle is showing some improvements. My aunt has decided to keep him quarantined for one more week.",goodyougo,0,False,/r/india/comments/g5vvhd/my_uncle_has_got_a_fever_for_more_than_a_week/,False,public,AskIndia,,0,0.88,2020-04-22 11:42:15,"  During times of a pandemic, please do not ask Reddit or webmd. Call helpline for COVID19 When they got his fever tested yesterday, was he prescribed any antibiotics? 99.x fever and headaches/bodyaches/weakness for 4-5 days? I had this a while ago - it is some seasonal flu that subsided on its own.

Covid 19 leads to high temperatures - 103 and beyond. In fact WHO doesn't consider anything below 100.4 as covid symptoms. 99°F is not a fever. It is normal body temperature. Fever is >100°F. 

Also depends on whether you're taking into account oral temperature or axillary temperature. In case of oral temperature, whether the person has eaten something hot or cold before measuring temperature then it affects the results. 

Since the temperature is normal and no other symptoms, you shouldn't worry. Contact Health care people, use Arogya Set app, corona watch app... Needs to be minimum of 37.5 degrees for consideration as 🇨🇳 virus. go and see a doctor and do not depend on anything it may be "
g5u5k4,t3_g5u5k4,Is ISA Global immigration agency a scam,5,india,https://www.reddit.com/r/india/comments/g5u5k4/is_isa_global_immigration_agency_a_scam/,7,"My elder brother (40 yrs old) is hell bent on spending a couple of lakhs on Canada PR by an agency. The family FD will have to be used. I want to be sure if ISA Global is a good reliable company or just another scam?   Also, has anyone with 40 yrs ever got the Canada PR. am unable to convince my bhai.",mariachihanzo,0,False,/r/india/comments/g5u5k4/is_isa_global_immigration_agency_a_scam/,False,public,AskIndia,,0,0.78,2020-04-22 09:22:43,"  It’s a fairly straight forward process. No need to spend that much money on it. 

However, I’d expect major changes in immigration in the near future and would keep an eye out for that before making a commitment. 

Don’t break the FD. Hi,

As already stated, you don't need to send money to apply for Canada PR. CIC (Canada Immigration) has a tool in their website (link given below) that lets you verify if you qualify for a PR application or not.

[https://www.cic.gc.ca/english/immigrate/skilled/crs-tool.asp](https://www.cic.gc.ca/english/immigrate/skilled/crs-tool.asp) You don't need an agency to get the PR. You can do it all on your own if you are eligible. I helped a family cousin with the application. straightforward process. Every information you need is available on-line and forums. The agency would do nothing more than uploading documents online or filling forms manually to scan. You're paying for data entry workm Dont spend the FD money. Get it done at through direct way. Scam"
g5vu81,t3_g5vu81,Government fast tracks plan to provide social security for gig workers,12,india,https://economictimes.indiatimes.com/small-biz/startups/newsbuzz/government-fast-tracks-plan-to-provide-social-security-for-gig-workers/articleshow/75259380.cms?intenttarget=no,0,,shadilal_gharjode,0,False,/r/india/comments/g5vu81/government_fast_tracks_plan_to_provide_social/,False,public,Policy/Economy,,0,1.0,2020-04-22 11:39:11, 
g5vm3l,t3_g5vm3l,‘Sitting upon a volcano’: Doctors in Bengal ring the alarm bell over state’s low testing numbers,266,india,https://scroll.in/article/959858/sitting-upon-a-volcano-doctors-in-bengal-ring-the-alarm-bell-over-states-low-testing-numbers,24,,shadilal_gharjode,0,False,/r/india/comments/g5vm3l/sitting_upon_a_volcano_doctors_in_bengal_ring_the/,False,public,Coronavirus,,0,0.96,2020-04-22 11:19:43,"  Has Mamta decided she will give Bengal to BJP on silver platter? One thing to learn from other countries is that this crisis can be managed only if governments are transparent and accountable. Being in denial will only make things worse. I hope she gets back to her senses and logically allow health workers to function.

They are fighting a long tiresome battle, let's not leave them alone. [Calcutta HC directs West Bengal govt to follow WHO, Centre guidelines for Covid-19 patients | The court issued directions after hearing a writ petition filed by Senior Counsel Smarajit Roy Chowdhury who had cited an example of a case in Howrah, which is a red zone.](https://www.indiatoday.in/india/story/calcutta-hc-directs-west-bengal-govt-to-follow-who-centre-guidelines-for-covid-19-patients-1669593-2020-04-22)

-

[Mamata gives Rs 10 lakh insurance cover to journalists, asks them to report positive](https://theprint.in/india/mamata-gives-rs-10-lakh-insurance-cover-to-journalists-asks-them-to-cove"
g5vl7d,t3_g5vl7d,The Hindu journalist questioned by J&K police in 2nd FIR against media personnel in Kashmir,20,india,https://theprint.in/india/the-hindu-journalist-questioned-by-jk-police-in-2nd-fir-against-media-personnel-in-kashmir/406015/,0,,lachrymator2019,0,False,/r/india/comments/g5vl7d/the_hindu_journalist_questioned_by_jk_police_in/,False,public,Politics,Snowflakes Everywhere,0,0.75,2020-04-22 11:17:29, 
g5vk39,t3_g5vk39,"Swiggy, Zomato delivery execs lose means of livelihood as Telangana bans food delivery",154,india,https://www.thenewsminute.com/article/swiggy-zomato-delivery-execs-lose-means-livelihood-telangana-bans-food-delivery-123080?amp&__twitter_impression=true,11,,hipporama,0,False,/r/india/comments/g5vk39/swiggy_zomato_delivery_execs_lose_means_of/,False,public,Policy/Economy,,0,0.95,2020-04-22 11:14:44,"  I ordered groceries from Swiggy yesterday. Slots at big basket are just not available Not only the delivery execs. Hundreds (thousands?) of restaurants & its employees have lost livelihood. I wonder what happens to the food stocked in these restaurants? Are they being left to rot? Goli hi maar do na hostelwalo ko, saalo bhookha marne se toh behtar hi hai /s

How stupid are Indian politcians, thousands of students, tourists will starve by this decision UH-- is this becoming a trend? 😱"
g5vgmk,t3_g5vgmk,ASHA Worker Threatened in Mysuru after Asking Residents to Practise Social Distancing; 3 Men Booked,100,india,https://www.news18.com/news/india/asha-worker-threatened-in-mysuru-after-asking-residents-to-practise-social-distancing-3-men-booked-2586897.html,6,,91uwu,0,False,/r/india/comments/g5vgmk/asha_worker_threatened_in_mysuru_after_asking/,False,public,Coronavirus,,0,0.97,2020-04-22 11:06:25,"  How long will this go on? These stories come everyday. Fucking stop harrassing medical staff, sanitization workers and volunteers. They are not requesting you to lift mountains. Don't push them to take extreme step of going on a strike. At the end of the day, there are like everyone else and want to go home. Let them do their duty and have some humanity and tolerance. https://twitter.com/nolanentreeo/status/1252484004248293376?s=20


 Video of this incident"
g5vf0v,t3_g5vf0v,Senior J&K Cop Called Out For Tweet Against PM After Charging Journalist,24,india,https://www.ndtv.com/india-news/senior-jammu-and-kashmir-cop-called-out-for-anti-modi-tweet-after-charging-journalist-2215895?amp=1&akamai-rum=off,1,,Trouble1nParadise,0,False,/r/india/comments/g5vf0v/senior_jk_cop_called_out_for_tweet_against_pm/,False,public,Politics,ab ki baar pls nuke kardo yaar,0,0.78,2020-04-22 11:02:30,"  How come such people's characters are so fluid. Something they called wrong becomes right magically within just 6-7 years? Looks like majority of government employees are mere careerists with no ethics and a fluid sense of right and wrong. And long after retirement and post-retirement sinecures, few of them will write some virtue-signalling memoirs to compensate for their conduct."
g5vd5i,t3_g5vd5i,Why Is the Centre Pushing a New Electricity Bill in the Midst of the COVID-19 Crisis?,23,india,https://thewire.in/government/why-is-the-centre-pushing-a-new-electricity-bill-in-the-midst-of-the-covid-19-crisis,12,,Dumma1729,0,False,/r/india/comments/g5vd5i/why_is_the_centre_pushing_a_new_electricity_bill/,False,public,Policy/Economy,,0,0.77,2020-04-22 10:58:19,"  This article is so myopic it beggars belief.

Every single entity in the power business is losing money, nobody wants to invest in the sector because no one cares about contracts and generators don't get paid.

I guess the author will be satisfied when everyone just packs up and goes home eventually and the country is left with severe power shortages.

If the Andhra Govt can arbitrarily declared contracts to be void and call for renegotiation, there is something fucking wrong and there is absolutely a need to enforce those contracts and do it quickly, not 5+ years later when the judicial system comes around to it.

As for private monopolies being better than public monopolies, first of all, none of the proposed privatisation is going to result in private monopolies. Private participation is either done through a PPP or through a licensee model. Not to mention that power distribution is a heavily regulated business. You have to bare it all before the regulator to set tariffs.

& despi"
g5vca2,t3_g5vca2,"By crowdfunding benefits for embattled workers, app-based services are evading their own obligations",34,india,https://scroll.in/article/959766/by-crowdfunding-benefits-for-embattled-workers-app-based-services-are-evading-their-own-obligations?__twitter_impression=true,1,,Dumma1729,0,False,/r/india/comments/g5vca2/by_crowdfunding_benefits_for_embattled_workers/,False,public,Business/Finance,,0,0.96,2020-04-22 10:56:16,"  Uber has been asking for donations. Yeah like the fuck I would give a penny to a private firm or PM Cares.
I’ve donated to local groups who are genuinely working. Not gonna waste."
g5vact,t3_g5vact,"Mumbai: Labourer dies after returning home in Dongri, friend says cops beat him for flouting lockdown",95,india,https://mumbaimirror.indiatimes.com/coronavirus/news/mumbai-labourer-dies-after-returning-home-in-dongri-friend-says-cops-beat-him-for-flouting-lockdown/articleshow/75233143.cms,2,,proyo7,0,False,/r/india/comments/g5vact/mumbai_labourer_dies_after_returning_home_in/,False,public,Coronavirus,,0,0.91,2020-04-22 10:51:42,  Are there these many vehicles out on the road?
g5v72c,t3_g5v72c,"[Showerthoughts] Is it just me or someone else also thinks that ""Namaste Trump"" event on 24th Feb could be the reason of Ahmedabad current Covid-19 situation.",15,india,https://www.reddit.com/r/india/comments/g5v72c/showerthoughts_is_it_just_me_or_someone_else_also/,3,"What the hell our beloved leaders were thinking while gathering lakhs of people in Ahmedabad including a bunch of foreigners, and that was when the whole world was suffering due to coronavirus.",BahutBadaHarami,0,False,/r/india/comments/g5v72c/showerthoughts_is_it_just_me_or_someone_else_also/,False,public,Coronavirus,,0,0.64,2020-04-22 10:43:48,"  [Anand patwardhan feels so too](https://twitter.com/anandverite/status/1252829418180841472?s=19) *Saatvik amdavad mein Corona, OMG!* Hope you are done with the shower


https://www.orfonline.org/expert-speak/sociology-of-a-pandemic-the-hidden-trends-of-covid19-in-ahmedabads-walled-city-64844/"
g5v6mq,t3_g5v6mq,Coronavirus epidemic could peak in India by mid-May: Study,41,india,https://timesofindia.indiatimes.com/india/coronavirus-epidemic-could-peak-in-india-by-mid-may-study/articleshow/75283258.cms,4,,VegetarianCannibal_,0,False,/r/india/comments/g5v6mq/coronavirus_epidemic_could_peak_in_india_by/,False,public,Coronavirus,,0,0.89,2020-04-22 10:42:49,"  Mudiji sab theek kar dege

Sab changa si 825,000 cases in the US with 1/3rd our population and 7 times our land area. But yeah, we'll have 75,000 cases at the peak.

Sounds legit."
g5v2wt,t3_g5v2wt,"Delhi: Union HM Amit Shah & Union Health Minister Dr Harsh Vardhan interacted with Indian Medical Association doctors through video conferencing today. HM assured them security & appealed to them to not to do even symbolic protest as proposed by them, govt is with them.",28,india,https://twitter.com/ANI/status/1252823788737056768,1,,aviakki1,0,False,/r/india/comments/g5v2wt/delhi_union_hm_amit_shah_union_health_minister_dr/,False,public,Coronavirus,,0,0.84,2020-04-22 10:34:40,"  Ha. Sure. Completely with them, with the poor, with Muslims, with women.. missing any other minority?"
g5tpcx,t3_g5tpcx,How effective is baba ramdev's herbal sanitizer?,27,india,https://www.reddit.com/r/india/comments/g5tpcx/how_effective_is_baba_ramdevs_herbal_sanitizer/,19,"Saw a status post on family WhatsApp which says herbal ones can be used instead of alcohol based. Some googling got me this [https://www.indiatvnews.com/lifestyle/health-swami-ramdev-lists-out-ways-to-protect-yourself-from-coronavirus-598159](https://www.indiatvnews.com/lifestyle/health-swami-ramdev-lists-out-ways-to-protect-yourself-from-coronavirus-598159) which says the method for creating herbal sanitizer is as follows.

&#x200B;

&#x200B;

Making herbal hand sanitizers:

Baba Ramdev, further shows how one can make an Ayurvedic hand sanitizer at home on India TV. Through this, you can make a hand sanitizer to avoid coronavirus. After thorough research by Baba Ramdev, this domestic and Ayurvedic hand sanitizer has been declared authentic. They say that it is absolutely herbal and it does not have any side effects. Have a look at how to make a home hand sanitizer.

**Ingredients:**

1-liter water

100 neem leaves10-20 basil leaves10 grams alum10 grams camphorAloe vera

&#x200B;

**Procedure**:

* First, put 100 grams of neem leaves in 1 liter of water.
* After that, add basil leaves and boil them well in water. Now put aloe vera in it.
* When the water boils well and about 600 to 700 mL of 1 liter is left, then add camphor and alum in it.

&#x200B;

Copied from the site mentioned.

This is exactly the English version of the WhatsApp status which was in Hindi.

&#x200B;

So, does thing actually work? If not, then this BS can be more dangerous as it gives a false sense of security and will actually prevent people from using alcohol based sanitizer.

&#x200B;

**EDIT: ""Elders must be respected in the group""** k chakar mein bc kisi ko bol be nhi sakte ki ye chutiyap hai. Inke chakkar mein baki ki lag jaye gi.",chase_away_the_night,0,False,/r/india/comments/g5tpcx/how_effective_is_baba_ramdevs_herbal_sanitizer/,False,public,Coronavirus,,0,0.81,2020-04-22 08:50:36,"  if (Alcohol content> 60%) {
    ""Sanitzer"";
} 
Else {
     ""Fuck off"" ;
} it might work against bacteria but to disrupt the viral envelope we need alcohols or similar compounds in them (that too in higher concentration about 60% at least if i remember correctly) Sanitizer without alcohol means it is nothing but juice to be applied on skin that does nothing apart for giving you a false sense of disinfection. Camphor?!!! He should be the very last person to be provided with vaccine. As good as gaumutr. 

There has to be a minimum of 60% alcohol content (usually ethanol-wrong) to be effective against viruses. As useful as fair and lovely.

This is a misleading advertisement. Camphor is not a disinfectant. This guy should be punished just like other fake sanitizer factories' owners. Mate, just use after-shave. In general they have a good alcohol content, Old spice for eg has 95.5% (V/V), but idk about the proof of the alcohol. You can blend whatever fruit pulp or aloe vera mix in it.

If"
