id,parent_id,link_id,body,author,author_flair_text,author_fullname,permalink,created_utc,score,total_awards_received
fcqvdj1,t1_fcqldfd,t3_eiioyo,Gaumutra is the fuel?? Cows are inside buildings.,shahabahmed,,t2_50lptr4m,/r/india/comments/eiioyo/in_2020_cows_just_disappear/fcqvdj1/,1577892777,1,0
fcqvea3,t1_fcpdvud,t3_eid66v,Haven't played Witcher. Didn't know it had portals. Valve's Portal 1 and 2 were awesome.,IrtahkEnt,,t2_2rh8oet3,/r/india/comments/eid66v/hello_there_from_bangalore/fcqvea3/,1577892788,1,0
fcqveci,t3_eih7oj,t3_eih7oj,Scoopwhoop unscripted is one channel that comes to mind but they don't put out content regularly,hak_i,Chennai,t2_nav8o,/r/india/comments/eih7oj/need_youtube_channel_recommendations_like/fcqveci/,1577892789,1,0
fcqvg9e,t1_fcquyp8,t3_eigs8n,"You literally just gave the proof that this is NOT action in response to the CAA protest by stating that the ""victims of such poice action are people who DID NOT take part in the protest.""

Those are horrific actions on the part of the police and they should be prosecuted but that is not an action taken against CAA protesters(which you admitted to by saying the victims did not take part in protest . You are conflating things again",chickenbis,,t2_5amgwwmc,/r/india/comments/eigs8n/modi_bjp_are_creating_a_climate_of_fear_in_india/fcqvg9e/,1577892813,1,0
fcqvgmz,t3_eid66v,t3_eid66v,"""clips are what civvies put in their hair, this is called a magazine""",finnvisible,,t2_1dkbstik,/r/india/comments/eid66v/hello_there_from_bangalore/fcqvgmz/,1577892818,1,0
fcqvo9p,t1_fcquzrd,t3_eijgob,And what's in the picture? A hotel?,Adimasterxx,,t2_41rtso5y,/r/india/comments/eijgob/took_this_photo_of_my_random_village_in_majuli/fcqvo9p/,1577892907,1,0
fcqvou4,t1_fcqujov,t3_eidi5v,kIAB-6. Fuck Bangalore.,JPBabuaFromOttawa,Glad to Have a Functioning Brain,t2_4xe5mrbh,/r/india/comments/eidi5v/random_daily_discussion_thread_january_01_2020_at/fcqvou4/,1577892914,1,0
fcqvph8,t1_fcqreuz,t3_eigzia,"Give me time while I reply every of your point but I noticed that you've been sharing this post with the title as  "" 

# Got downvoted. Whatever you do ppl of one religion never understand.

Screenshot: [https://imgur.com/a/i1hzeXo](https://imgur.com/a/i1hzeXo) 

Then let me tell you fucker, I am a Hindu Brahmin and I would have not used this language if you would not have came up with the ""Religion part"", You have every right to disagree with me and prove me wrong and I will gladly accept that, share this post with 1000 of your frineds and ask them to dislike without even reading I don't care but you asshole stop bringing up this religious angle in every thing, Get over this religion bullshit for once. This country has seen enough bloodshed, Let people live for fuck sake.",Neglectedsince1994,📢 Inquilab Zindabad! ,t2_11ya6ujn,/r/india/comments/eigzia/do_we_owe_an_apology_to_kashmir/fcqvph8/,1577892922,1,0
fcqvpnr,t1_fcqurez,t3_eihiuw,Sorry auto correct.,pm_me_your_booty420,,t2_55ox84aw,/r/india/comments/eihiuw/happy_new_year_superpower_2020/fcqvpnr/,1577892925,1,0
fcqvqx9,t1_fcqv7eo,t3_eijgob,And what's in the picture? A hotel?,Adimasterxx,,t2_41rtso5y,/r/india/comments/eijgob/took_this_photo_of_my_random_village_in_majuli/fcqvqx9/,1577892940,1,0
fcqvsb4,t1_fcqokkc,t3_eiiah7,Be gone bhakht.,miyan_modi,,t2_19jttk8j,/r/india/comments/eiiah7/4th_grade_social_science_textbook_of_central/fcqvsb4/,1577892958,1,0
fcqvsw1,t3_eiir33,t3_eiir33,"Wait, it wasn't clear have they been moved to other departments. Or did he fire them?",axyz77,,t2_yza9e,/r/india/comments/eiir33/to_cut_cost_pm_modi_cuts_size_of_his_personal/fcqvsw1/,1577892965,1,0
fcqvuoa,t1_fcqnr3a,t3_eie7xz,you mean Bargain Gurus,veertamizhan,le narhwal bacon xD,t2_849pa,/r/india/comments/eie7xz/among_those_superpower_posts_a_superpower_meme/fcqvuoa/,1577892986,1,0
fcqvxny,t1_fcqvuoa,t3_eie7xz,Nope. Search for Pawn Stars.,AimHrimKleem,Baad main dekh lenge,t2_4v3v73ai,/r/india/comments/eie7xz/among_those_superpower_posts_a_superpower_meme/fcqvxny/,1577893025,1,0
fcqvyec,t1_fcqvsb4,t3_eiiah7,I am not a bakht. I don't even like Maulana Monkey Bath Mahdi.,haizl0ver,,t2_3r1h80r0,/r/india/comments/eiiah7/4th_grade_social_science_textbook_of_central/fcqvyec/,1577893035,1,0
fcqw05z,t1_fcqvxny,t3_eie7xz,it is broadcast as Bargain Gurus on History India,veertamizhan,le narhwal bacon xD,t2_849pa,/r/india/comments/eie7xz/among_those_superpower_posts_a_superpower_meme/fcqw05z/,1577893056,1,0
fcqw2g4,t1_fcqv7n1,t3_eidi5v,10 baje tak allowed rehta na legally shayad... Upar se ye pata chal jaega ki mene call kara tha...,Ooo_weee,15 LAKHS RECEIVED ,t2_592kdp14,/r/india/comments/eidi5v/random_daily_discussion_thread_january_01_2020_at/fcqw2g4/,1577893081,1,0
fcqw4mv,t1_fcqv4nd,t3_eii5h7,2020 is the year India fully embraces what it always meant to be - A Superpower.,sparoc3,,t2_14ti8l,/r/india/comments/eii5h7/i_see_your_blore_pune_and_goa_and_raise_you_my/fcqw4mv/,1577893109,1,0
fcqw4wz,t1_fcqsub6,t3_eii5h7,Ikr.,Gaurav-07,Maharashtra,t2_15lp2k,/r/india/comments/eii5h7/i_see_your_blore_pune_and_goa_and_raise_you_my/fcqw4wz/,1577893112,1,0
fcqw5ss,t1_fcqvqx9,t3_eijgob,"Some of them are hotels, but mostly these are homes of the villagers. Electricity is provided my windmills completely.",magenta_riddim,,t2_37ag46ev,/r/india/comments/eijgob/took_this_photo_of_my_random_village_in_majuli/fcqw5ss/,1577893124,1,0
fcqw78j,t1_fcqvg9e,t3_eigs8n,"Understand the chronology.

1. Indian citizenship protest peacefully
2. Police does baton charge on them
3. Police destroys cars, homes, mosques
4. Police blames protestors for the damages caused
5. Police wreaks havoc on the Muslim community, saying that all of them are protestors
6. The teacher and his students are included in point 5 above

Understanding from afar is difficult. But it is appreciable that you are trying to understand.",in3po,"opinion is free, but facts are sacred",t2_13v7ya,/r/india/comments/eigs8n/modi_bjp_are_creating_a_climate_of_fear_in_india/fcqw78j/,1577893141,1,0
fcqw8mb,t1_fcqw05z,t3_eie7xz,When I used to watch it they used to say it Pawn Stars. But I stll feel like you are confusing it with another one.,AimHrimKleem,Baad main dekh lenge,t2_4v3v73ai,/r/india/comments/eie7xz/among_those_superpower_posts_a_superpower_meme/fcqw8mb/,1577893159,1,0
fcqw8tp,t3_eigzia,t3_eigzia,"Taken from the Human Rights Watch Report - *Rape in Kashmir: A Crime of War, 1993*:  
""In some cases, women have been raped by militant forces as a way of punishing other family members believed to be informers or suspected of opposing the militants. In other cases, members of armed militant groups have abducted women and raped them after threatening or murdering other members of the family.""

https://en.wikipedia.org/wiki/Rape_during_the_Kashmir_conflict#Rape_by_militants_(post-1988)",funny_penis,,t2_8kcam,/r/india/comments/eigzia/do_we_owe_an_apology_to_kashmir/fcqw8tp/,1577893162,1,0
fcqw986,t3_eiidip,t3_eiidip,"I see, you have saved quite a lot of water by not showering for almost a month.",srivathsaaa,,t2_j9cccy5,/r/india/comments/eiidip/how_2019_was_for_this_average_indian_student_hny/fcqw986/,1577893167,1,0
fcqw9ps,t1_fcqu26a,t3_eihiuw,"Indeed, and jokes aside, he was two faced after all. Behind the facade, he was quite okay with the British repressing and subjugating Indians. In an alternative reality timeline, if the Nazis did take control of the subcontinent, I think our fate would be no different than of Eastern European Gypsies.",rehnedeyaar,,t2_54pi0zpz,/r/india/comments/eihiuw/happy_new_year_superpower_2020/fcqw9ps/,1577893172,1,0
fcqwaqc,t3_eiiah7,t3_eiiah7,Wow! did not expect that. Truly impressed. Where can I check the whole book?,Arjun_,Universe,t2_gxqp2,/r/india/comments/eiiah7/4th_grade_social_science_textbook_of_central/fcqwaqc/,1577893185,1,0
fcqwbrx,t1_fcqvou4,t3_eidi5v,"Dheere bol

Traffic miljayega",Superbhatam,Free hugs :snoo_hug:,t2_59cam04e,/r/india/comments/eidi5v/random_daily_discussion_thread_january_01_2020_at/fcqwbrx/,1577893198,1,0
fcqwbvj,t1_fcqqsy3,t3_eidi5v,[Aisa kuch?](https://youtu.be/UbQgXeY_zi4),catwhamen,there's a storm coming Mr. Wayne,t2_58aq1244,/r/india/comments/eidi5v/random_daily_discussion_thread_january_01_2020_at/fcqwbvj/,1577893199,1,0
fcqwdas,t1_fcqr79w,t3_eidi5v,[something like this?](https://youtu.be/UbQgXeY_zi4),catwhamen,there's a storm coming Mr. Wayne,t2_58aq1244,/r/india/comments/eidi5v/random_daily_discussion_thread_january_01_2020_at/fcqwdas/,1577893218,1,0
fcqwdgh,t3_eihiuw,t3_eihiuw,What happened to tadipar ? He looks....lean ? Is that alternate universe skinny smriti irani ?,jojo_joestar_69,,t2_58d6l19y,/r/india/comments/eihiuw/happy_new_year_superpower_2020/fcqwdgh/,1577893220,1,0
fcqwe1a,t1_fcqhuzc,t3_eii724,"No, Indian telecom company in their right mind will do any bidding for 5G trials right now. 

5G is inefficient with current infrastructure and needs lot of investment from the telecom companies to do anything susbtantial with 5G really. Moreover neither the Telecom industry financial condition nor the present economic environment is conducive for any commercial activity with 5G",reddit_guy666,,t2_m692z,/r/india/comments/eii724/govt_lets_5g_waves_roll_asks_cos_to_submit_bids/fcqwe1a/,1577893227,1,0
fcqwfg2,t3_eiiah7,t3_eiiah7,And there was no outrage? I'm impressed,Itookthesauce51,,t2_52yiw5yb,/r/india/comments/eiiah7/4th_grade_social_science_textbook_of_central/fcqwfg2/,1577893242,1,0
fcqwg7n,t3_eigllv,t3_eigllv,Your mother seems to be an awful person. Sorry for asking but would you mind  throwing some light why did she abandon you? How much min money would you be needing monthly to survive? What kind of work would you be interested- tutions etc? Also do try your luck with grandparents about some temporary monthly allowance.,ta_ind_hus,,t2_4yk353un,/r/india/comments/eigllv/ok_i_feel_like_this_would_be_the_best_sub_for/fcqwg7n/,1577893250,1,0
fcqwgjd,t1_fcqw8mb,t3_eie7xz,"yeah actually Bargain Gurus is a compilation of several shows including Pawn Stars..

https://www.adgully.com/history-tv18-to-premier-bargain-gurus-tonight-61297.html",veertamizhan,le narhwal bacon xD,t2_849pa,/r/india/comments/eie7xz/among_those_superpower_posts_a_superpower_meme/fcqwgjd/,1577893255,1,0
fcqwgyg,t3_eijcdk,t3_eijcdk,Kaha khade hokar le ye pic??,xxyyccb,"I am not nationalist, I am patriotic.",t2_1210z1ut,/r/india/comments/eijcdk/anti_caa_protest_in_kochi_today/fcqwgyg/,1577893261,1,0
fcqwhjo,t1_fcqv7n1,t3_eidi5v,"&gt; ter~~a~~i ~~bhai~~ behen

FTFY",easysleazzy,zeal is ze best,t2_4llbcvk1,/r/india/comments/eidi5v/random_daily_discussion_thread_january_01_2020_at/fcqwhjo/,1577893268,1,0
fcqwjpj,t3_eif3kr,t3_eif3kr,"Not to be an asshole, but they sing the national anthem wrong. Gahe ""taba"" jaygatha, not sab as they sing.

Takes nothing away from the intention though.",Beardedquack,,t2_znqafx1,/r/india/comments/eif3kr/jamia_millia_islamia_welcoming_new_year_2020_with/fcqwjpj/,1577893299,1,0
fcqwjvi,t1_fcqvph8,t3_eigzia,"Damn it boy, v convenient of you to be a hindu brahmin. 
With your language you seem to be fuming with hatred. Go grab some water to keep your stink upto yourself. Dont spread this garbage everywhere",youindiayouwin,,t2_3gsnnm0w,/r/india/comments/eigzia/do_we_owe_an_apology_to_kashmir/fcqwjvi/,1577893301,1,0
fcqwjvp,t3_eij9xm,t3_eij9xm,Indian police has segways???,pauldmps,Telangana,t2_p18bx,/r/india/comments/eij9xm/police_at_marine_drive_mumbai/fcqwjvp/,1577893302,1,0
fcqwjyj,t1_fcqwgjd,t3_eie7xz,Yeah! Thanks for clearance.,AimHrimKleem,Baad main dekh lenge,t2_4v3v73ai,/r/india/comments/eie7xz/among_those_superpower_posts_a_superpower_meme/fcqwjyj/,1577893303,1,0
fcqwmmr,t1_fcqw986,t3_eiidip,I tried man. I backpacked for around 15 days to mountains twice. Too much snow for showers.,15percentage,Antarctica,t2_m87yuj5,/r/india/comments/eiidip/how_2019_was_for_this_average_indian_student_hny/fcqwmmr/,1577893337,1,0
fcqwngn,t1_fcqix70,t3_eiiah7,Yeah ...ncert won’t change shit,BlooD2784,,t2_2ox7ih01,/r/india/comments/eiiah7/4th_grade_social_science_textbook_of_central/fcqwngn/,1577893348,1,0
fcqwnhb,t1_fcqimto,t3_eidi5v,"When he said ki wo karke aya tha, he meant her?

Fucking amazing dude",Ooo_weee,15 LAKHS RECEIVED ,t2_592kdp14,/r/india/comments/eidi5v/random_daily_discussion_thread_january_01_2020_at/fcqwnhb/,1577893348,1,0
fcqwo3h,t3_eii5h7,t3_eii5h7,Is that structure Cow dung fusion reactor to power the whole city?,Arjun_,Universe,t2_gxqp2,/r/india/comments/eii5h7/i_see_your_blore_pune_and_goa_and_raise_you_my/fcqwo3h/,1577893355,1,0
fcqwp93,t3_eihfv4,t3_eihfv4,"Dude , we are super power now , that’s not an unusual site anymore 🙂",SkewRadial,,t2_b3z3gjc,/r/india/comments/eihfv4/just_stepped_out_of_my_house_and_saw_this/fcqwp93/,1577893368,1,0
fcqwqpo,t3_eijgob,t3_eijgob,"Bro, this is not even reality, it's still a concept, come on..... [source](https://www.aecom.com/without-limits/article/stranger-than-fiction-a-day-in-the-life-of-future-infrastructure/futuristic-city-village-the-concept-of-the-future-aerial-view-3d-rendering/)",Adimasterxx,,t2_41rtso5y,/r/india/comments/eijgob/took_this_photo_of_my_random_village_in_majuli/fcqwqpo/,1577893385,1,0
fcqwqro,t1_fcpgqhm,t3_eid66v,Did you know that hyperloop was invented in ancient India? It was called pushpak yaan and it was driven by ancient martiand and lizardmen,quit_engg,,t2_2wrt8hn1,/r/india/comments/eid66v/hello_there_from_bangalore/fcqwqro/,1577893385,1,0
fcqwrzc,t1_fcqrfse,t3_eiiah7,\*Ahem\* Pedophilia,Master_of_hunt,,t2_14opwgb,/r/india/comments/eiiah7/4th_grade_social_science_textbook_of_central/fcqwrzc/,1577893398,1,0
fcqws90,t1_fcqphok,t3_eiidip,Surprise for sure but a welcome one.,15percentage,Antarctica,t2_m87yuj5,/r/india/comments/eiidip/how_2019_was_for_this_average_indian_student_hny/fcqws90/,1577893402,1,0
fcqwt0s,t1_fcquepi,t3_eigs8n,"CAA makes sense with one exception which I will end with. Ask any secular liberal person in Afghanisan and Pakistan and they will say that hindus, and other minority groups do face persecution or prejudice. Hindu girls are kidnapped at exceedingly high rates in Pakistan. Sikhs face discrimination in Afghanistan. Just because it is a secular country does not mean you cannot give refugee status based on religion if that is the indicator of discrimination, which does exist.

Using Sri Lanka as an example, a majority of the Refugees to secular countries like USA and Canada were tamil hindus and muslims. Very few Sinhalese and buddists were given refugee status to those countries, if they were it was on a case by case basis(Ex one of Edward Snowden's guardian angel was a sinhalese buddhist given asylum in Canada).

If Bangladesh where the Rohingya has their roots and is the actual bordering nation to Burma are not willing to take them why should India?

Lastly, the contention and principle I agree with you on is Sri Lanka. Tamil Muslims in Sri Lanka are a persecuted minority having Indian origin so I do believe to be fair they should also be benificiaries of CAA.

Pathway to citizenship for refugee/asylum to any group has to be selective in nature and for most of the history of western democracy and democracies influenced by western civilization. The selection criteria should be on a region to by region basis with a selective criteria that is tailored for each region.

THe only point from that uncredible source lol 'urbannazi' i took is the Sri Lankan Muslim issue, who i am sympathetic too. Sri Lankan Tamil Muslims should be covered by CAA. (try a credible source not some blog)

As for the passport quote I have to double check if it is accurate but if he did say that it is ridiculous. 

I am for the most part pro CAA and I dont see why giving citizenship to 32,000 who have been in India for over 5 years from minorities in their prior countries is worth all the protest. Yes Sri Lankan Muslims should be included but all I see is people protesting to just strip the law in its entire form or add all muslims from neighboring countries even muslim majority countries. 

There are historical precedents for paving a pathway to citizenship for people based on religion in other countries. Post WWII and during the onset of the cold war, for the most part the only immigrants from the former USSR who were given this pathway were Jewish. There were some exceptions of course.",chickenbis,,t2_5amgwwmc,/r/india/comments/eigs8n/modi_bjp_are_creating_a_climate_of_fear_in_india/fcqwt0s/,1577893411,1,0
fcqwtny,t1_fcqw8tp,t3_eigzia,"Yes mate, already mentioned in the post. I tried to keep it as short as possible for people who don't have time to go through links. The Wikipedia thread on Kashmir is HUGE if we go through all the links.",Neglectedsince1994,📢 Inquilab Zindabad! ,t2_11ya6ujn,/r/india/comments/eigzia/do_we_owe_an_apology_to_kashmir/fcqwtny/,1577893418,1,0
fcqwtrv,t1_fcqrfse,t3_eiiah7,It's because single men who like children are paedophiles. /s,zoidberg_42,,t2_131ghs,/r/india/comments/eiiah7/4th_grade_social_science_textbook_of_central/fcqwtrv/,1577893420,1,0
fcqwufn,t1_fcpg0f6,t3_eiemdm,56 inch thick layers of deception you mean.,buzzenwired,,t2_zxq4i,/r/india/comments/eiemdm/woke_up_to_a_magnificent_view_of_pune_city_behind/fcqwufn/,1577893429,1,0
fcqwuiw,t3_eij1nd,t3_eij1nd,"If he was a educationist, why is the market named after him?",BhayanakMuut,,t2_4wnyk1n6,/r/india/comments/eij1nd/mahatma_jyotiba_phule_savitribai_phule_and_fatima/fcqwuiw/,1577893430,1,0
fcqwxci,t3_eihqj7,t3_eihqj7,It’s a wonder how he’s still alive and not been Epsteined yet.,C0AL-Miner,West Bengal,t2_10afi307,/r/india/comments/eihqj7/kanhaiya_kumar_giving_it_left_and_right/fcqwxci/,1577893464,1,0
fcqwyr1,t3_eiihew,t3_eiihew,Contact some lawyer. And try to study property laws on your own too.,GymBoyBae,,t2_1fgzrheq,/r/india/comments/eiihew/help_with_ancestral_property_causing_a_lot_of/fcqwyr1/,1577893479,1,0
fcqwyv7,t1_fcqwqpo,t3_eijgob,No. This is reality. It is inspired by the concept in your source.,magenta_riddim,,t2_37ag46ev,/r/india/comments/eijgob/took_this_photo_of_my_random_village_in_majuli/fcqwyv7/,1577893481,1,0
fcqwyzb,t3_eiemdm,t3_eiemdm,This is what a dystopian urban jungle looks like eh ?,buzzenwired,,t2_zxq4i,/r/india/comments/eiemdm/woke_up_to_a_magnificent_view_of_pune_city_behind/fcqwyzb/,1577893482,1,0
fcqx1hn,t1_fbflhh3,t3_ecvoa4,TIL!,gimmeanyusernamewtf,,t2_37bjjmh,/r/india/comments/ecvoa4/life_imitates_art/fcqx1hn/,1577893513,1,0
fcqx1k3,t1_fcqwo3h,t3_eii5h7,The city? It powers the whole state!,Chanzy94,,t2_zioji,/r/india/comments/eii5h7/i_see_your_blore_pune_and_goa_and_raise_you_my/fcqx1k3/,1577893514,1,0
fcqx1pp,t3_eijmxe,t3_eijmxe,Brrrrruuuaaaahh,diskoDeewana,,t2_4yrhwkv3,/r/india/comments/eijmxe/late_night_random_discussion_thread/fcqx1pp/,1577893516,1,0
fcqx2jj,t1_fcqf7zc,t3_eifhqy,All the best bud.,1dmendes02,,t2_50tw85j8,/r/india/comments/eifhqy/started_the_new_year_like_a_normie_mains_on_7th/fcqx2jj/,1577893527,1,0
fcqx3ds,t3_eijmv9,t3_eijmv9,Haters will say it is motherboard,HairLikeWinterFire,FPTP needs to go,t2_4sgwxujb,/r/india/comments/eijmv9/2020_is_here_and_noida_is_leading_the_charge/fcqx3ds/,1577893538,1,0
fcqx4g5,t3_eiiah7,t3_eiiah7,"This is seriously impressive... To the point where I'm actually doubting this to be true.

If it is, which I am beginning to think this is, I am so happy!",ki67,,t2_plpbh,/r/india/comments/eiiah7/4th_grade_social_science_textbook_of_central/fcqx4g5/,1577893551,1,0
fcqx55c,t1_fcpb1r7,t3_eid66v,First word problems,I_tongue_ass,,t2_36mujmbq,/r/india/comments/eid66v/hello_there_from_bangalore/fcqx55c/,1577893559,1,0
fcqx6mp,t1_fcqrq17,t3_eiicbs,They ain't getting married bruh. This isn't a Bollywood movie.,samistark86,,t2_1xpqfx,/r/india/comments/eiicbs/hardik_pandya_and_natasha_stankovic_are_medias/fcqx6mp/,1577893575,1,0
fcqx6w3,t1_fcqu9l4,t3_eidi5v,"Ooo_wee Police Bula Legi!


Phir Bhi Party Yunhi Chaalegi",samacknojia,Are we gonna fight or fuck?,t2_h8lozen,/r/india/comments/eidi5v/random_daily_discussion_thread_january_01_2020_at/fcqx6w3/,1577893578,1,0
fcqx8v9,t1_fcqtgj2,t3_eiicbs,Not bad for health though.,samistark86,,t2_1xpqfx,/r/india/comments/eiicbs/hardik_pandya_and_natasha_stankovic_are_medias/fcqx8v9/,1577893599,1,0
fcqx9io,t3_eihal2,t3_eihal2,Also govt: bans internet at the drop of a hat.,redfilmflow,,t2_b5p6y,/r/india/comments/eihal2/cbdt_to_fine_businesses_rs_5000day_for_not_using/fcqx9io/,1577893607,1,0
fcqx9zo,t1_fcqvph8,t3_eigzia,"&gt;Give me time while I reply every of your point

I will not be replying to  (probably) such low bar.",youindiayouwin,,t2_3gsnnm0w,/r/india/comments/eigzia/do_we_owe_an_apology_to_kashmir/fcqx9zo/,1577893613,1,0
fcqxbeb,t1_fcqoq37,t3_ea3sdp,Absolutely.,IAmMohit,Bigotry begets Bigotry,t2_b0ush,/r/india/comments/ea3sdp/cab_bill_2019_newsprotestseditorials_megathread/fcqxbeb/,1577893629,1,0
fcqxcui,t1_fcqw2g4,t3_eidi5v,Tu aur loud music baja *bol na aunty aao kya*,Leburnum,,t2_553bgnmr,/r/india/comments/eidi5v/random_daily_discussion_thread_january_01_2020_at/fcqxcui/,1577893645,1,0
fcqxcwy,t1_fcqwyv7,t3_eijgob,Please name the village and country 😇,Adimasterxx,,t2_41rtso5y,/r/india/comments/eijgob/took_this_photo_of_my_random_village_in_majuli/fcqxcwy/,1577893646,1,0
fcqxd1o,t1_fcqlb60,t3_eihhoi,Kavita Krishnan is also opposed to death penalty as a matter of principle.,that_70_show_fan,Telangana,t2_ciz0x,/r/india/comments/eihhoi/indians_pl_dont_ask_for_hanging_castration_etc_of/fcqxd1o/,1577893648,1,0
fcqxd31,t3_eijia2,t3_eijia2,My God the comment below is 🔥 ...😂😂😂,Paree264,,t2_1qsnqunq,/r/india/comments/eijia2/mallu_fanbois_be/fcqxd31/,1577893648,1,0
fcqxdri,t1_fcqu26a,t3_eihiuw,"Yes, but only for the sake of geopolitics, since they had a common enemy. Once britain is outta the way, it is just conquered brown slaves. Will never know since both of them died in mysterious ways.",jojo_joestar_69,,t2_58d6l19y,/r/india/comments/eihiuw/happy_new_year_superpower_2020/fcqxdri/,1577893655,1,0
fcqxeaj,t1_fcqix70,t3_eiiah7,ICSE being ahead of time.,samistark86,,t2_1xpqfx,/r/india/comments/eiiah7/4th_grade_social_science_textbook_of_central/fcqxeaj/,1577893661,1,0
fcqxekj,t1_fcqkni5,t3_eii0cx,And in real life too.  I live in the UK.  We have a lot of Poles here now and often I hear them say things that really are straight up Nazi stuff.,mahavishvarupa,,t2_2ab61i2l,/r/india/comments/eii0cx/future_generations_of_poles_who_found_refuge_in/fcqxekj/,1577893664,1,0
fcqxep8,t1_fcqx1pp,t3_eijmxe,briiiiii,covic999,Maharashtra,t2_12bbhxdn,/r/india/comments/eijmxe/late_night_random_discussion_thread/fcqxep8/,1577893666,1,0
fcqxf1u,t1_fcqwhjo,t3_eidi5v,:0,Leburnum,,t2_553bgnmr,/r/india/comments/eidi5v/random_daily_discussion_thread_january_01_2020_at/fcqxf1u/,1577893670,1,0
fcqxfuv,t1_fcqwbvj,t3_eidi5v,"Good one bro

Keep em coming",Ooo_weee,15 LAKHS RECEIVED ,t2_592kdp14,/r/india/comments/eidi5v/random_daily_discussion_thread_january_01_2020_at/fcqxfuv/,1577893678,1,0
fcqxg4v,t1_fcqxcwy,t3_eijgob,It's in the title.,magenta_riddim,,t2_37ag46ev,/r/india/comments/eijgob/took_this_photo_of_my_random_village_in_majuli/fcqxg4v/,1577893682,1,0
fcqxg9w,t1_fcqrjvy,t3_eiihew,One of my teacher told the same thing. Instead of fighting with family members love somewhere else and build your own future.,msareddit123,,t2_12y3ehw9,/r/india/comments/eiihew/help_with_ancestral_property_causing_a_lot_of/fcqxg9w/,1577893684,1,0
fcqxhia,t1_fcpd9h2,t3_eieqq6,"Wait.. if government is filled with dynasts, politics is filled with dynasts and Business is filled with dynasts .. where is the merit?",HairLikeWinterFire,FPTP needs to go,t2_4sgwxujb,/r/india/comments/eieqq6/uddhav_thackeray_once_a_critic_of_dynastic/fcqxhia/,1577893698,1,0
fcqxhxw,t1_fcqx6w3,t3_eidi5v,Bhai fail ho jaunga wo chalega?,Ooo_weee,15 LAKHS RECEIVED ,t2_592kdp14,/r/india/comments/eidi5v/random_daily_discussion_thread_january_01_2020_at/fcqxhxw/,1577893703,1,0
fcqxi8k,t1_fcqxep8,t3_eijmxe,Bhaiiijaaannn,Leburnum,,t2_553bgnmr,/r/india/comments/eijmxe/late_night_random_discussion_thread/fcqxi8k/,1577893706,1,0
fcqxjbi,t1_fcqxcui,t3_eidi5v,Speakers de do koi,Ooo_weee,15 LAKHS RECEIVED ,t2_592kdp14,/r/india/comments/eidi5v/random_daily_discussion_thread_january_01_2020_at/fcqxjbi/,1577893719,1,0
fcqxk07,t3_eif5xl,t3_eif5xl,Achhe din aa gaye 💃🕺,leon_nerd,,t2_d9css,/r/india/comments/eif5xl/hello_from_goa_was_surprised_to_see_so_much/fcqxk07/,1577893727,1,0
fcqxk5p,t3_eiikfo,t3_eiikfo,Amazingly suddenly communal by right wing ...They're just looking for anything to say because they're put in a difficult position by the unexpected resilience against CAA which makes it difficult to implement NRC,Spideyocd,India,t2_3kan7z92,/r/india/comments/eiikfo/hum_dekhenge_we_shall_see_by_faiz_ahmed_faiz/fcqxk5p/,1577893729,1,0
fcqxko4,t1_fcqsag3,t3_eiiah7,Why not one dad and 4 mom?,samistark86,,t2_1xpqfx,/r/india/comments/eiiah7/4th_grade_social_science_textbook_of_central/fcqxko4/,1577893734,1,0
fcqxlhy,t1_fcqxjbi,t3_eidi5v,Unse hi maang le,Leburnum,,t2_553bgnmr,/r/india/comments/eidi5v/random_daily_discussion_thread_january_01_2020_at/fcqxlhy/,1577893744,1,0
fcqxmcg,t1_fcqxi8k,t3_eijmxe,Bahenjiiii,diskoDeewana,,t2_4yrhwkv3,/r/india/comments/eijmxe/late_night_random_discussion_thread/fcqxmcg/,1577893754,1,0
fcqxmgj,t1_fcqxhxw,t3_eidi5v,Nai chalegi! Nai chalegi! Aunty ki loud party nai chalegi!,samacknojia,Are we gonna fight or fuck?,t2_h8lozen,/r/india/comments/eidi5v/random_daily_discussion_thread_january_01_2020_at/fcqxmgj/,1577893755,1,0
fcqxne9,t3_eiiah7,t3_eiiah7,*happy APJ Abdul Kalam noise*,jumbled_joe,,t2_2osfbr05,/r/india/comments/eiiah7/4th_grade_social_science_textbook_of_central/fcqxne9/,1577893766,1,0
fcqxnei,t1_fcqwtny,t3_eigzia,"No, you have not mentioned it in the post. 

This is rape done by MILITANTS. 

Could you add it ? It adds much needed perspective.",funny_penis,,t2_8kcam,/r/india/comments/eigzia/do_we_owe_an_apology_to_kashmir/fcqxnei/,1577893766,1,0
