id,name,title,score,subreddit,url,num_comments,selftext,author,num_crossposts,over_18,permalink,pinned,subreddit_type,link_flair_text,author_flair_text,total_awards_received,upvote_ratio,time_created,comment
g5al52,t3_g5al52,Bengaluru: Locals attack ASHA workers on COVID-19 screening duty,29,india,https://www.theweek.in/news/india/2020/04/02/bengaluru-locals-attack-asha-workers-covid-19-duty.html,0,,crazymaverick,0,False,/r/india/comments/g5al52/bengaluru_locals_attack_asha_workers_on_covid19/,False,public,Non-Political,,0,0.85,2020-04-21 12:41:47, 
g5ajt6,t3_g5ajt6,This Doctor From Kashmir Uses Machine Learning To Crunch Coronavirus Data,43,india,https://www.forbes.com/sites/andrewwight/2020/04/19/this-doctor-from-kashmir-uses-machine-learning-to-crunch-coronavirus-data/,1,,lachrymator2019,0,False,/r/india/comments/g5ajt6/this_doctor_from_kashmir_uses_machine_learning_to/,False,public,Coronavirus,Snowflakes Everywhere,0,0.86,2020-04-21 12:38:40, 
g5ahy3,t3_g5ahy3,Indian Envoy condemns hate-speech by Indians in the UAE,28,india,https://www.thehindu.com/news/national/indian-envoy-condemns-hate-speech-by-indians-in-the-uae/article31392067.ece/,4,,silentr3b31,0,False,/r/india/comments/g5ahy3/indian_envoy_condemns_hatespeech_by_indians_in/,False,public,Politics,,0,0.77,2020-04-21 12:34:23,"  modi and his IT cell trolls shat their chaddis courtesy gulf countries this week Only *after* a backlash during a national disaster. Otherwise, for last 6 years, these glorified clerks were all chuckling at the same tweets. >Discrimination is against our moral fabric and the Rule of law. **Indian nationals in the UAE** should always remember this

Is he indirectly saying India jaake discriminate karo?"
g5af6s,t3_g5af6s,"WTI May crude futures crashes over 300% to -$36.90 a barrel on scant storage, weak demand",15,india,https://www.moneycontrol.com/news/business/commodities/wti-crude-futures-for-may-delivery-plummets-over-88-to-2-17barrel-5168491.html,0,,Ku_hu,0,False,/r/india/comments/g5af6s/wti_may_crude_futures_crashes_over_300_to_3690_a/,False,public,Business/Finance,,0,1.0,2020-04-21 12:28:16, 
g5aaz7,t3_g5aaz7,Indian artists warned against online collaborations with Pakistanis,4,india,https://images.dawn.com/news/1185053/indian-artists-warned-against-online-collaborations-with-pakistanis,3,,kingof-potatos,0,False,/r/india/comments/g5aaz7/indian_artists_warned_against_online/,False,public,Politics,,0,0.62,2020-04-21 12:18:00,  Why can't we have good things. This was so entertaining and the collabs were really soothing. Haan yeh karlo pehle
g5a979,t3_g5a979,"Palghar lynching: When police watches helplessly, where does one go for justice, asks wife of deceased",515,india,https://indianexpress.com/article/india/palghar-lynching-when-police-watches-helplessly-where-does-one-go-for-justice-asks-wife-of-deceased-6371593/,58,,aviakki1,0,False,/r/india/comments/g5a979/palghar_lynching_when_police_watches_helplessly/,False,public,Non-Political,,0,0.98,2020-04-21 12:13:36,"  [removed] [removed] But according to Indian Media police is always right and talking against them is anti-national. [The Wire had already reported two years ago about the State Apathy towards this particular tribe when BJP was ruling the state and Fadnavis was the CM.](https://thewire.in/rights/maharashtra-lynching-nath-panthi-davari-gosavi)This Palghar incident was not the first and it's not going to be the last. There is severe social apathy, whatsapp rumours against the people of this tribe. The only reason why this particular incident got so much coverage is because the Right Wing made it out to be a communal incident when in fact it was not. Lagegi aag to ayenge sabhi ghar jad mei, yaha sirf hamara makan thodi hh

-Rahat Indori How is the narrative of communal angle fits here? Are the mob from another religion or something?

edit: down vote for just asking? nice [removed] Well sure downvote me, but it has been debunked
https://www.altnews.in/palghar-lynching-incident-falsely-com"
g5a7bo,t3_g5a7bo,Govt preparing for a second wave towards May end as lockdown eases,99,india,https://indianexpress.com/article/india/govt-preparing-for-a-second-wave-towards-may-end-as-lockdown-eases-6371750/,8,,GL4389,0,False,/r/india/comments/g5a7bo/govt_preparing_for_a_second_wave_towards_may_end/,False,public,Coronavirus,,0,0.99,2020-04-21 12:08:59,"  Wtf. We never got a lockdown ease lol. The one state that tried to do (Kerela) got thrown under the train This government is constantly in either preparatory mode or election mode or damage mode... Social distancing not even once. I don't think sanghis even care about second wave. All they want to do is become world championships by showing how they controlled the spread of the virus when people in west were dying. That's a pretty sound strategy. Atleast we are listening to experts in this country. And the populous for whatever reason, trusts scientists and doctors to show us the way forward. Like any sane country minus usa"
g5a778,t3_g5a778,How the UAPA Repackages Ideas As Crimes,10,india,https://www.article-14.com/post/how-the-uapa-repackages-ideas-as-crimes,0,,Dumma1729,0,False,/r/india/comments/g5a778/how_the_uapa_repackages_ideas_as_crimes/,False,public,Policy/Economy,,0,0.75,2020-04-21 12:08:42, 
g5a1hi,t3_g5a1hi,Palghar lynching incident falsely communalised on social media - Alt News,59,india,https://www.altnews.in/palghar-lynching-incident-falsely-communalised-on-social-media/?utm_source=website&utm_medium=social-media&utm_campaign=newpost,1,,Dumma1729,0,False,/r/india/comments/g5a1hi/palghar_lynching_incident_falsely_communalised_on/,False,public,Politics,,0,0.78,2020-04-21 11:54:46,  Arbab Goswami resigned due to this. Talk about irony.
g59zou,t3_g59zou,"TV anchor Arnab Goswami resigns from the Editors Guild of India, live on air",129,india,https://scroll.in/video/959791/watch-tv-anchor-arnab-goswami-resigns-from-the-editors-guild-of-india-live-on-air,34,,suntanx_02-24,0,False,/r/india/comments/g59zou/tv_anchor_arnab_goswami_resigns_from_the_editors/,False,public,Non-Political,Non Residential Indian,0,0.9,2020-04-21 11:50:33,"  I have a few questions:

1. What is the Editor's Guild of India? What do they do? Why haven't most people heard it till now? 
2. What was Arnab's position in the Guild?
3. How does it affect him that now he has resigned from the Guild?
4. What comments did he expect from the Guild about the Palghar incident? He blamed the Guild for not speaking about it. Why couldn't he report the incident as a member of the guild? 

Very important note: These questions are not an invitation to argue. These questions are being asked in good faith. Please refrain from replying anything other than factual answers. Good riddance. EGI gained more credibility with Arnab leaving. He should just call his channel The BJP Channel. The first half got me. I thought he's finally ashamed of what he's doing and resigned from Republic. I recently saw a peeinghuman video in which he bashed a guy for speaking against Modi.
Agar aap Modi ke khilaaf hai, toh aap desh ke khilaaf hai. Line pe aajaiye aur Modi ji ko accep"
g59zn1,t3_g59zn1,"‘Demons, Jihadi Virus’: Kannada Media on B’luru COVID-19 Violence",107,india,https://www.thequint.com/news/india/rakshas-jihadi-virus-tv-channels-on-bluru-covid-19-violence,21,,Dumma1729,0,False,/r/india/comments/g59zn1/demons_jihadi_virus_kannada_media_on_bluru/,False,public,Coronavirus,,0,0.89,2020-04-21 11:50:25,"  Why the f\*ck do these people turn everything into communal hatred? The battle is long but once all this is over, we'd need our own version of Vergangenheitsbewältigung Public TV. It's same guy channel who broadcasted helicopter money episode Bhakt brigade trying to suppress the news. Why can't you criticize people without generalising their entire community and religion? Karnataka, the UP of the south. can confirm, our local media is shit, awful, and puke inducing. When did Karnataka become this ?"
g59xr2,t3_g59xr2,"Pakistani student, whom Sadhguru called 'Taliban', named in Forbes list",297,india,https://www.theweek.in/news/world/2020/04/21/pakistani-student-whom-sadhguru-called-taliban-named-in-forbes-list.html,40,,Lund_Fried_Rice,0,False,/r/india/comments/g59xr2/pakistani_student_whom_sadhguru_called_taliban/,False,public,Politics,,0,0.88,2020-04-21 11:45:53,"  I found out about this guy from Twitter. Turns out his brother is the guy who went viral after the India Pakistan match at last year's World Cup. Oooo bhai maro mujhe :-D LSESU press report after Sadguru going Savarkar

>LSESU stands firmly on our above stance and deem the comments to be Islamophobic. We do not believe the video was ""mischievously edited” and have heard no reports supporting the common use of ‘Taliban’ in India as meaning over-enthusiastic. 

>We believe that individuals who have many followers, hold power and status, and claim to promote tolerance, should be aware of and sensitive, to the political and extremist connotations attached to the word ‘Taliban’ in our current context. Casual Islamophobia such as this perpetuates the culture of misunderstanding and judgement. Sadhguru made a huge scam for bringing water in cauvery and amassed millions. But didn't move a tiny shite to bring water. Youtube gold, in [that video](https://www.youtube.com/watch?v=9IMy3Efxp8E)

*"
g59xq7,t3_g59xq7,[Prediction] It's happening. The campaign machinery of BJP has started rooting for Yogi Adityanath as the next PM of India.,249,india,https://www.reddit.com/r/india/comments/g59xq7/prediction_its_happening_the_campaign_machinery/,129,"So ever since the news of Yogi Adityanath not attending the last rites of his deceased father came out, the godi media has started their campaign of showing him as the next saint India needs. [Check](https://ibb.co/LnqC6hn) this out.

Get ready randia. We are gonna have a religious fanatic as our Supreme Leader soon.",beech_lasagna,0,False,/r/india/comments/g59xq7/prediction_its_happening_the_campaign_machinery/,False,public,Politics,,0,0.85,2020-04-21 11:45:49,"  Where are they rooting for him as the next PM though. 

Amit Shah is way higher in the pecking order. Expecting him to be the candidate in 2028 Its not new. This started in the first year of Yogi itself. Then quietened down. Now starts again. The idea is that even if he never becomes PM, the seed is planted - that an aggressive, angry monk may one day be PM of India. That would please many for whom that potential matters above everything else. Anyone outside of UP  even likes this monkey? He can't speak, looks like voldemort, and has peanut for a brain. Modi has a way with words. This dumbo doesn't even have that going for him. We're gonna be a Hindu Iran then. >We are gonna have a religious fanatic as our Supreme Leader soon.

The present emperor already fits the bill. My family & friends Sanghi brigade would actually laugh at the idea (in 2014-15) that he will ever get a shot at the PM's chair. They'd say, 'ofcourse not Adityanath. Not him no way. After Modi, it will be Shah. After"
g59x2i,t3_g59x2i,‘Transgender’ to be added as separate category in job applications: Centre to depts - education - Hindustan Times,68,india,https://www.hindustantimes.com/education/transgender-to-be-added-as-separate-category-in-job-applications-centre-to-depts/story-TyRm1xmi27uaWVLLMlVgrL.html,5,,doomer_in_disguise,0,False,/r/india/comments/g59x2i/transgender_to_be_added_as_separate_category_in/,False,public,Policy/Economy,India,0,0.94,2020-04-21 11:44:11,"  Also add atheist in survey forms Doesn't ""Third Gender"" already exist in govt. forms? I might be wrong. But we still disrespect them and make them quit"
g59unn,t3_g59unn,U.S. oil plunges below $0 a barrel: What does a negative futures price mean?,35,india,https://www.thehindu.com/business/what-is-a-negative-crude-future-and-does-it-mean-anything-for-consumers/article31393336.ece,5,,aviakki1,0,False,/r/india/comments/g59unn/us_oil_plunges_below_0_a_barrel_what_does_a/,False,public,Business/Finance,,0,0.91,2020-04-21 11:38:17,  Oil is a hedged market. Price changes do not immediately make major impact on the consumers and producers of oil. [deleted] mota bhai ka share girega ki nahi?
g59ms4,t3_g59ms4,Republic’s Arnab Goswami Quits Editors Guild of India on Live TV,246,india,https://www.thequint.com/news/india/arnab-goswami-republic-tv-lynching-palghar-resignation-editors-guild-shekhar-gupta,96,,sudden_dust,0,False,/r/india/comments/g59ms4/republics_arnab_goswami_quits_editors_guild_of/,False,public,Non-Political,:snoo_shrug:,0,0.94,2020-04-21 11:20:08,"  How does this guy sleep at night? So much hate must have its effect on the stability of the mind. > I accuse you Shekhar Gupta of leading the compromise on journalism for not speaking on incidents like this.

Pot, Kettle.

""Doorknob"" should be one of the last people to talk about journalistic integrity. Saffron Stooge. Over the years, I've despised many many public figures in television, media, movies, government etc. But nobody has ever made me want to punch them square in the face so much like this guy has. 

Every. Single. Fucking. Day. When I tried to study, this moron's screaming would come out of that stupid television from the hall. At first, people were overjoyed that there was a journalist who could ask such brazen questions to people the rest of the country was afraid to oppose. But as time went on, the questions weren't brazen anymore. Just utterly fucking stupid. And his signature move is to yell out their name ""Missssster xyz. Lisssssten to me. Sir sir misssteerrrr LISTE"
g59jnx,t3_g59jnx,"Why aren't there movies made about important African (Habshi) figures in Indian history? In general, there seems to be so little discussion of Africans and their important historical role in India.",228,india,https://www.reddit.com/r/india/comments/g59jnx/why_arent_there_movies_made_about_important/,186,"So, I recently did a TON of research and made a video on a man named Malik Ambar.  He's an Ethiopian slave who became a de facto king in the Deccan and successfully defended his kingdom against Mughal invasion.  What shocked me is how I would not have ever known about his existence if I wasn't already doing a deep-dive into Deccan history.

His narrative is incredible.

This man was sold into slavery by his own parents, then climbed his way to the top of the Ahmadnagar Sultanate and led a Deccan resistance movement against the Mughal Empire.  Jahangir was so pissed off that he had a painting commissioned of himself shooting Malik Ambar in the head with an arrow.

Why is there so little interest in the Habshi community and their historical exploits?

I mean, Malik Ambar is not even the only one with an interesting story.  There's the Bijapur minister Ikhlas Khan, there's the Habshis who took over the Bengal Sultanate, the independent Habshi pirates of Janjira Island, and more.

Thoughts?

It struck me as particularly strange, as many African communities in India are treated poorly today.  Seems like if more people knew how intricately tied they are to our histories, there would be more respect.

Edit: as people are asking me to post the link here for added visibility, [https://youtu.be/beXIBdLvvPc](https://youtu.be/beXIBdLvvPc).",oddcompass,0,False,/r/india/comments/g59jnx/why_arent_there_movies_made_about_important/,False,public,Non-Political,,1,0.94,2020-04-21 11:12:46,"  1. It's a regional empire - most regional histories are underweighted, ignored  in India. This is a major factor

2. It's not particularly resonant with existing state governments and parties in power.  eg maharashtra is shivaji this and shivaji that. No particular state takes up some of these stories now like the sultanate

3. It is not super recent.  History in itself is not told well, except as lip service, rote elements, fables, vague allusions to great indian past/ history, or injustice done by brits , etc etc . Few people really take to studying history.

4. It doesn't bespeak any broad trends in history - eg colonialism, nation state etc.

5. Malik Amber, on the face of it doesn't scream african or escaped slavery background.

There are a lot of people with interesting stories in history whose stories could be told.

If you can tell his story in an interesting fashion, you *should* try. Racism could be a reason seeing how they are treated in society today.

PS. You should post"
g59f50,t3_g59f50,"In Mumbai, 53 journalists found to be Covid-19 positive",32,india,https://www.thehindubusinessline.com/news/in-mumbai-53-journalists-found-to-be-covid-19-positive/article31390756.ece,0,,proyo7,0,False,/r/india/comments/g59f50/in_mumbai_53_journalists_found_to_be_covid19/,False,public,Coronavirus,,0,0.94,2020-04-21 11:02:17, 
g58hky,t3_g58hky,How are you using free time because of lockdown?,7,india,https://www.reddit.com/r/india/comments/g58hky/how_are_you_using_free_time_because_of_lockdown/,19,"Hi All, I am recently having lots of free time because of no commuting, no gyms or going out. And I have found that have more than 4-5 hours of spare time everyday. I was wondering how others are spending it.",kaashaisahota,0,False,/r/india/comments/g58hky/how_are_you_using_free_time_because_of_lockdown/,False,public,Non-Political,,0,0.69,2020-04-21 09:49:19,"  Watching TV series, playing old Smackdown vs Raw games on PC using emulator and returned to the grind fest which is Clash of Clans. Smoking ganja every night, binge-watching stuff and reading a lot. And I exercise every day after work. by playing chess tactics

[https://chesstempo.com/chess-tactics/](https://chesstempo.com/chess-tactics/) Work till 12

Sleep

 Exercise 

GTA5, RDR2 Masturbating, gaming and even more masturbating. Also cuddling with my dog. Sleeping, playing games ghanta padai ho rahi hai yahan csgo with friends Playing games, watching the Grand Tour and trying my best to complete the Udemy courses that I have pending. Bruh I finished 7 video games"
g58mf6,t3_g58mf6,PROBLEMS OF ONLINE CLASSES!,8,india,https://www.reddit.com/r/india/comments/g58mf6/problems_of_online_classes/,5,"Hello everyone, every other school now has started teaching online and most of them don't care if total strength is attending or not they just join and teach and leave. They give a lot of homework! and projects to complete which have time till July!  What if a student's pen ink is finished? Now how can he go out and buy pens? Is it even right to conduct online classes during this crisis time? These schools only care about the fees. They are teaching online only because they can at least take half monthly fees!   Some teachers don't even care how the quality is! Why are they even teaching when half of them don't understand! Some wont have a WiFi! What about them? DO they have to use mobile data for an online streaming like teaching?",VishruthSiddi,0,False,/r/india/comments/g58mf6/problems_of_online_classes/,False,public,AskIndia,,0,0.71,2020-04-21 09:58:58,"  These are the problems you all should communicate to the school, no?

It's going to be tougher than live class, I don't know about the fees but if schools won't be open for a long time to come then I think online classes will be the way forward to keep the academic year going. Schools should indeed give some concession with fee, as students are not using their infrastructure they are saving enormous expenses on maintenance, electricity and so on.


And online teaching cannot be compared with physical classes.

Schools should ask not more than 50% of fees if schools remain close for next few months.
And mind it schools are only conducting online class as a reason to validate their fee demand they don't care about quality most of schools are using zoom free account and take classes for 40min as it's the limit.
If whole economy is suffering schools cannot expect to have fees on velvet pillow.



And don't get me started about colleges. But this isn't just something Indians are going thr"
g598g3,t3_g598g3,Which tax regime to choose for TDS from salary?,6,india,https://www.reddit.com/r/india/comments/g598g3/which_tax_regime_to_choose_for_tds_from_salary/,1,"https://economictimes.indiatimes.com/wealth/tax/how-to-choose-the-tax-regime-for-tds-on-salary-for-fy2020-21/articleshow/75244544.cms

Old regime or New regime??",Sea-Belt,0,False,/r/india/comments/g598g3/which_tax_regime_to_choose_for_tds_from_salary/,False,public,Business/Finance,,0,0.88,2020-04-21 10:46:39,"  https://www.google.co.in/amp/s/www.financialexpress.com/money/income-tax/new-tax-regime-calculator-for-fy-2020-21-compare-tax-under-old-and-new-regime-on-e-filing-website/1860732/lite/
.
.
I found this article to be the best. Have a quick read and I hope it helps you choose."
g5979d,t3_g5979d,"12-Year-Old Walks 3 Days Amid Lockdown, Dies Just An Hour From Home",2038,india,https://www.ndtv.com/india-news/coronavirus-lockdown-12-year-old-walks-3-days-amid-lockdown-dies-just-an-hour-from-home-2215346,214,,Mulaayam_Yadav,1,False,/r/india/comments/g5979d/12yearold_walks_3_days_amid_lockdown_dies_just_an/,False,public,Coronavirus,Go Karuna go,0,0.96,2020-04-21 10:44:00,"  Migrant workers are facing the absolute worst of this pandemic. I hope everyone does their bit to help the migrants around them. It could be food or monetary donation. Unlike people who think this is because of the pandemic, this problem is actually due to Child-Labour (why else would a child be so far away from home?), a problem so widespread in India and was very much prominent before the pandemic. The only thing this pandemic has done is expose the already prevalent problems... That's so heartbreaking. Why was a 12 year old allowed to work in ""the chilly fields at a village in Telangana"" in the first place? The article says nothing about punishments being meted out to her employers or the people or the family circumstances that drove her to manual work at such a young age. Is there a way that one can make a contribution that directly alleviates their situation? This poor child walked for 3 days and dropped dead. How we have become so heartless? Jamlo Makhdam should have gone to sc"
g592r3,t3_g592r3,We should start minting coins with different shapes or with holes.,21,india,https://www.reddit.com/r/india/comments/g592r3/we_should_start_minting_coins_with_different/,16,"It is too difficult to figure out the value of a coin by just looking at the size. There are 2 one rupee coins in circulation, the older one rupee coin is almost the same size as the newer 2 rupee coin. It is necessary to read the amount on the coin before paying.

If we make coins with different shapes or with different number of holes according to the denomination would be easier to figure out the value without reading. Remember the old 2 rupee coin used to be some polygon instead of a circle and the 5, 10 ,20 paise used to be different shapes. If the coins have different shapes, the shapes can be maintained even with the coins are being resized to ease perceiving the value.",tanaysoley,0,False,/r/india/comments/g592r3/we_should_start_minting_coins_with_different/,False,public,Non-Political,,0,0.81,2020-04-21 10:34:14,"  My guess is India will print one and five rupee notes and slowly withdraw all denominations of coins in circulation. Incoming inflation will make coins impractical and inefficient! Don't give new ideas for demonetization season 2 please I think 1, 2 & 5 rupee coins will lose their value in the next 5-10 years. You will not be able to use them for any purpose just like the 50 paise coin of today. I would have to say I agree with this. I visited from America at the beginning of March, before everything got crazy. It was cool to see the different coins, but it did become a little bit of a pain when going through the toll booths.   
Here in America, all 4 of our coins (we have more, like 1/2 dollar and dollar coins, but they are never used, and most stores don't like taking them) are different shapes. We have .01 , .05, .10 , and .25. The .25 is the biggest, the .10 is the smallest, the .05 and .25 are a little thicker, and the .10 is the smallest and thinest. Why don't we have coins for"
