id,parent_id,link_id,body,author,author_flair_text,author_fullname,permalink,created_utc,score,total_awards_received
fcqn9im,t3_eiigqt,t3_eiigqt,"&gt;Justice Kurian Joseph said that all the constitutional institutions in the country were facing a credibility crisis like never before.

Going to be honest here, This fuckers waking up after retirement and speaking truth when it does not make any changes except big hardline are frankly means shit. Kurian Joseph, Arvind Subramanian are all the same. 

Be like Ashok Lavasa instead. He is.speaking what's right!",Gavthi_Batman,सब बझिंगा सी..,t2_35yili2z,/r/india/comments/eiigqt/i_regret_njac_decision_after_seeing_things_now/fcqn9im/,1577888984,1,0
fcqnahv,t1_fcqjlea,t3_eif3kr,So Muslims singing the Pakistan National anthem are proving their loyalty to Pakistan?,Crocbro_8DN,Chidiyatapu,t2_3pa8n04o,/r/india/comments/eif3kr/jamia_millia_islamia_welcoming_new_year_2020_with/fcqnahv/,1577888997,1,0
fcqnbws,t3_eig6im,t3_eig6im,"IIT - indian institute of technology.
Does it have a literature wing too?",kindasapien,Chandigarh,t2_4hucfhzq,/r/india/comments/eig6im/bizarre_iitkanpur_panel_to_decide_if_faiz_poem/fcqnbws/,1577889016,1,0
fcqng4j,t3_eihfv4,t3_eihfv4,Don't see Modi fucking the cow? How the hell did it get away? Bloody anti-national cow.,desultoryquest,,t2_br0y9,/r/india/comments/eihfv4/just_stepped_out_of_my_house_and_saw_this/fcqng4j/,1577889068,1,0
fcqngkr,t3_eiivmo,t3_eiivmo,"Official Website by Government:  
[https://ceir.gov.in/Home/index.jsp](https://ceir.gov.in/Home/index.jsp)  
The user can block the device by **any one** of the following means:                                          

* Through a form submitted on this website. The procedure to do it is as follows: -                                                  

1. File a report with the police, and keep a copy of the report.
2. Get a duplicate SIM Card for the lost number from your telecom service provider (eg, Airtel, Jio, Voda/Idea, BSNL, MTNL etc.).
3. Get your  documents ready - a copy of police report and an Identity Proof must be  provided. You can also provide the mobile purchase invoice.
4. Fill out the request registration form for blocking the IMEI of lost/stolen phone, and attach the required documents. [Click here](https://ceir.gov.in/Request/CeirUserBlockRequestDirect.jsp) to go to the form.
5. After submitting  the form, you will be given a Request ID. The same can be used for  checking the status of your request and for unblocking the IMEI in  future.

* Through TSP’s specified customer outlets.
* Through State Police.",amreddish,देश का नागरिक,t2_cg7nzn,/r/india/comments/eiivmo/block_recover_stolen_mobile_using_imei_central/fcqngkr/,1577889074,1,0
fcqnitb,t1_fcqlb60,t3_eihhoi,"Read the gazette.
Imprisonment from 10 years upto life in prison plus a fine.",in3po,"opinion is free, but facts are sacred",t2_13v7ya,/r/india/comments/eihhoi/indians_pl_dont_ask_for_hanging_castration_etc_of/fcqnitb/,1577889104,1,0
fcqnkgf,t1_fcn393x,t3_ei2hmb,Normie alert,Supermutant22,Bangalore,t2_e342oz1,/r/india/comments/ei2hmb/brace_yourselves_we_are_less_than_6_hours_away/fcqnkgf/,1577889126,1,0
fcqnkub,t3_eie7xz,t3_eie7xz,"I saw that guy's face somewhere, does anyone know about him?",LogangYeddu,,t2_1g3tbvot,/r/india/comments/eie7xz/among_those_superpower_posts_a_superpower_meme/fcqnkub/,1577889132,1,0
fcqnmfv,t1_fcqmklq,t3_eig8ri,Hyderabadi spottted,AfzalOzil360,,t2_3ogn1jxm,/r/india/comments/eig8ri/a_restaurant_in_hyderabad/fcqnmfv/,1577889156,1,0
fcqnmr6,t1_fcqfuux,t3_eiiah7,Deviant - mindhunter terminology,kindasapien,Chandigarh,t2_4hucfhzq,/r/india/comments/eiiah7/4th_grade_social_science_textbook_of_central/fcqnmr6/,1577889159,1,0
fcqnnnw,t3_eiiah7,t3_eiiah7,Love this,inkyfingers7719,,t2_4y1xyxnv,/r/india/comments/eiiah7/4th_grade_social_science_textbook_of_central/fcqnnnw/,1577889170,1,0
fcqnnxd,t1_fcqgatx,t3_eiicbs,I just love these timely lines!...Reddit really comes up with one line gem,Spideyocd,India,t2_3kan7z92,/r/india/comments/eiicbs/hardik_pandya_and_natasha_stankovic_are_medias/fcqnnxd/,1577889173,1,0
fcqnr3a,t1_fcqnkub,t3_eie7xz,Show- Pawn Stars,AimHrimKleem,Baad main dekh lenge,t2_4v3v73ai,/r/india/comments/eie7xz/among_those_superpower_posts_a_superpower_meme/fcqnr3a/,1577889217,1,0
fcqns6q,t1_fcqfuux,t3_eiiah7,"Yeah what an idiots, infesting bad things in childs mind. 

India bAd, now gibme upbotes.",t2upac,,t2_5a2b457v,/r/india/comments/eiiah7/4th_grade_social_science_textbook_of_central/fcqns6q/,1577889233,1,0
fcqntb7,t3_eid66v,t3_eid66v,But why has Bangalore architects choosen monochrome theme,ave1894,,t2_pd5us15,/r/india/comments/eid66v/hello_there_from_bangalore/fcqntb7/,1577889248,1,0
fcqntix,t1_fcqjfij,t3_eidi5v,Stud hai waise toh,BuntyFromPremNagar,Non Residential Indian,t2_40pyv6e5,/r/india/comments/eidi5v/random_daily_discussion_thread_january_01_2020_at/fcqntix/,1577889251,1,0
fcqntok,t1_fcqkecn,t3_eigs8n,"Try this

https://np.reddit.com/r/india/comments/eihhoi/indians_pl_dont_ask_for_hanging_castration_etc_of",in3po,"opinion is free, but facts are sacred",t2_13v7ya,/r/india/comments/eigs8n/modi_bjp_are_creating_a_climate_of_fear_in_india/fcqntok/,1577889254,1,0
fcqnu41,t1_fcqmqu6,t3_eidi5v,"Thanks for introducing me to bahu kale ki, aaj kal Bhojpuri songs kuch zyada hi electronic ho rahe hain. He did dance a little on a song which goes like ""bala bala shaitaan ka saala"" to mock takla physics sir.",Acetylated_Morphine,,t2_3trhnlx2,/r/india/comments/eidi5v/random_daily_discussion_thread_january_01_2020_at/fcqnu41/,1577889261,1,0
fcqnvfr,t3_eigoeh,t3_eigoeh,"Its legit, they are a 100% real finance company, if your order doesnt get confirmed then you will eventually get your money back,  just give it some time.",LowerAcanthopterygii,,t2_tydrjbb,/r/india/comments/eigoeh/snapmintcom_legit_please_help/fcqnvfr/,1577889280,1,0
fcqnxir,t1_fcqmnac,t3_eiir33,adding to India's unemployment rate.,xuxebiko,quotes cheesy movie dialogues,t2_134h9i0v,/r/india/comments/eiir33/to_cut_cost_pm_modi_cuts_size_of_his_personal/fcqnxir/,1577889309,1,0
fcqnyst,t3_eiivmo,t3_eiivmo,"**Verify if you are buying a stolen phone (phone with blocked IMEI)**  
Know Your Mobile (KYM)

Through KYM, you can check  the validity of your mobile device even before buying it. IMEI is written on the mobile  packaging box. It could be found on the mobile bill/invoice. From your  mobile you can check the IMEI number by  dialling \*#06#, IMEI number will be shown on mobile screen.  If the status of the mobile is shown as  Black-listed, duplicate or already in use, please avoid buying the  mobile. KYM could be used through  any of the following 3 methods.

SMS / KYM app / Web portal.

See: [https://ceir.gov.in/Home/index.jsp](https://ceir.gov.in/Home/index.jsp)",amreddish,देश का नागरिक,t2_cg7nzn,/r/india/comments/eiivmo/block_recover_stolen_mobile_using_imei_central/fcqnyst/,1577889328,1,0
fcqo436,t1_fcqnu41,t3_eidi5v,[yeh video dekho](https://youtu.be/oIQMXXMZvF8),BuntyFromPremNagar,Non Residential Indian,t2_40pyv6e5,/r/india/comments/eidi5v/random_daily_discussion_thread_january_01_2020_at/fcqo436/,1577889400,1,0
fcqo46c,t3_eihhoi,t3_eihhoi,"I'm afraid to ask, what and when is the news about?",aitchnyu,Kerala,t2_12o91i,/r/india/comments/eihhoi/indians_pl_dont_ask_for_hanging_castration_etc_of/fcqo46c/,1577889401,1,0
fcqo5bc,t3_eihf5q,t3_eihf5q,"_Hello Frends, Paani Peelo_",JaggaBomb,"Life was easy, I made it hard. ",t2_3k6sb7yb,/r/india/comments/eihf5q/by_2050_mumbai_and_chennai_will_be_under_water/fcqo5bc/,1577889417,1,0
fcqo5rk,t1_fcqhoj4,t3_eiiah7,[May you choke on a rainbow🏳️‍🌈](https://i.imgur.com/99zjGL4.gif),rohanshenoy,,t2_y4494,/r/india/comments/eiiah7/4th_grade_social_science_textbook_of_central/fcqo5rk/,1577889423,1,0
fcqo6h9,t3_eiduhh,t3_eiduhh,Why do we need HyperLoop again? Such a limited use case does not justify the cost IMHO.,morning_cawfee,,t2_bwqth,/r/india/comments/eiduhh/as_govt_fails_in_sealing_mou_for_hyperloop/fcqo6h9/,1577889433,1,0
fcqo6tx,t3_eiir33,t3_eiir33,"At the same time, he is also centralizing power and all decision making in himself and the PMO. I see this as him being a control freak who doesn't trust anyone and wants only 
yes men' in his vicinity.",xuxebiko,quotes cheesy movie dialogues,t2_134h9i0v,/r/india/comments/eiir33/to_cut_cost_pm_modi_cuts_size_of_his_personal/fcqo6tx/,1577889437,1,0
fcqo7mb,t3_eid66v,t3_eid66v,"Yeh tunnel bangalore airport to bangalore hai kya ?? lol,",IRSINGH271999,,t2_thzpv,/r/india/comments/eid66v/hello_there_from_bangalore/fcqo7mb/,1577889448,1,0
fcqocv2,t3_eihhoi,t3_eihhoi,I'm pretty sure state sponsored rape is a part of the UN's definition of genocide. At what point is it not hyperbole to describe the BJP's actions as genocide?,Oneiricl,,t2_6qyut,/r/india/comments/eihhoi/indians_pl_dont_ask_for_hanging_castration_etc_of/fcqocv2/,1577889512,1,0
fcqod0c,t1_fcqey2p,t3_eii3ip,they have a weird obsession with Israelis. any Israeli post will have at least one ''WE ARE WITH YOU!!'' or some other bullshit. maybe its due to Israel's reputation of being ''anti Muslim''.,fruity_frend,,t2_19ngnnmf,/r/india/comments/eii3ip/super_power_2020_guys_some_sanghi_made_this/fcqod0c/,1577889514,1,0
fcqod4o,t1_fcqo46c,t3_eihhoi,"&gt;A bedridden Maulana Asad Raza Hussaini, 66, both arms and both legs bandaged, “sobs in his sleep” and refuses to “show his face” to visiting relatives because, his family says, he cannot get over his humiliation by the police who stripped and tortured him in custody.

&gt;The police also detained and assaulted almost all the maulana’s 100-odd students from the Saadat hostel-cum-orphanage in Muzaffarnagar town, many of them minors and most of them orphans, local people said.



&gt;“The boys were denied access to the toilet at times, and some of them suffered **rectal bleeding** from the torture,” said Salman Saeed, local Congress politician and son of former MP Saiduzzaman Saeed, who lives nearby.

https://www.telegraphindia.com/amp/india/uttar-pradesh-police-accused-of-stripping-cleric/cid/1731127",in3po,"opinion is free, but facts are sacred",t2_13v7ya,/r/india/comments/eihhoi/indians_pl_dont_ask_for_hanging_castration_etc_of/fcqod4o/,1577889515,1,0
fcqodsw,t1_fcpu4sm,t3_eigoeh,"Chill out, its fine doesnt matter if its emi on a smartwatch, he wants a smartwatch and he is getting it the way that works well for him  without harming others.
Nothing wrong with that. 
Would be dumb to not get something you want and can using ""emi"" just cuz you got a long stick up your ass that makes you think that ""emi"" for a smartwatch is stupid.",LowerAcanthopterygii,,t2_tydrjbb,/r/india/comments/eigoeh/snapmintcom_legit_please_help/fcqodsw/,1577889524,1,0
fcqoe6x,t3_eihpdk,t3_eihpdk,Who cares. We are already superpower. Developed economies have slow growth rate.,HomophobicKundan,,t2_3dny8qqx,/r/india/comments/eihpdk/india_will_struggle_to_achieve_5_gdp_growth_in/fcqoe6x/,1577889530,1,0
fcqof10,t3_eihpdk,t3_eihpdk,/r/Suppapowa,i_Killed_Reddit,:table_flip:,t2_nl1wv,/r/india/comments/eihpdk/india_will_struggle_to_achieve_5_gdp_growth_in/fcqof10/,1577889542,1,0
fcqog0q,t3_eifhqy,t3_eifhqy,Mains January main kab se hone lage?,kindasapien,Chandigarh,t2_4hucfhzq,/r/india/comments/eifhqy/started_the_new_year_like_a_normie_mains_on_7th/fcqog0q/,1577889555,1,0
fcqoh5e,t3_eiiusl,t3_eiiusl,"This decade old article by noted historian and economist  Ramchandra Guha  the ten reasons why India will not become a superpower. Almost all the points hold true even after 10 years.

Extremism, both 1. Leftwing and 2. Rightwing
The political elite, which has transformed India’s political parties into family organizations. Because of this,

3. Public institutions such as universities, the police and the judiciary have deteriorated and 

4. Democratic openness is victim to corruption.

5. The increasing gap between rich and poor. Witness Mukesh Ambani's 27-floor house for his five-member family in Mumbai

6. Disastrous damage to the environment. Lack of regulation or corporate responsibility means water supplies are at risk, people are breathing poisonous air. Irretrievable damage to health and resources continues and no one is accountable.

7. The apathy of the media. The media has essentially been co-opted by the government and corporations. Many journalists even re-trained as financial analysts in the 19990s.

8. No long-term policy. The political chaos that accompanies a pluralist system makes it difficult to form stable long-term policy.

Territorial instability in 9. The northeast and 10. The northwest of the country. Three of India’s 28 states are struggling for independence.

In the words of Guha: ""There are too many fault lines in our society to be a superpower. As a historian I say: ‘We are not prepared’, as an Indian citizen I say: ‘We should not even attempt to’",fekumama,,t2_2ea7egiu,/r/india/comments/eiiusl/superpower_fantasies_india_should_seek_other/fcqoh5e/,1577889572,1,0
fcqohqx,t1_fcqhoj4,t3_eiiah7,None of this bigoted shit should be allowed here.,FreeMyGuyMiniQ,,t2_5cgqdssb,/r/india/comments/eiiah7/4th_grade_social_science_textbook_of_central/fcqohqx/,1577889579,1,0
fcqoi6z,t1_fcqo436,t3_eidi5v,10 million views wtf,Acetylated_Morphine,,t2_3trhnlx2,/r/india/comments/eidi5v/random_daily_discussion_thread_january_01_2020_at/fcqoi6z/,1577889585,1,0
fcqoiso,t1_fcqiqzx,t3_eiidip,"Get some work if you're not a teenager...if you're a Teenager then try speak to real people.dont stay alone at home for a long time...don't eat unnecessarily heavy food...

go to r/nofap 

Try solar subreddit for tip",Spideyocd,India,t2_3kan7z92,/r/india/comments/eiidip/how_2019_was_for_this_average_indian_student_hny/fcqoiso/,1577889594,1,0
fcqokkc,t1_fcqohqx,t3_eiiah7,Stop being islamophobic! You F@ggot!,haizl0ver,,t2_3r1h80r0,/r/india/comments/eiiah7/4th_grade_social_science_textbook_of_central/fcqokkc/,1577889619,1,0
fcqon7t,t1_fcpvkl6,t3_eidi5v,"I am not decision shaming you bro

I made tge same decision too after all",Ooo_weee,15 LAKHS RECEIVED ,t2_592kdp14,/r/india/comments/eidi5v/random_daily_discussion_thread_january_01_2020_at/fcqon7t/,1577889656,1,0
fcqoq37,t3_ea3sdp,t3_ea3sdp,Would it be safe to go to Chandni chowk tomorrow? To some saree stores.,FreeMyGuyMiniQ,,t2_5cgqdssb,/r/india/comments/ea3sdp/cab_bill_2019_newsprotestseditorials_megathread/fcqoq37/,1577889697,1,0
fcqoqob,t3_eihfv4,t3_eihfv4,"This is fake. That's a Jersey Cow, not Gaumata!",morning_cawfee,,t2_bwqth,/r/india/comments/eihfv4/just_stepped_out_of_my_house_and_saw_this/fcqoqob/,1577889705,1,0
fcqotpo,t3_eiemdm,t3_eiemdm,I Want to Visit India.,hareembbt,,t2_5azrul97,/r/india/comments/eiemdm/woke_up_to_a_magnificent_view_of_pune_city_behind/fcqotpo/,1577889746,1,0
fcqou43,t3_eiiah7,t3_eiiah7,How is the family of two dads and a child possible? Would it be possible for two men to adopt a child in India?,BeefJumlaPakoda,,t2_1egc684l,/r/india/comments/eiiah7/4th_grade_social_science_textbook_of_central/fcqou43/,1577889752,1,0
fcqouak,t1_fcpfw3k,t3_ei5hmt,You're not eating it. Show putting it in your mouth and gulping it,s222n,"Paisa bohot hai, bas Pyaar chahiye",t2_3gh95yyl,/r/india/comments/ei5hmt/hey_guys_when_i_posted_the_tea_idli_video_uwromit/fcqouak/,1577889755,1,0
fcqoud0,t1_fcqlqbj,t3_eiicbs,"aBhOrReNT

Dude stfu 

Idk what it means",SyNd1CaTe4,,t2_4klf3jzu,/r/india/comments/eiicbs/hardik_pandya_and_natasha_stankovic_are_medias/fcqoud0/,1577889756,1,0
fcqoxbw,t1_fcqkni5,t3_eii0cx,All groups are racist on the internet. And IRL too.,FreeMyGuyMiniQ,,t2_5cgqdssb,/r/india/comments/eii0cx/future_generations_of_poles_who_found_refuge_in/fcqoxbw/,1577889796,1,0
fcqoy4l,t1_fcqoi6z,t3_eidi5v,Dance dekho dance ladke ka,BuntyFromPremNagar,Non Residential Indian,t2_40pyv6e5,/r/india/comments/eidi5v/random_daily_discussion_thread_january_01_2020_at/fcqoy4l/,1577889807,1,0
fcqozvi,t3_eiibtu,t3_eiibtu,"Pretty sure this is the case in India too.
If you want to avoid that, u can use palm sugar. It isn't refined, not as sweet.",Captain_Muks,,t2_151g96,/r/india/comments/eiibtu/anyone_whos_working_at_sugar_industries_here_can/fcqozvi/,1577889831,1,0
fcqp0ed,t1_fcqoy4l,t3_eidi5v,"Dekh liya, accha naacha.",Acetylated_Morphine,,t2_3trhnlx2,/r/india/comments/eidi5v/random_daily_discussion_thread_january_01_2020_at/fcqp0ed/,1577889838,1,0
fcqp0f6,t3_eih71h,t3_eih71h,Fuck these paywalls.,FreeMyGuyMiniQ,,t2_5cgqdssb,/r/india/comments/eih71h/historical_records_expose_the_lie_that_nathuram/fcqp0f6/,1577889839,1,0
fcqp1l8,t1_fcpi0xo,t3_ei7x31,"Yeah, she's not out of shape or anything. But I guess she just wants to say that it's okay not to have the perfect figure/flat stomach.",s222n,"Paisa bohot hai, bas Pyaar chahiye",t2_3gh95yyl,/r/india/comments/ei7x31/slutshamed_sona_mohapatra_posts_more_swimsuit/fcqp1l8/,1577889854,1,0
fcqp68u,t3_eiicbs,t3_eiicbs,"He is tall, fit, rich, famous, and has a good facial structure. Indian men are jealous of this dude.",FreeMyGuyMiniQ,,t2_5cgqdssb,/r/india/comments/eiicbs/hardik_pandya_and_natasha_stankovic_are_medias/fcqp68u/,1577889916,1,0
fcqp6ih,t1_fcprrlz,t3_eifcxw,Money can’t buy good production quality. Ask Vivek of you don’t agree.,i_Killed_Reddit,:table_flip:,t2_nl1wv,/r/india/comments/eifcxw/pm_modi_shares_a_video_covering_progress_of_works/fcqp6ih/,1577889919,1,0
fcqp6o2,t1_fcqp0ed,t3_eidi5v,Babloo mama ne promise kiya hai vo meri shaadi mein issi gaane mein dance karenge.,BuntyFromPremNagar,Non Residential Indian,t2_40pyv6e5,/r/india/comments/eidi5v/random_daily_discussion_thread_january_01_2020_at/fcqp6o2/,1577889921,1,0
fcqp7mc,t3_eiisqv,t3_eiisqv,Well said!,xuxebiko,quotes cheesy movie dialogues,t2_134h9i0v,/r/india/comments/eiisqv/message_from_a_woke_mohtarma/fcqp7mc/,1577889934,1,0
fcqp838,t1_fcqe9ag,t3_eiduhh,"Yeah, India can see so much more productivity gains simply by adding more tracks instead of investing in faster trains. An uncongested, free track should easily get you from Delhi to Jaipur in 3 hours comfortably. Our current trains can already hit 120kmph. Even with 2 stops in between, traveling 250km in 3 hours is totally possible",mrfreeze2000,,t2_vkkln,/r/india/comments/eiduhh/as_govt_fails_in_sealing_mou_for_hyperloop/fcqp838/,1577889939,1,0
fcqp885,t1_fcqokkc,t3_eiiah7,"Yeah, itd be a real shame if someone painted a whole group of people with one brush right?",muklan,,t2_5sb0u,/r/india/comments/eiiah7/4th_grade_social_science_textbook_of_central/fcqp885/,1577889941,1,0
fcqp9av,t1_fcqou43,t3_eiiah7,Yes :D They can also have their own with injecting sperm or there are other processes. I don't know the details.,Slim_Python,I love Section 144:doge: coz I hate festivals:snoo_facepalm:,t2_1hdy5cv6,/r/india/comments/eiiah7/4th_grade_social_science_textbook_of_central/fcqp9av/,1577889955,1,0
fcqp9nk,t3_eihfv4,t3_eihfv4,"This reminded me of the claim made by Nithyananda in Sep 2018 that within a year he will make monkeys and cows talk in Sanskrit. I hope he is planning a demonstration in his new ""country"" soon 😂",bringmeback0,,t2_4r2llqpr,/r/india/comments/eihfv4/just_stepped_out_of_my_house_and_saw_this/fcqp9nk/,1577889960,1,0
fcqpasz,t3_eiiah7,t3_eiiah7,It's in India?! That's crazy. So impressed though,MusingLife,Telangana,t2_3hbr8ujq,/r/india/comments/eiiah7/4th_grade_social_science_textbook_of_central/fcqpasz/,1577889975,1,0
fcqpbrm,t3_eiia3y,t3_eiia3y,Who are these people ?,Squash3000,,t2_u269m,/r/india/comments/eiia3y/what_are_your_opinions_on_tarek_fateh_and_imam/fcqpbrm/,1577889988,1,0
fcqpdcb,t1_fcqnmr6,t3_eiiah7,when the wife gave that book to btk lol,covic999,Maharashtra,t2_12bbhxdn,/r/india/comments/eiiah7/4th_grade_social_science_textbook_of_central/fcqpdcb/,1577890009,1,0
fcqpe5w,t3_eiir33,t3_eiir33,Next time the voters will cut him down to size and the PM can stop worrying about costs.,Plaudits1102,,t2_5810s4j3,/r/india/comments/eiir33/to_cut_cost_pm_modi_cuts_size_of_his_personal/fcqpe5w/,1577890019,1,0
fcqpenz,t1_fcq82nu,t3_eigwo0,This piece is decidedly against the government though? Were you being sarcastic?,bishopsandrooks,,t2_lcm43,/r/india/comments/eigwo0/caa_violence_videos_shot_by_locals_show_civilians/fcqpenz/,1577890025,1,0
fcqper9,t1_fcqp6o2,t3_eidi5v,"Arey wah. Jaldi shaadi kar lo phir, mama ka dance dekhenge.",Acetylated_Morphine,,t2_3trhnlx2,/r/india/comments/eidi5v/random_daily_discussion_thread_january_01_2020_at/fcqper9/,1577890027,1,0
fcqpf0p,t3_eid66v,t3_eid66v,"I'm sorry, I'm not from India, and I'm really confused by all the sarcasm here - is this a real picture or no?",jahnub,,t2_1sf412ee,/r/india/comments/eid66v/hello_there_from_bangalore/fcqpf0p/,1577890030,1,0
fcqpfcn,t3_eidi5v,t3_eidi5v,"#Randia Walo! Suggest some good fucking Synthwave music!

#I have listened Nightcall by Kavinsky, Daft Punk songs and the recent Weeknd song which all have synthwave.

#Suggest me more.

Also you should listen to this too - https://youtu.be/NZf15xVrOW8",Ooo_weee,15 LAKHS RECEIVED ,t2_592kdp14,/r/india/comments/eidi5v/random_daily_discussion_thread_january_01_2020_at/fcqpfcn/,1577890034,1,0
fcqphoc,t1_fcqfvlv,t3_eih615,"Well she got [13 lakhs](https://www.desimartini.com/news/martini-shots/trending/laxmi-agarwal-dissatisfied-with-the-mere-13-lakhs-she-is-paid-for-deepika-padukone-starrer-chhapaak-article128134.htm) apparently, and wasn’t invited to the trailer launch also.",i_Killed_Reddit,:table_flip:,t2_nl1wv,/r/india/comments/eih615/hope_we_wont_have_to_constantly_tell_stories_on/fcqphoc/,1577890063,1,0
fcqphok,t3_eiidip,t3_eiidip,"82 faps.

Those are Rookie numbers.",FreeMyGuyMiniQ,,t2_5cgqdssb,/r/india/comments/eiidip/how_2019_was_for_this_average_indian_student_hny/fcqphok/,1577890063,1,0
fcqpj6c,t1_fcqg31b,t3_eidi5v,kya hua?,xartaddct,soon to be a wizard,t2_n2153,/r/india/comments/eidi5v/random_daily_discussion_thread_january_01_2020_at/fcqpj6c/,1577890084,1,0
fcqpjq3,t1_fcqg31b,t3_eidi5v,Thika muchon kootko nanmaganay,deadsix6,wheatishfairboylookingrilindianvaluesnochowminjeansplisendnudsok,t2_oad7r,/r/india/comments/eidi5v/random_daily_discussion_thread_january_01_2020_at/fcqpjq3/,1577890093,1,0
fcqpkab,t1_fcpl0fc,t3_eicidd,"Sorry about that. just fixed it, it should perform a bit better now.",pslayer89,,t2_8j93q,/r/india/comments/eicidd/for_this_new_year_i_wrote_a_procedurally/fcqpkab/,1577890101,1,0
fcqpkdv,t1_fcqiqzx,t3_eiidip,Have some willpower.,FreeMyGuyMiniQ,,t2_5cgqdssb,/r/india/comments/eiidip/how_2019_was_for_this_average_indian_student_hny/fcqpkdv/,1577890102,1,0
fcqpl34,t1_fcqp6o2,t3_eidi5v,u/haggu_baby_bot Kya ye sach hai,Acetylated_Morphine,,t2_3trhnlx2,/r/india/comments/eidi5v/random_daily_discussion_thread_january_01_2020_at/fcqpl34/,1577890112,1,0
fcqpltn,t3_eiiah7,t3_eiiah7,Awwwww. That is no progressive,therealfalafel,,t2_42rpyn2w,/r/india/comments/eiiah7/4th_grade_social_science_textbook_of_central/fcqpltn/,1577890123,1,0
fcqpngx,t3_eih4or,t3_eih4or,People must throw out that snake Nitish Kumar.,i_Killed_Reddit,:table_flip:,t2_nl1wv,/r/india/comments/eih4or/delhi_bihar_assembly_elections_and_rajya_sabha/fcqpngx/,1577890147,1,0
fcqpo9u,t3_eij02x,t3_eij02x,605 + 94.5 = 620 😂,pavi2410,:redditgold: 1 Award,t2_179cg5,/r/india/comments/eij02x/beware_of_swiggy_scam_gst_is_5_on_food_products/fcqpo9u/,1577890158,1,0
fcqpp8l,t1_fcqokkc,t3_eiiah7,Dude. Lakum deenukum valiya deen.,therealfalafel,,t2_42rpyn2w,/r/india/comments/eiiah7/4th_grade_social_science_textbook_of_central/fcqpp8l/,1577890172,1,0
fcqppbg,t1_fcqn92k,t3_eii5h7,Where else do you think the Soylent Green comes from?,Chanzy94,,t2_zioji,/r/india/comments/eii5h7/i_see_your_blore_pune_and_goa_and_raise_you_my/fcqppbg/,1577890174,1,0
fcqppxq,t1_fcqnmfv,t3_eig8ri,Hau chicha,satanicunicorn611,,t2_203fm0c,/r/india/comments/eig8ri/a_restaurant_in_hyderabad/fcqppxq/,1577890183,1,0
fcqpqkp,t1_fcpkvd4,t3_eicidd,"Thanks! I'll take a look see of I can slow down the rockets near the apex like you suggested. Right now it just linearly travels over time, but I guess I'll have to use a fancier math function to slow it down near the end haha. Thanks for the suggestion though!",pslayer89,,t2_8j93q,/r/india/comments/eicidd/for_this_new_year_i_wrote_a_procedurally/fcqpqkp/,1577890193,1,0
fcqpqmy,t3_eiioyo,t3_eiioyo,"Here I am with porotta... hey, where the beef at?",xuxebiko,quotes cheesy movie dialogues,t2_134h9i0v,/r/india/comments/eiioyo/in_2020_cows_just_disappear/fcqpqmy/,1577890194,1,0
fcqpqqr,t3_eiicbs,t3_eiicbs,"Is it just me or is this a racist joke? Don't think anyone would have talked about posted about ""paisa"" if Hardik had fair skin.",SreesanthTakesIt,,t2_3pppwq53,/r/india/comments/eiicbs/hardik_pandya_and_natasha_stankovic_are_medias/fcqpqqr/,1577890195,1,0
fcqps0b,t1_fcqou43,t3_eiiah7,"A single man can adopt for sure, [difficult but possible](https://m.huffingtonpost.in/2018/06/17/heres-what-i-learnt-when-i-went-out-to-adopt-as-a-single-man-in-india_a_23459249/). But he cannot adopt a girl child. And as far as I know, the law doesn't really recognise homosexual marriages so any homosexual couple can pass themselves as single male and then proceed with adoption.",noob_finger2,,t2_11ovws,/r/india/comments/eiiah7/4th_grade_social_science_textbook_of_central/fcqps0b/,1577890214,1,0
fcqpsjd,t1_fcqn9im,t3_eiigqt,Yes. The spineless suddenly grows a spine after retirement.,verybadbot,sandaas wahi banega!,t2_1ubk5xd1,/r/india/comments/eiigqt/i_regret_njac_decision_after_seeing_things_now/fcqpsjd/,1577890222,1,0
fcqpsy1,t3_eihhoi,t3_eihhoi,"Like CM, like police",51837,,t2_1o6ynfjo,/r/india/comments/eihhoi/indians_pl_dont_ask_for_hanging_castration_etc_of/fcqpsy1/,1577890228,1,0
