id,name,title,score,subreddit,url,num_comments,selftext,author,num_crossposts,over_18,permalink,pinned,subreddit_type,link_flair_text,author_flair_text,total_awards_received,upvote_ratio,time_created,comment
g785l6,t3_g785l6,Mystery of India's lower death rates seems to defy coronavirus trend,2,india,https://economictimes.indiatimes.com/news/politics-and-nation/mystery-of-indias-lower-death-rates-seems-to-defy-coronavirus-trend/articleshow/75346712.cms,2,,lovejackdaniels,0,False,/r/india/comments/g785l6/mystery_of_indias_lower_death_rates_seems_to_defy/,False,public,Coronavirus,,0,1.0,2020-04-24 18:43:58,"  Portugal is on the same trend. Korea is even lesser.

GodiMedia is vomiting for their leader."
g784xc,t3_g784xc,"Australia with the population less than Delhi, pledged more than $100 B and India with population of 1.35 B has pledged only $ 20 B.[source: Bloomberg]",3,india,https://i.redd.it/07fyj5npmru41.jpg,1,,gotmyvitamins,0,False,/r/india/comments/g784xc/australia_with_the_population_less_than_delhi/,False,public,Coronavirus,Telangana,0,0.8,2020-04-24 18:42:40,  Statue hai na. It will generate revenue don't worry 🤭
g780w7,t3_g780w7,6 Muslim families in Jind district convert to Hinduism | Chandigarh News - Times of India,4,india,http://toi.in/j_qDla/a33gj,1,,_azadak,0,False,/r/india/comments/g780w7/6_muslim_families_in_jind_district_convert_to/,False,public,Non-Political,,0,1.0,2020-04-24 18:35:07, 
g77xlf,t3_g77xlf,Many Arab handles slamming India are part of ‘Twitter war’ from Pakistan,8,india,https://theprint.in/world/many-arab-handles-slamming-india-are-part-of-twitter-war-from-pakistan/408287/,1,,Awkward-Today,0,False,/r/india/comments/g77xlf/many_arab_handles_slamming_india_are_part_of/,False,public,Politics,,0,1.0,2020-04-24 18:29:04,  Hmmmm never thought of that
g77wlf,t3_g77wlf,How coronavirus will fuel manufacturing exodus from China,1,india,https://www.indiatoday.in/business/story/how-coronavirus-will-fuel-manufacturing-exodus-from-china-1670330-2020-04-23,0,,Johari82,0,False,/r/india/comments/g77wlf/how_coronavirus_will_fuel_manufacturing_exodus/,False,public,Policy/Economy,,0,1.0,2020-04-24 18:27:02, 
g77vgu,t3_g77vgu,Chikoos from 2 trees. Big ones 300g,1,india,https://i.redd.it/xrulu90hjru41.jpg,0,,Blue_Maven,0,False,/r/india/comments/g77vgu/chikoos_from_2_trees_big_ones_300g/,False,public,Non-Political,Karnataka,0,0.67,2020-04-24 18:24:36, 
g77uq4,t3_g77uq4,Chinese investors flummoxed by India's new foreign investment rules,1,india,https://www.reuters.com/article/us-india-china-investments-analysis/chinese-investors-flummoxed-by-indias-new-foreign-investment-rules-idUSKCN2251YZ,0,,Johari82,0,False,/r/india/comments/g77uq4/chinese_investors_flummoxed_by_indias_new_foreign/,False,public,Policy/Economy,,0,0.67,2020-04-24 18:23:14, 
g77oab,t3_g77oab,"Covid-19: Congress criticises Centre for freezing DA, asks it to stop ‘wasteful expenditure’ instead",5,india,https://scroll.in/latest/960144/covid-19-congress-criticises-centre-for-freezing-da-asks-it-to-stop-wasteful-expenditure-instead,2,,sudden_dust,0,False,/r/india/comments/g77oab/covid19_congress_criticises_centre_for_freezing/,False,public,Politics,:snoo_shrug:,0,0.78,2020-04-24 18:10:33,"  DA and DR hasn't been frozen. The routine increment is.

Or am I wrong?"
g77o1q,t3_g77o1q,"PM Modi is a Model & a Hero, says Patna High Court Chief Justice M.R. Shah [August, 2018]",5,india,https://theprint.in/india/governance/pm-modi-is-a-model-a-hero-says-patna-high-court-chief-justice-m-r-shah/100960/,4,,wordswithmagic,0,False,/r/india/comments/g77o1q/pm_modi_is_a_model_a_hero_says_patna_high_court/,False,public,Politics,India,0,0.86,2020-04-24 18:10:09,  He's now a SC judge and will be around till 2023 lol Chaliye Article 50 ko vanakkam Anticipatory Salivation He's the same guy who delivered judgement on Arnab's case today. Judiciary ki maa behen ho gayi hai
g77nhq,t3_g77nhq,"In 6 months, Justice DY Chandrachud undergoes spectacular image makeover [Oct 1, 2018]",4,india,https://timesofindia.indiatimes.com/india/in-6-months-justice-dy-chandrachud-undergoes-spectacular-image-makeover/articleshow/66021313.cms,0,,wordswithmagic,0,False,/r/india/comments/g77nhq/in_6_months_justice_dy_chandrachud_undergoes/,False,public,Politics,India,0,1.0,2020-04-24 18:09:07, 
g77lq0,t3_g77lq0,We have saved India from going into Stage 3: Health Minister. [coronavirus],2,india,https://timesofindia.indiatimes.com/india/we-have-saved-india-from-going-into-stage-3-health-minister/articleshow/75350159.cms,2,,stress_buster,0,False,/r/india/comments/g77lq0/we_have_saved_india_from_going_into_stage_3/,False,public,Coronavirus,,0,0.75,2020-04-24 18:05:35,"  Lol. Right. This is infuriating. It's okay not to outrightly confirm stage 3 but this crap is absolutely not true,when there are many cases of community transmission.India is at the verge of death and they are pushing us to it."
g77k1z,t3_g77k1z,"PM CARES fund won’t be checked by government’s auditor, say sources",12,india,https://www.ndtv.com/india-news/coronavirus-pm-cares-fund-wont-be-checked-by-cag-say-sources-2217714,4,,ashallowheart,0,False,/r/india/comments/g77k1z/pm_cares_fund_wont_be_checked_by_governments/,False,public,,Rock n’ Roll is my religion. \m/,0,0.87,2020-04-24 18:02:18,"  >	""Since the fund is based on donations of individuals and organisations, we have no right to audit the charitable organisation,"" sources in the CAG offices said.

>	""Unless the trustees ask us to audit, we will not be auditing the accounts,"" a senior official in the CAG said.

>	Government sources have reportedly said the PM CARES fund will be audited by independent auditors appointed by the trustees."
g77jq0,t3_g77jq0,Many Arab handles slamming India are part of ‘Twitter war’ from Pakistan,1,india,https://theprint.in/world/many-arab-handles-slamming-india-are-part-of-twitter-war-from-pakistan/408287/?amp,3,,Timbaktu22,0,False,/r/india/comments/g77jq0/many_arab_handles_slamming_india_are_part_of/,False,public,Non-Political,,0,0.56,2020-04-24 18:01:38,  Why do we not have geopolitics flair?
g77jp4,t3_g77jp4,"#WATCH: Tamil Nadu Police put lockdown violators in an ambulance with a fake #COVID19 positive patient as punishment, in Tiruppur. (Video Source: Tamil Nadu Police)",5,india,https://twitter.com/ANI/status/1253662270409920518,0,,Ku_hu,0,False,/r/india/comments/g77jp4/watch_tamil_nadu_police_put_lockdown_violators_in/,False,public,Non-Political,,0,1.0,2020-04-24 18:01:36, 
g77jb6,t3_g77jb6,Online money making,2,india,https://www.reddit.com/r/india/comments/g77jb6/online_money_making/,2,"Hello!
So given the pandemic and WFH, as a student I was wondering about the ways to make money online trying websites like Swagbucks and all. However, while these platforms provide great opportunities for someone in US. These platforms aren't very active or cater to Indians trying to navigate them. Does anyone have alternatives?",triary95,0,False,/r/india/comments/g77jb6/online_money_making/,False,public,Business/Finance,,0,0.75,2020-04-24 18:00:51,"  Try online stocks and shares One of the Apps that I have tried is Qureka. Which is a quizzing app. The quizzes are available in a lot of topics like literature, GK etc. One needs a Paytm account to which the funds get transferred. 
Drawbacks - you can only tranfer Rs 15 once in 10 days  and need to have played around 30 quizzes during that time. Plus accruing of money is pretty slow. The Referral wallet however let's you transfer more ."
g779xw,t3_g779xw,Recommendations for a decent mid-premium price range laptop?,1,india,https://www.reddit.com/r/india/comments/g779xw/recommendations_for_a_decent_midpremium_price/,2,"Hey there.
I was planning to buy a decent mid-premium laptop anything below Rs. 1.3 Lakhs.

I'm not a hardcore gamer, so not looking for a fancy graphic card, but anything that fits casual gaming (mostly CS GO) should be alright.

I plan to use it to learn Python and R. I would also love to experience other Linux based systems (either through VMware or dual boot)

Other than that, most of my time will be spent on  viewing movies and web-browsing (which any standard laptop can do)

Accordingly I believe the following specifications would be good

Intel i7 10th Gen processor
16 GB RAM
512GB /1TB SSD or 1TB HDD with 128 GB SSD
A decent display (4K would be ideal but not mandatory)
Light-weight and preferably touch screen (2-in-1s)
A decent audio setup


Would love your recommendations.
Also if you've purchased a laptop within this price range, and have any suggestions, I would love to hear them out.

Thanks.",metheist,0,False,/r/india/comments/g779xw/recommendations_for_a_decent_midpremium_price/,False,public,Non-Political,,0,1.0,2020-04-24 17:40:54,"  An Inspiron or a surfacebook I'm just gonna advice you that you should make getting a 4k screen the priority. You're gonna study code, reading letters is what you're gonna spend most times in and 4k screen matters the most here and there's a huge difference between 1080p and 4k, specially for text."
g778sl,t3_g778sl,‘No Action Has Been Taken’: Frustration In National Covid-19 Task Force,3,india,https://www.article-14.com/post/no-action-taken-frustration-in-national-covid-19-task-force?fbclid=IwAR2qoLBrEAeBa1bPhtKp-ie9B4JlVsk3H8DEx5DautMngHNUHGipXwLftQo,0,,IAmMohit,0,False,/r/india/comments/g778sl/no_action_has_been_taken_frustration_in_national/,False,public,Coronavirus,Bigotry begets Bigotry,0,0.8,2020-04-24 17:38:27, 
g776m6,t3_g776m6,Yuval Noah Harari: the world after coronavirus,4,india,https://www.ft.com/content/19d90308-6858-11ea-a3c9-1fe6fedcca75,0,,yogiraj_zala,0,False,/r/india/comments/g776m6/yuval_noah_harari_the_world_after_coronavirus/,False,public,Coronavirus,,0,0.83,2020-04-24 17:33:53, 
g770ho,t3_g770ho,Pregnant woman kin in Haridwar claims govt hospital refused admission for delivery unless Covid-19 test done | Dehradun News - Times of India,5,india,https://timesofindia.indiatimes.com/city/dehradun/pregnant-woman-kin-in-haridwar-claims-govt-hospital-refused-admission-for-delivery-unless-covid-19-test-done/articleshow/75331425.cms,0,,ReallyRedditLover,0,False,/r/india/comments/g770ho/pregnant_woman_kin_in_haridwar_claims_govt/,False,public,Coronavirus,,0,0.86,2020-04-24 17:20:38, 
g7700v,t3_g7700v,One month of lockdown: Why Indian states have dramatically divergent Covid-19 trajectories,4,india,https://scroll.in/article/960075/one-month-of-lockdown-why-indian-states-have-dramatically-divergent-covid-19-trajectories,0,,Fabulous-Rice,0,False,/r/india/comments/g7700v/one_month_of_lockdown_why_indian_states_have/,False,public,Coronavirus,Realized my Lifestyle is called Social Distancing,0,0.75,2020-04-24 17:19:39, 
g7700r,t3_g7700r,Bengaluru: Government permits private schools to collect school fee,8,india,https://realtime.rediff.com/news/india/Bengaluru-Government-permits-private-schools-to-collect-school-fee/18c79565ca1849c8?src=interim_alsoreadimage,0,,ShankDatNaan,0,False,/r/india/comments/g7700r/bengaluru_government_permits_private_schools_to/,False,public,Coronavirus,,0,0.91,2020-04-24 17:19:38, 
g76zan,t3_g76zan,What Does a Mechanical Ventilator Do?,3,india,https://www.reddit.com/r/india/comments/g76zan/what_does_a_mechanical_ventilator_do/,0,"The COVID-19 pandemic has provoked the exponential demand for ventilators across the world. But, **why do we need ventilators so desperately? Are they the only solution to fight against deadly coronavirus?** According to Brian Oliver, a respiratory disease researcher and an Associate Professor at the University of Technology, Sydney (UTS) the ventilator can decide life and death for severe COVID-19 patients. Like Pneumonia, in COVID-19 lungs are filled with fluid and pus which makes it difficult to breathe. A ventilator becomes the only way to make the respiration process easier by moving oxygen into such parts of the lungs that aren’t badly damaged by the virus.

If you wish to make donations and save lives, please visit the following links:

**For international contributors:**

[https://www.gofundme.com/f/covid19-india-ventilator-development-project](https://www.gofundme.com/f/covid19-india-ventilator-development-project)

**For contributors in India:**

[https://www.ketto.org/fundraiser/Covid19-indian-MedicalGrade-Rugged-LowCost-ventilator](https://www.ketto.org/fundraiser/Covid19-indian-MedicalGrade-Rugged-LowCost-ventilator)

&#x200B;

https://preview.redd.it/b7sbu01i7ru41.png?width=702&format=png&auto=webp&s=83338b38fddcf7e31be0ac3fce21b052f790b5e9",ProductEngineering1,0,False,/r/india/comments/g76zan/what_does_a_mechanical_ventilator_do/,False,public,Coronavirus,,0,1.0,2020-04-24 17:17:54, 
g76zla,t3_g76zla,Thane police to take action against housing societies if medical staff harassed | Thane News - Times of India,2,india,https://timesofindia.indiatimes.com/city/thane/thane-police-to-take-action-against-housing-societies-if-medical-staff-harassed/articleshow/75345530.cms,0,,ReallyRedditLover,0,False,/r/india/comments/g76zla/thane_police_to_take_action_against_housing/,False,public,Coronavirus,,0,1.0,2020-04-24 17:18:33, 
g76zl8,t3_g76zl8,"Coronavirus | Model shows deaths, cases rising over next three weeks",1,india,https://www.thehindu.com/news/national/coronavirus-model-shows-deaths-cases-rising-over-next-three-weeks/article31418830.ece,0,,Dumma1729,0,False,/r/india/comments/g76zl8/coronavirus_model_shows_deaths_cases_rising_over/,False,public,Coronavirus,,0,0.67,2020-04-24 17:18:32, 
g76z8t,t3_g76z8t,How covid-19 response disrupted health services in rural India,2,india,https://www.livemint.com/news/india/how-covid-19-response-disrupted-health-services-in-rural-india-11587713155817.html,0,,Dumma1729,0,False,/r/india/comments/g76z8t/how_covid19_response_disrupted_health_services_in/,False,public,Coronavirus,,0,1.0,2020-04-24 17:17:46, 
g76o5f,t3_g76o5f,The real loser in India's errupting Islamaphobia: Caste politics.,17,india,https://www.reddit.com/r/india/comments/g76o5f/the_real_loser_in_indias_errupting_islamaphobia/,3,"TLDR: My (unqualified) opinion is that dalit political movement has seen the most erosion in the anti-muslim appraoch the government has championed.

Note: This post is for discussion. If you have nothing but belligerent responses that add nothing to the conversation I will report you. If you only have worn out, down over a thousand times arguments of being caste blind, having merit and anti reservation nonsense, I will be ignoring you.

Now that I've gotten that out of the way, lets talk.

The anti muslim sentiment grows stronger even in lockdown, with the hindu right finding more ways to demonize muslims everyday. I didnt think it could be possible, but every day it seems they have a new angle of attack. 

And such it has been since day 1 i.e. the day the 2014 elections results came out when the muslim techie was murdered by a hindu mob and that mosque attack happened, I'm forgetting where. The very day of the results. Modi hadnt even taken up PMship that day. 

So to begin, Anti-Muslim rhetoric creates a unified Hindu identity. This is something that BJP has long worked for and was one of the goals of VHP, HM and RSS since their inception - create a Hindu identity that trumps caste indentity so that the caste status quo is maintained while killing any caste discourse. 

Now, I'm muslim. And I have no intention of blaming Dalits for the victory of BJP. Dalits, much like Muslims, have been promised much by politicians purporting to be their champions but delivery has been less than spectacular. Lalu's first term & Maywati's first full term withstanding, no government has been able to delivery upon their promises to their dalit and obc voter very much. So yes, I do not blame these communities for voting outside their 'champions', for 'fracturing' the community vote. 

But the fact remains that Modi's government has done spectacular work for the backward communities (barring muslims). We in urban areas scoff at the Modi governments but their work for the financially weak and socially disadvantaged has been phenomenal. From being called ""Congress + Cow"" it has been jokingly called ""Prakash Karat + Cow"". Such is the success of Modi's socialist policies that I have to begrudgingly accept it as the unequivocal truth.

But coming to the matter at hand, OBC representation in Parliament has been dropping and sarvana i.e. upper caste repesentation is increasing. Now, Dalits have reserved seats so while their count can not decrease, but this seat reservation is working against them. I'm going to copy paste directly from an article here to explain this

[Not a single constituency in India has more than 50 per cent Dalit population, which means it’s always the non-Dalits who decide the fate of Dalit candidates in reserved constituencies. A vocal or assertive Dalit leader has the least chance of winning from such seats. To be re-elected, a Dalit MP must be careful not to antagonise the non-Dalits, and one way of ensuring this is by remaining silent in Parliament.](https://theprint.in/opinion/17th-lok-sabha-looks-set-to-confirm-ambedkars-fears-no-vocal-dalits-in-parliament/232383/)

So who is the loser here? Mayawati has lost her base. There can be no doubt about it. The BSP+SP combine failed because SP votes were transfered to BSP but the BSP vote was not. Why? Because Dalits find BJP a more attractive proposition than BSP.  Who else? Lalu and Mulayam have lost a significant base altho this could be attributed to multiple reasons. It is also less significant because OBC leaders are many. Dalit leaders are few. 

While Chandrashekar 'Raavan' Azad has made a great big splash, he is being kept under hold by the government almost since day 1. He has the appeal to be a mass leader and present a large potential threat to the status quo. But he has been muzzled and jailed as often as was possible. 

Ultimately even the news cycles focus on muslim, and the caste conflicts happeneing everyday take a backseat, all the while forgetting that 85% of Indian Muslims are lower caste muslims. Here too, the muslim identity has trumped the caste identity and they are doubly the losers here considering that most muslim victim to Islamaphobic attack tend to be the under privileged and of backward caste.

This is all by design, mind you. The idea here is the same I mentioned earlier. Maintain caste status quo and the cost of caste identity. And its working.

Note that Modi himself never speaks about caste. Despite being an OBC he never mentions caste struggles and his own caste related experiences. So his being OBC does not bring more visibility to the problems of the oppressed castes.



Reading material:


[Why Dalits voted for the BJP](http://www.india-seminar.com/2019/720/720_snigdha_dhrubo_guru.htm)
[Despite having 40 Dalit MPs, why has the BJP ignored Dalit complaints? Dr Ambedkar has the answer](https://scroll.in/article/802377/despite-having-40-dalit-mps-why-has-the-bjp-ignored-dalit-complaints-dr-ambedkar-has-the-answer)

[India’s Most Oppressed Get Their Revenge](https://www.nytimes.com/2019/05/15/opinion/india-elections-dalits.html)

[Narendra Modi’s “two-caste society” is a facade to hide the BJP’s casteist politics ](https://caravanmagazine.in/politics/narendra-modi-two-caste-society-casteist-bjp)


[Half of BJP’s additional MPs from SC/ST constituencies](https://timesofindia.indiatimes.com/india/half-of-bjps-additional-mps-from-sc/st-constituencies/articleshow/69501208.cms)",HairLikeWinterFire,0,False,/r/india/comments/g76o5f/the_real_loser_in_indias_errupting_islamaphobia/,False,public,Politics,Azaadi,0,0.8,2020-04-24 16:51:21,"  I understand everything you say except 

> But the fact remains that Modi's government has done spectacular work for the backward communities (barring muslims). We in urban areas scoff at the Modi governments but their work for the financially weak and socially disadvantaged has been phenomenal. From being called ""Congress + Cow"" it has been jokingly called ""Prakash Karat + Cow"". Such is the success of Modi's socialist policies that I have to begrudgingly accept it as the unequivocal truth.

What exactly are these policies? Real problem is fake news. Most people aren't smart enough to check facts by themselves."
g76feg,t3_g76feg,Storm from my balcony [Kolkata],19,india,https://v.redd.it/28suzcr2zqu41,1,,sayn23,0,False,/r/india/comments/g76feg/storm_from_my_balcony_kolkata/,False,public,Non-Political,Calcutta,0,0.96,2020-04-24 16:30:39,  Nice
g76qa9,t3_g76qa9,Covid Toes among kids: New symptom of novel coronavirus infection,7,india,http://www.indiatoday.in/amp/coronavirus-outbreak/story/covid-toes-among-kids-new-symptom-of-novel-coronavirus-infection-1670462-2020-04-24,0,,theragnork,0,False,/r/india/comments/g76qa9/covid_toes_among_kids_new_symptom_of_novel/,False,public,Coronavirus,,0,1.0,2020-04-24 16:56:40, 
g76m9x,t3_g76m9x,PVR says it may face liquidity issues if lockdown continues beyond 2-3 months,10,india,https://www.moneycontrol.com/news/business/markets/pvr-says-it-may-face-liquidity-issues-if-lockdown-continues-beyond-2-3-months-5180001.html/amp,2,,RathimoorchaReturns,0,False,/r/india/comments/g76m9x/pvr_says_it_may_face_liquidity_issues_if_lockdown/,False,public,Business/Finance,,0,1.0,2020-04-24 16:46:59,  So that’s like 2 popcorns? /s Nobody is eager to watch Movies.
g76kfv,t3_g76kfv,"Lucknow: Colleges relax admission rules, deadline for UG and PG courses | Lucknow News - Times of India",2,india,https://timesofindia.indiatimes.com/city/lucknow/colleges-relax-admission-rules-deadline-for-ug-and-pg-courses/articleshow/75335476.cms,0,,ReallyRedditLover,0,False,/r/india/comments/g76kfv/lucknow_colleges_relax_admission_rules_deadline/,False,public,Coronavirus,,0,1.0,2020-04-24 16:42:29, 
g76kcw,t3_g76kcw,Arnab Goswami gets interim relief for three weeks from SC in FIRs against him,8,india,https://scroll.in/latest/960107/arnab-goswami-gets-interim-relief-for-three-weeks-from-sc-in-firs-against-him,4,,hauntin,0,False,/r/india/comments/g76kcw/arnab_goswami_gets_interim_relief_for_three_weeks/,False,public,Non-Political,RASHTRIYA SANDAS SANGH,0,0.72,2020-04-24 16:42:19,"  Why cannot common citizens do something like that? SC is a chaddi den for something now,  this was expected,  no  doubt  why  godi  media is relentlessly and fearlessly spreading hatred , as  they are  confident chaddis in  SC  will protect them. >A bench of Justices DY Chandrachud and MR Shah made the observations while hearing a petition filed by Goswami seeking no coercive action should be taken on the first information reports filed against him in various states for allegedly defaming Congress President Sonia Gandhi."
g76k12,t3_g76k12,Lawyer approaches Bombay HC for fin help over loss of work | Nagpur News - Times of India,2,india,https://timesofindia.indiatimes.com/city/nagpur/lawyer-approaches-hc-for-fin-help-over-loss-of-work/articleshow/75334728.cms,0,,ReallyRedditLover,0,False,/r/india/comments/g76k12/lawyer_approaches_bombay_hc_for_fin_help_over/,False,public,Coronavirus,,0,1.0,2020-04-24 16:41:32, 
g76i6f,t3_g76i6f,Masks mandatory in Bihar from today | Patna News - Times of India,7,india,https://timesofindia.indiatimes.com/city/patna/masks-mandatory-in-state-from-today/articleshow/75332244.cms,0,,ReallyRedditLover,0,False,/r/india/comments/g76i6f/masks_mandatory_in_bihar_from_today_patna_news/,False,public,Coronavirus,,0,0.9,2020-04-24 16:37:06, 
g76flf,t3_g76flf,"'50,000 students from India stranded abroad'",12,india,https://www.deccanherald.com/national/west/50000-students-from-india-stranded-abroad-829336.html,0,,Neglectedsince1994,0,False,/r/india/comments/g76flf/50000_students_from_india_stranded_abroad/,False,public,Politics,The Imitation Game! :snoo_surprised:,0,1.0,2020-04-24 16:31:08, 
g76ejf,t3_g76ejf,Is there a customer care email address for Axis bank?,5,india,https://www.reddit.com/r/india/comments/g76ejf/is_there_a_customer_care_email_address_for_axis/,6,"Their online chat is non-functional and there's a wait time for the customer care number. Any mail ID I can expect responses from.

Thanks",0Kysh0,0,False,/r/india/comments/g76ejf/is_there_a_customer_care_email_address_for_axis/,False,public,AskIndia, :snoo_scream::snoo_tableflip::table_flip:,0,0.86,2020-04-24 16:28:34,"  General Bank Account Queries

[customer.service@axisbank.com](mailto:customer.service@axisbank.com)

Queries Related To Credit 

[Cardscreditcards@axisbank.com](mailto:Cardscreditcards@axisbank.com)

Loan Queries

[loans@axisbank.com](mailto:loans@axisbank.com)

Merchant Services

[merchant.services@axisbank.com](mailto:merchant.services@axisbank.com)

NRI Customers

nri.services@axisbank.com Yes ofcourse"
g76dlk,t3_g76dlk,"Modi isn’t bringing back Indians stranded in the Middle East, and he’s running out of goodwill",4,india,https://www.newslaundry.com/2020/04/24/modi-isnt-bringing-back-indians-stranded-in-the-middle-east-and-hes-running-out-of-goodwill,1,,Neglectedsince1994,0,False,/r/india/comments/g76dlk/modi_isnt_bringing_back_indians_stranded_in_the/,False,public,Politics,The Imitation Game! :snoo_surprised:,0,0.61,2020-04-24 16:26:14, 
g76846,t3_g76846,Tripura: BJP MLA alleges fund misuse in procuring COVID-19 kits,1,india,https://www.eastmojo.com/story/tripura-bjp-mla-alleges-fund-misuse-in-procuring-covid-19-kits,0,,silentr3b31,0,False,/r/india/comments/g76846/tripura_bjp_mla_alleges_fund_misuse_in_procuring/,False,public,Politics,,0,0.57,2020-04-24 16:13:11, 
