id,parent_id,link_id,body,author,author_flair_text,author_fullname,permalink,created_utc,score,total_awards_received
fcqe4vc,t1_fcqdmu1,t3_eidi5v,Don't,easysleazzy,zeal is ze best,t2_4llbcvk1,/r/india/comments/eidi5v/random_daily_discussion_thread_january_01_2020_at/fcqe4vc/,1577884190,1,0
fcqe6vb,t1_fcpfcuo,t3_ei5ixh,"This is a conundrum which only they can solve but only if they want to. You can't force your opinion on them. It's natural they are deeply prejudiced against Pakistan. So maybe you can start there. 

I watched a YouTube video series posted by ""Where the Jones"" in Pakistan and was pleasantly surprised how civilised and morally upright people they can be. The whole series has been a big eye opener. I also saw the Indian series by the same vlogger and could see the stark difference we have vis a vis Pakistan. I think your parents and every other Indians should see this

https://youtu.be/_70TygLqXJs",makky115,,t2_24298718,/r/india/comments/ei5ixh/my_parents_are_supporters_of_bjp_and_theres_not/fcqe6vb/,1577884221,1,0
fcqe771,t1_fcpe8wk,t3_ei4vq6,Please read the report again. You have misunderstood several points.,onosmosis,,t2_1dcc61ox,/r/india/comments/ei4vq6/twitterurbannazicom_report_you_have_been_waiting/fcqe771/,1577884227,1,0
fcqe7l9,t1_fcqe33l,t3_eidi5v,hum toh peeth thapthapa rahe the. ab /s laga diya. thoo!,baburao87,,t2_5alimi4y,/r/india/comments/eidi5v/random_daily_discussion_thread_january_01_2020_at/fcqe7l9/,1577884233,1,0
fcqe941,t1_fcqe3ab,t3_eidi5v,kood ke marogi. aur kya karna hai?,baburao87,,t2_5alimi4y,/r/india/comments/eidi5v/random_daily_discussion_thread_january_01_2020_at/fcqe941/,1577884256,1,0
fcqe9ag,t1_fcpfa31,t3_eiduhh,"Many fail to realize this, faster trains doesn't mean quicker travel. Trains still have to be slowed down for traffic.
Example-konkan railway is single line for most of the distance so trains have to be side lined",thickestthicc,,t2_3vw5zqya,/r/india/comments/eiduhh/as_govt_fails_in_sealing_mou_for_hyperloop/fcqe9ag/,1577884259,1,0
fcqe9y4,t3_eii0cx,t3_eii0cx,Kolhapur?,Indianopolice,,t2_ie9wf,/r/india/comments/eii0cx/future_generations_of_poles_who_found_refuge_in/fcqe9y4/,1577884269,1,0
fcqeap7,t1_fcptu7q,t3_eig8ri,*Humare chicha ku nai pehchaante tum.*,webdevop,> 1.6 LPM Club,t2_hy8gi,/r/india/comments/eig8ri/a_restaurant_in_hyderabad/fcqeap7/,1577884278,1,0
fcqeb78,t1_fcqda5v,t3_eidi5v,"Pinnalladhey! 

Ippom I’m feeling left out aniya!",brown_burrito,,t2_17zu6sle,/r/india/comments/eidi5v/random_daily_discussion_thread_january_01_2020_at/fcqeb78/,1577884286,1,0
fcqebny,t1_fcqe941,t3_eidi5v,Pani mei kood kar nhi doob kar marte hai buddhu,Leburnum,,t2_553bgnmr,/r/india/comments/eidi5v/random_daily_discussion_thread_january_01_2020_at/fcqebny/,1577884292,1,0
fcqed2a,t1_fcqe4pd,t3_eigllv,Yeah but they live all the way in Delhi,throwawayacc_ount420,,t2_503xnekc,/r/india/comments/eigllv/ok_i_feel_like_this_would_be_the_best_sub_for/fcqed2a/,1577884315,1,0
fcqee6o,t1_fcpe45r,t3_ei4vq6,"Don’t know. With political parties on electoral bonds and shit, it’s just an impossible track. Else RTI could have helped to know the money trail.",onosmosis,,t2_1dcc61ox,/r/india/comments/ei4vq6/twitterurbannazicom_report_you_have_been_waiting/fcqee6o/,1577884332,1,0
fcqeggb,t1_fcqe7l9,t3_eidi5v,"Spitting is a disgrace.It's bang out of order.It's a lifelong shame

One  should always swallow...",Timur_tomb_opener,,t2_4xi7bttt,/r/india/comments/eidi5v/random_daily_discussion_thread_january_01_2020_at/fcqeggb/,1577884366,1,0
fcqeh3d,t1_fcqebny,t3_eidi5v,"kudegi toh doob bhi jayegi, jab 50 log aur girenge tere upar",baburao87,,t2_5alimi4y,/r/india/comments/eidi5v/random_daily_discussion_thread_january_01_2020_at/fcqeh3d/,1577884377,1,0
fcqejeb,t1_fcqeh3d,t3_eidi5v,Bsdk marna kyu chahta hai.,Leburnum,,t2_553bgnmr,/r/india/comments/eidi5v/random_daily_discussion_thread_january_01_2020_at/fcqejeb/,1577884415,1,0
fcqejif,t3_eihf5q,t3_eihf5q,Dont worry the shivaji maharaj statue will atleast save mumbai!,melvin_rajeev,,t2_zxldm,/r/india/comments/eihf5q/by_2050_mumbai_and_chennai_will_be_under_water/fcqejif/,1577884417,1,0
fcqejmr,t3_eih9i4,t3_eih9i4,"Top left, there's a policeman doing the same as well.",webdevop,> 1.6 LPM Club,t2_hy8gi,/r/india/comments/eih9i4/caa_violence_videos_shot_by_locals_show_civilians/fcqejmr/,1577884419,1,0
fcqelcr,t1_fcqeggb,t3_eidi5v,neither spit not swallow. rather apply on face.,baburao87,,t2_5alimi4y,/r/india/comments/eidi5v/random_daily_discussion_thread_january_01_2020_at/fcqelcr/,1577884447,1,0
fcqenfd,t1_fcq3kmt,t3_eig6im,But is a very obvious metaphor - even in English when you say idol there metaphor exists. Referring to the rulers it means as opposed to a real living thing they're idols,sAK47,,t2_fvlx4,/r/india/comments/eig6im/bizarre_iitkanpur_panel_to_decide_if_faiz_poem/fcqenfd/,1577884484,1,0
fcqenfn,t1_fcqejeb,t3_eidi5v,kagzat dikha aur bach ja na simple,baburao87,,t2_5alimi4y,/r/india/comments/eidi5v/random_daily_discussion_thread_january_01_2020_at/fcqenfn/,1577884485,1,0
fcqenwq,t1_fcqejeb,t3_eidi5v,gali kyo deti hai bc,baburao87,,t2_5alimi4y,/r/india/comments/eidi5v/random_daily_discussion_thread_january_01_2020_at/fcqenwq/,1577884493,1,0
fcqeoiw,t1_fcq6r8w,t3_eigzia,"If you look for a conspiracy, you will find it in everything.",FranknStein07,Maharashtra,t2_qiwx4,/r/india/comments/eigzia/do_we_owe_an_apology_to_kashmir/fcqeoiw/,1577884504,1,0
fcqepbn,t1_fcq3h4k,t3_eig6im,"And but just means idol, as in the metaphor - not any religions dieties",sAK47,,t2_fvlx4,/r/india/comments/eig6im/bizarre_iitkanpur_panel_to_decide_if_faiz_poem/fcqepbn/,1577884517,1,0
fcqeqkw,t1_fcqenwq,t3_eidi5v,*Nikal*,Leburnum,,t2_553bgnmr,/r/india/comments/eidi5v/random_daily_discussion_thread_january_01_2020_at/fcqeqkw/,1577884537,1,0
fcqer66,t1_fcq08j5,t3_eig8tw,This temple was spared during the sack of Hampi.,Gurajada,,t2_5ags0a53,/r/india/comments/eig8tw/virupaksha_temple_hampi_clicked_on_my_redmi_note_5/fcqer66/,1577884547,1,0
fcqerpu,t1_fcqelcr,t3_eidi5v,I see...,Timur_tomb_opener,,t2_4xi7bttt,/r/india/comments/eidi5v/random_daily_discussion_thread_january_01_2020_at/fcqerpu/,1577884557,1,0
fcqerqi,t1_fcqenfn,t3_eidi5v,Dekhte h,Leburnum,,t2_553bgnmr,/r/india/comments/eidi5v/random_daily_discussion_thread_january_01_2020_at/fcqerqi/,1577884557,1,0
fcqesli,t1_fcpetz4,t3_eid66v,"yeah, bro",CommonSalt,,t2_154vub,/r/india/comments/eid66v/hello_there_from_bangalore/fcqesli/,1577884572,1,0
fcqessy,t1_fcqeqkw,t3_eidi5v,*laude*,baburao87,,t2_5alimi4y,/r/india/comments/eidi5v/random_daily_discussion_thread_january_01_2020_at/fcqessy/,1577884575,1,0
fcqesve,t3_eii5h7,t3_eii5h7,This view is more clear from zooroad.,bjpITcell_101,,t2_5cfszbb2,/r/india/comments/eii5h7/i_see_your_blore_pune_and_goa_and_raise_you_my/fcqesve/,1577884576,1,0
fcqets0,t1_fcqessy,t3_eidi5v,*Chuche*,Leburnum,,t2_553bgnmr,/r/india/comments/eidi5v/random_daily_discussion_thread_january_01_2020_at/fcqets0/,1577884593,1,0
fcqeuev,t3_eii3ip,t3_eii3ip,Who decides the boundaries?,ShudraShinigami,,t2_5bfqzf3v,/r/india/comments/eii3ip/super_power_2020_guys_some_sanghi_made_this/fcqeuev/,1577884605,1,0
fcqeukz,t1_fcqerqi,t3_eidi5v,when in doubt sl.it wris.ts,baburao87,,t2_5alimi4y,/r/india/comments/eidi5v/random_daily_discussion_thread_january_01_2020_at/fcqeukz/,1577884608,1,0
fcqeunm,t3_eihfv4,t3_eihfv4,"Is she real? Her tail looks really fake, there are little to no hairs on tail.",Slim_Python,I love Section 144:doge: coz I hate festivals:snoo_facepalm:,t2_1hdy5cv6,/r/india/comments/eihfv4/just_stepped_out_of_my_house_and_saw_this/fcqeunm/,1577884609,1,0
fcqeuqv,t3_eig4dl,t3_eig4dl,If they are all from outside then there is no trouble proving it... your argument is to impede an investigation and insinuate that the police are going to act counter to their duty and responsibilities just to “get back” at students bc they are Muslim. That is liberal arrogance and irresponsible in a democracy.,tomjerry94,,t2_59126jmv,/r/india/comments/eig4dl/anticaa_violence_jamia_millia_islamia_university/fcqeuqv/,1577884610,1,0
fcqev8n,t3_eii724,t3_eii724,No one knows which company is going to get the bid!,CloudPad,,t2_e4bp4,/r/india/comments/eii724/govt_lets_5g_waves_roll_asks_cos_to_submit_bids/fcqev8n/,1577884619,1,0
fcqeviw,t1_fcqesve,t3_eii5h7,I took this all the way from Jalukbari flyover,Chanzy94,,t2_zioji,/r/india/comments/eii5h7/i_see_your_blore_pune_and_goa_and_raise_you_my/fcqeviw/,1577884624,1,0
fcqew2k,t1_fcqeukz,t3_eidi5v,*Tu karta na h yeh*,Leburnum,,t2_553bgnmr,/r/india/comments/eidi5v/random_daily_discussion_thread_january_01_2020_at/fcqew2k/,1577884634,1,0
fcqexh3,t1_fcqdmpc,t3_eigs8n,"Thanks for the clarification. I have to say I still retain my stance that CAA makes sense with one exception which I will end with. Ask any secular liberal person in Afghanisan and Pakistan and they will say that hindus, and other minority groups do face persecution or prejudice. Hindu girls are kidnapped at exceedingly high rates in Pakistan. Sikhs face discrimination in Afghanistan. Just because it is a secular country does not mean you cannot give refugee status based on religion if that is the indicator of discrimination, which does exist. 

Using Sri Lanka as an example, a majority of the Refugees to countries like USA and Canada were tamil hindus and muslims. Very few Sinhalese and buddists were given refugee status to those countries, if they were it was on a case by case basis(Ex one of Edward Snowden's guardian angel was a sinhalese buddhist given asylum in Canada). 

If Bangladesh where the Rohingya has their roots and is the actual bordering nation to Burma are not willing to take them why should India?

Lastly, the contention and principle I agree with you on is Sri Lanka. Muslims in Sri Lanka are a persecuted minority with some having Indian origin so I do believe to be fair they should also be benificiaries of CAA.",chickenbis,,t2_5amgwwmc,/r/india/comments/eigs8n/modi_bjp_are_creating_a_climate_of_fear_in_india/fcqexh3/,1577884660,1,0
fcqey2p,t3_eii3ip,t3_eii3ip,Why did Saudi Arabia get occupied by Israel in Akkand Bharat plan?,pi3141592653589,,t2_gi7mk,/r/india/comments/eii3ip/super_power_2020_guys_some_sanghi_made_this/fcqey2p/,1577884671,1,0
fcqeykl,t1_fcqets0,t3_eidi5v,*bobs*,baburao87,,t2_5alimi4y,/r/india/comments/eidi5v/random_daily_discussion_thread_january_01_2020_at/fcqeykl/,1577884681,1,0
fcqeyoa,t3_eid66v,t3_eid66v,"Looks like there finally finished the silk board side of the metro. 
Looks like acche din

 /s",runway_bananacop,,t2_t6dm2,/r/india/comments/eid66v/hello_there_from_bangalore/fcqeyoa/,1577884682,1,0
fcqez30,t3_eih7oj,t3_eih7oj,Newslaundry,amnruti,jungle jungle baat chali h pata chala h,t2_54is9i5f,/r/india/comments/eih7oj/need_youtube_channel_recommendations_like/fcqez30/,1577884690,1,0
fcqf03l,t3_eifhqy,t3_eifhqy,Quora level cringe,Gurajada,,t2_5ags0a53,/r/india/comments/eifhqy/started_the_new_year_like_a_normie_mains_on_7th/fcqf03l/,1577884709,1,0
fcqf0qx,t1_fcqew2k,t3_eidi5v,mujhe toh sab aata hai karna.,baburao87,,t2_5alimi4y,/r/india/comments/eidi5v/random_daily_discussion_thread_january_01_2020_at/fcqf0qx/,1577884722,1,0
fcqf42f,t1_fcqastm,t3_eigzia,The world only looks away due to soft power (and military power against China in some future war on behalf of the West),sAK47,,t2_fvlx4,/r/india/comments/eigzia/do_we_owe_an_apology_to_kashmir/fcqf42f/,1577884784,1,0
fcqf4kb,t3_eid66v,t3_eid66v,This frontpaged and I feel like I must be missing out on the inside joke of a subcontinent of a billion people...,PensivePatriot,,t2_4baivlwb,/r/india/comments/eid66v/hello_there_from_bangalore/fcqf4kb/,1577884793,1,0
fcqf5gp,t1_fcqf0qx,t3_eidi5v,Bohut vadiya,Leburnum,,t2_553bgnmr,/r/india/comments/eidi5v/random_daily_discussion_thread_january_01_2020_at/fcqf5gp/,1577884810,1,0
fcqf63o,t1_fcqbfe2,t3_eigzia,"No, that's not the official position nor the people's perception - you can ask on Reddit",sAK47,,t2_fvlx4,/r/india/comments/eigzia/do_we_owe_an_apology_to_kashmir/fcqf63o/,1577884821,1,0
fcqf7i4,t1_fcqeoiw,t3_eigzia,"I don't look at everything as conspiracy, I simply ask questions about everything, then I my own research from ""all angles"" with an open mind, That's called learning new stuff or self-learning.",Neglectedsince1994,📢 Inquilab Zindabad! ,t2_11ya6ujn,/r/india/comments/eigzia/do_we_owe_an_apology_to_kashmir/fcqf7i4/,1577884847,1,0
fcqf7wn,t1_fcq58nz,t3_ei3q30,WTH!,snw2,,t2_fcwk2ev,/r/india/comments/ei3q30/entering_new_decade_like_a_true_loner_happy_new/fcqf7wn/,1577884854,1,0
fcqf7zc,t1_fcqdwoo,t3_eifhqy,first,alonelysaber,,t2_dzwtvex,/r/india/comments/eifhqy/started_the_new_year_like_a_normie_mains_on_7th/fcqf7zc/,1577884856,1,0
fcqfaun,t1_fcqee6o,t3_ei4vq6,"There's no technology trail , to identify the company / individuals running the botnet?",fmnatic,,t2_oiehglz,/r/india/comments/ei4vq6/twitterurbannazicom_report_you_have_been_waiting/fcqfaun/,1577884907,1,0
fcqfaw9,t1_fcqc8r0,t3_eifhqy,"huh. ""normal college""? dont tell me if you dont want to. just curious.",alonelysaber,,t2_dzwtvex,/r/india/comments/eifhqy/started_the_new_year_like_a_normie_mains_on_7th/fcqfaw9/,1577884908,1,0
fcqfek2,t1_fcpt6as,t3_eidi5v,Aur jo doodh giraya hai uska kya,deadsix6,wheatishfairboylookingrilindianvaluesnochowminjeansplisendnudsok,t2_oad7r,/r/india/comments/eidi5v/random_daily_discussion_thread_january_01_2020_at/fcqfek2/,1577884970,1,0
fcqfgae,t3_eiia3y,t3_eiia3y,Almost majority of the Muslim community ignore/slam Tawhidi as he himself spread misinformation and misinterpretation of Islamic teachings.,assphault8,,t2_41ucqt6g,/r/india/comments/eiia3y/what_are_your_opinions_on_tarek_fateh_and_imam/fcqfgae/,1577884996,1,0
fcqfgsk,t3_eihqj7,t3_eihqj7,I wish I understood Hindi. :/,op_pollicis,Universe,t2_yamw9,/r/india/comments/eihqj7/kanhaiya_kumar_giving_it_left_and_right/fcqfgsk/,1577885004,1,0
fcqfhrs,t1_fcqa3et,t3_eigs8n,Try reading http://urbannazi.com to get the context,in3po,"opinion is free, but facts are sacred",t2_13v7ya,/r/india/comments/eigs8n/modi_bjp_are_creating_a_climate_of_fear_in_india/fcqfhrs/,1577885018,1,0
fcqfi17,t1_fcqf5gp,t3_eidi5v,वाडिया वाडिया बधाइयां पटक्के,baburao87,,t2_5alimi4y,/r/india/comments/eidi5v/random_daily_discussion_thread_january_01_2020_at/fcqfi17/,1577885022,1,0
fcqfj88,t1_fcqfaw9,t3_eifhqy,I just said that cause you're probably never heard of it.. what do you wanna know specifically?,ab4328,,t2_xly81qd,/r/india/comments/eifhqy/started_the_new_year_like_a_normie_mains_on_7th/fcqfj88/,1577885036,1,0
fcqfjpt,t3_eidi5v,t3_eidi5v,bc Hardick ki engagement ho gayi 😡,kart678, Golu ,t2_1m6a2xql,/r/india/comments/eidi5v/random_daily_discussion_thread_january_01_2020_at/fcqfjpt/,1577885044,1,0
fcqfk17,t1_fcqdix7,t3_eidi5v,Nahi abhi bas *thik* bolke chali jayegi,Superbhatam,Free hugs :snoo_hug:,t2_59cam04e,/r/india/comments/eidi5v/random_daily_discussion_thread_january_01_2020_at/fcqfk17/,1577885049,1,0
fcqfk1j,t1_fcqfi17,t3_eidi5v,*blinks*,Leburnum,,t2_553bgnmr,/r/india/comments/eidi5v/random_daily_discussion_thread_january_01_2020_at/fcqfk1j/,1577885049,1,0
fcqfkul,t3_eif5xl,t3_eif5xl,"Sorry, what's the context? Is this related to India supposed to reach 5T by 2020?",pinkzepvana,,t2_71m1t9l,/r/india/comments/eif5xl/hello_from_goa_was_surprised_to_see_so_much/fcqfkul/,1577885063,1,0
fcqfofj,t3_eihz2n,t3_eihz2n,Bruh do you live in a village or something? Is this the first time you've come to the city?,Laninaconfusa,,t2_4q5vbahr,/r/india/comments/eihz2n/check_this_out_view_from_my_window_what_a_sight/fcqfofj/,1577885120,1,0
fcqfoyp,t1_fcqfk1j,t3_eidi5v,*misses meat scepter*,baburao87,,t2_5alimi4y,/r/india/comments/eidi5v/random_daily_discussion_thread_january_01_2020_at/fcqfoyp/,1577885129,1,0
fcqfrbb,t1_fcqfaun,t3_ei4vq6,No unfortunately. There is no API provided to know the IP etc. and I am pretty sure these companies would be careful.,onosmosis,,t2_1dcc61ox,/r/india/comments/ei4vq6/twitterurbannazicom_report_you_have_been_waiting/fcqfrbb/,1577885169,1,0
fcqfskh,t3_ehvvhv,t3_ehvvhv,"If any Yogi and Baba enter in politics for any designation, don't say them Yogi and Baba, learn with Chanakiya, he were just fight with a bad king, for protect the public from him... he were sit in chair of king but he never,   
because he was a real Sant, and there motive is just remove the bad King from there chair. But today there ideology used for just ruling on peoples.",Azqaadesigns,,t2_4wf6pril,/r/india/comments/ehvvhv/deccan_herald_speak_out_december_31st_2019/fcqfskh/,1577885186,1,0
fcqfsvj,t3_eifhqy,t3_eifhqy,"I already was feeling bad that i wasn't able to get any studying done today. Getting so distracted. This is making me  feel more pathetic. 

But keep going man. Good luck for JEE.",Asakasa1,,t2_2si8ld2a,/r/india/comments/eifhqy/started_the_new_year_like_a_normie_mains_on_7th/fcqfsvj/,1577885191,1,0
fcqft3k,t1_fcqdtpm,t3_eidi5v,"क्यूं दोस्त?

Edit /s",buntys-ancestor,there is no god,t2_4oo913yp,/r/india/comments/eidi5v/random_daily_discussion_thread_january_01_2020_at/fcqft3k/,1577885195,1,0
fcqfuux,t3_eiiah7,t3_eiiah7,"Sick! Infecting childern's innocent mind and soul with deviant lies.
"" Mad, mad world""",3X1573NZ,,t2_4zddez7c,/r/india/comments/eiiah7/4th_grade_social_science_textbook_of_central/fcqfuux/,1577885223,1,0
fcqfvlv,t3_eih615,t3_eih615,"“If we don’t, then we’ve done something wrong as a society.”

Yeah right... stop this pseudo sentimental capitalistic bull shit, and tell us how much of the revenue generated from the film is going to the victim/victims that have helped you make this film.

Secondly, your comment on is complete trash, especially, when we are in the midst of a crisis where an entire community is being sacrificed in the name of fascism and you can't utter a single word about it!

Where the f**k have your values as a society gone?",melvin_rajeev,,t2_zxldm,/r/india/comments/eih615/hope_we_wont_have_to_constantly_tell_stories_on/fcqfvlv/,1577885235,1,0
fcqfvwn,t1_fcqcf6s,t3_eidi5v,"*हमें तो प्यार के दो लफ्ज भी नसीब नहीं,*

*और बदनाम ऐसे हैं जैसे इश्क के बादशाह थे हम*",haggu_baby_bot,,t2_59upi71a,/r/india/comments/eidi5v/random_daily_discussion_thread_january_01_2020_at/fcqfvwn/,1577885239,1,0
fcqfvyy,t1_fcoq9uy,t3_ehyu79,I have patented it,meemboy,,t2_yk08r1v,/r/india/comments/ehyu79/bjp_it_cell_makes_a_typo_their_members_and_bots/fcqfvyy/,1577885240,1,0
fcqfw26,t1_fcqfoyp,t3_eidi5v,म द फ क,Leburnum,,t2_553bgnmr,/r/india/comments/eidi5v/random_daily_discussion_thread_january_01_2020_at/fcqfw26/,1577885242,1,0
fcqfw2d,t1_fcqfrbb,t3_ei4vq6,"Unless, someone creates a fake app to rig twitter polls and lure these accounts to sign up to that fake app, and then release the data.",onosmosis,,t2_1dcc61ox,/r/india/comments/ei4vq6/twitterurbannazicom_report_you_have_been_waiting/fcqfw2d/,1577885242,1,0
fcqfxav,t3_eihyxb,t3_eihyxb,"I like Sadhguru for his ability to explain things. I may not agree with him but he makes you think.

This one: was a planted question with a prepared answer. It still did not work which implies the issue is harder than Sadhguru's pay grade, with all due respect to him. 

It needs Modi in a planted ""aap ki adalat"" at the minimum, and if that is too much maybe maybe maybe Amit Shah but i am not sure that will go well.",MileSurMeraTumhara,,t2_5cg9qb6c,/r/india/comments/eihyxb/an_unenlightened_sadhguru_in_king_modis_court/fcqfxav/,1577885261,1,0
fcqfyep,t1_fcq8k7o,t3_eidi5v,(╯ ͝° ͜ʖ͡°)╯︵ ┻━┻,haggu_baby_bot,,t2_59upi71a,/r/india/comments/eidi5v/random_daily_discussion_thread_january_01_2020_at/fcqfyep/,1577885277,1,0
fcqfzjb,t1_fcqb6m8,t3_eidi5v,2016 was tough? Nah.,SexyBabua, UP se hain dost,t2_530nk3ax,/r/india/comments/eidi5v/random_daily_discussion_thread_january_01_2020_at/fcqfzjb/,1577885293,1,0
fcqg1or,t1_fcqfw26,t3_eidi5v,अह ओ ऊ आह,baburao87,,t2_5alimi4y,/r/india/comments/eidi5v/random_daily_discussion_thread_january_01_2020_at/fcqg1or/,1577885326,1,0
fcqg1st,t1_fcqf63o,t3_eigzia,"&gt;people's perception

It doesn't matter, It's the biggest myth that people's perception matters.

""It's pure business""",Neglectedsince1994,📢 Inquilab Zindabad! ,t2_11ya6ujn,/r/india/comments/eigzia/do_we_owe_an_apology_to_kashmir/fcqg1st/,1577885328,1,0
fcqg2nd,t1_fcq7dli,t3_eiemxs,"56% of India are represented by State CMs. Central government doesn't have all powers over states people. 
Members of Parliament are not equals to CM of state. MPs represent their own constituency which is only applicable in Lok Sabha. They are only useful in Parliament to vote Yes and No. That's it. Please learn some school level Civics.",Boochu_Ghochu,Ravish Kumar ka news Dekho. The Only real hope of media.,t2_58909h37,/r/india/comments/eiemxs/11_state_govts_representing_56_of_india_have_now/fcqg2nd/,1577885341,1,0
fcqg2o0,t1_fcq8jlb,t3_eidi5v,Aapki yoni me daalna hai?,SexyBabua, UP se hain dost,t2_530nk3ax,/r/india/comments/eidi5v/random_daily_discussion_thread_january_01_2020_at/fcqg2o0/,1577885341,1,0
fcqg31b,t3_eidi5v,t3_eidi5v,Fuck Bangalore,JPBabuaFromOttawa,Glad to Have a Functioning Brain,t2_4xe5mrbh,/r/india/comments/eidi5v/random_daily_discussion_thread_january_01_2020_at/fcqg31b/,1577885346,1,0
fcqg5rs,t1_fcqfk17,t3_eidi5v,Tu dekh. Ladki chappal fekegi Delhi se Bangalore,JPBabuaFromOttawa,Glad to Have a Functioning Brain,t2_4xe5mrbh,/r/india/comments/eidi5v/random_daily_discussion_thread_january_01_2020_at/fcqg5rs/,1577885387,1,0
fcqg6fz,t1_fcqg1or,t3_eidi5v,Kisne chod diya,Leburnum,,t2_553bgnmr,/r/india/comments/eidi5v/random_daily_discussion_thread_january_01_2020_at/fcqg6fz/,1577885396,1,0
fcqg6ls,t1_fcqg2o0,t3_eidi5v,Yesnt,JPBabuaFromOttawa,Glad to Have a Functioning Brain,t2_4xe5mrbh,/r/india/comments/eidi5v/random_daily_discussion_thread_january_01_2020_at/fcqg6ls/,1577885398,1,0
fcqg6nb,t1_fcqg31b,t3_eidi5v,Fuck you,buntys-ancestor,there is no god,t2_4oo913yp,/r/india/comments/eidi5v/random_daily_discussion_thread_january_01_2020_at/fcqg6nb/,1577885399,1,0
fcqg6rp,t1_fcqg31b,t3_eidi5v,+,SexyBabua, UP se hain dost,t2_530nk3ax,/r/india/comments/eidi5v/random_daily_discussion_thread_january_01_2020_at/fcqg6rp/,1577885401,1,0
fcqg6uz,t1_fcq9yvn,t3_eigqr8,"The CAA goes directly against our culture of secularism enshrined in the Constitution, the police response against JMIU &amp; AMU breaks the right of peaceful protests in the democracy promised by the Constitution. 

As such, the RSS-BJP government is directly attacking the Constitution and Indians are trying to protect it.",xuxebiko,quotes cheesy movie dialogues,t2_134h9i0v,/r/india/comments/eigqr8/meet_ccpsmangaluru_theyve_sent_a_bunch_of_notices/fcqg6uz/,1577885402,1,0
fcqg7wm,t1_fcqft3k,t3_eidi5v,"You don't believe in /s, do you?",Timur_tomb_opener,,t2_4xi7bttt,/r/india/comments/eidi5v/random_daily_discussion_thread_january_01_2020_at/fcqg7wm/,1577885417,1,0
fcqg8u1,t3_eiemdm,t3_eiemdm,"Reporting from Delhi, the whole city has been turned into a fridge. This is the greatest achievement of the Indian Government.",mohit_habeeb,,t2_9bxus,/r/india/comments/eiemdm/woke_up_to_a_magnificent_view_of_pune_city_behind/fcqg8u1/,1577885430,1,0
fcqg9xj,t1_fcqfzjb,t3_eidi5v,idk the chitrang muraliya one. or was it 2015?,baburao87,,t2_5alimi4y,/r/india/comments/eidi5v/random_daily_discussion_thread_january_01_2020_at/fcqg9xj/,1577885446,1,0
fcqgatx,t3_eiicbs,t3_eiicbs,Ab roj kar ke aata hoga!,CloudPad,,t2_e4bp4,/r/india/comments/eiicbs/hardik_pandya_and_natasha_stankovic_are_medias/fcqgatx/,1577885458,1,0
fcqgclu,t3_eihila,t3_eihila,How ?,sharma_ji_k_sasur,😤 aayegi to Mayawati he jo karna hai kar le 😤,t2_4wfb1n5w,/r/india/comments/eihila/best_reply_to_this_fascist_govt_nawazuddin_s/fcqgclu/,1577885483,1,0
fcqgdb8,t1_fcqg6fz,t3_eidi5v,dara singh ne,baburao87,,t2_5alimi4y,/r/india/comments/eidi5v/random_daily_discussion_thread_january_01_2020_at/fcqgdb8/,1577885492,1,0
fcqge1w,t3_eifhqy,t3_eifhqy,Get off the internet. Aise nahi hoga clear,1001tigers,🎬,t2_kvl03,/r/india/comments/eifhqy/started_the_new_year_like_a_normie_mains_on_7th/fcqge1w/,1577885503,1,0
fcqgebj,t1_fcqgdb8,t3_eidi5v,Enjaaayy,Leburnum,,t2_553bgnmr,/r/india/comments/eidi5v/random_daily_discussion_thread_january_01_2020_at/fcqgebj/,1577885507,1,0
fcqggr7,t1_fcqeap7,t3_eig8ri,Yeh Sahi bole dekho bhai hamare,travscifibeast,na⚔️ki dhar se na🔫ki bauchar se banda darta hai parwardigar se ,t2_77i4rjq,/r/india/comments/eig8ri/a_restaurant_in_hyderabad/fcqggr7/,1577885542,1,0
fcqggs0,t1_fcqgebj,t3_eidi5v,he doesn't have meat scepter,baburao87,,t2_5alimi4y,/r/india/comments/eidi5v/random_daily_discussion_thread_january_01_2020_at/fcqggs0/,1577885542,1,0
fcqggy1,t3_eihooo,t3_eihooo,"Doctors &amp; medical teams are allowed in warzones, but in Modi's Delhi?? Shame on Modi &amp; Shah who think that torturing people will shut them down.",xuxebiko,quotes cheesy movie dialogues,t2_134h9i0v,/r/india/comments/eihooo/how_the_police_prevented_medical_volunteers_from/fcqggy1/,1577885544,1,0
fcqghh1,t3_eii3ip,t3_eii3ip,The Nazi dream of Entire Europe which failed back in 1944. Their old stale rotten books are poisoning Sanghis mind with this failed bullshit dream. Lol.,Boochu_Ghochu,Ravish Kumar ka news Dekho. The Only real hope of media.,t2_58909h37,/r/india/comments/eii3ip/super_power_2020_guys_some_sanghi_made_this/fcqghh1/,1577885552,1,0
